"level";"id";"parent_id";"object_id";"object_type";"object_key";"query_status";"query_time";"query_type";"message";"created_time";"like_count";"comment_count";"error.message"
"1";"740";"1";"3060918930674700_3062092933890633";"data";"data.*";"fetched (200)";"2021-08-10 12:52:26.325626";"Facebook:/<post-id>/comments";"Uno de los componentes son células de abortos humanos. La verdadera pandemia es la del autismo!";"2020-11-19T01:58:17+0000";"0";"";""
"1";"741";"1";"3060918930674700_3062099503889976";"data";"data.*";"fetched (200)";"2021-08-10 12:52:26.325626";"Facebook:/<post-id>/comments";"¿Sabéis, tod@s? Antes de echar la lengua a paseo hay que meditar un poco. Gracias a gente que se suma a ensayos clínicos los demás podemos beneficiarnos de muchos tratamientos. Agradezco a quienes lo hayan hecho antes, sinceramente. Por cierto, estoy participando en un ensayo clínico de oncología, que dura tres años, y pretende ayudar a mujeres que, como yo, han pasado un cáncer de mama hormonodependiente, con su quimioterapia y su radioterapia. Si no os apetece ponéroslas llegado el caso, estáis en vuestro derecho. Pero avisad, que valen una pasta y se le pueden poner a otras personas. Y la mascarilla la llevo, claro, para proteger mi debilitado sistema inmune de mendrugos como algunos de los que están opinando en este foro. Ya está bien. ";"2020-11-19T02:00:58+0000";"62";"";""
"1";"742";"1";"3060918930674700_3062188813881045";"data";"data.*";"fetched (200)";"2021-08-10 12:52:26.325626";"Facebook:/<post-id>/comments";"Inma Picón Que alineada estás hija, no has leído mucho en tu vida ";"2020-11-19T02:54:00+0000";"0";"";""
"1";"743";"1";"3060918930674700_3062196653880261";"data";"data.*";"fetched (200)";"2021-08-10 12:52:26.325626";"Facebook:/<post-id>/comments";"Monica RF gracias por la explicación. Soy checo y de verdad agradezco correcciones. No fui a una escuela aquí pero aprendí como pude solo sin y sin nadie que me explique. Así que gracias porque me viene bien. Y si tienes razón estoy ventilao. ";"2020-11-19T02:58:47+0000";"2";"";""
"1";"744";"1";"3060918930674700_3062350997198160";"data";"data.*";"fetched (200)";"2021-08-10 12:52:26.325626";"Facebook:/<post-id>/comments";"Toni Garcia Reccess porque no se puede compartir tú comentario, que lo compartía volando. Toda la razón. Es lo que pensamos muchos";"2020-11-19T04:33:10+0000";"1";"";""
"1";"745";"1";"3060918930674700_3062368680529725";"data";"data.*";"fetched (200)";"2021-08-10 12:52:26.325626";"Facebook:/<post-id>/comments";"Tanto que china es un país muy rápido en estas cosas. Se supone que ya tenían vacuna, porque aún hay casos, y se protegen tanto. Va eso no hay quien se lo crea. Una vacuna para estás pandemias tardarían lo maximo 2 años. Y que pensáis que los políticos si se vacunan delante nuestra , va a ser la vacuna. No son tontos. Pero solo pido que si sale esa vacuna sea tan cierta como humanos en  el mundo";"2020-11-19T04:44:37+0000";"0";"";""
"1";"746";"1";"3060918930674700_3062371380529455";"data";"data.*";"fetched (200)";"2021-08-10 12:52:26.325626";"Facebook:/<post-id>/comments";"Que se pongan los que quieran y los que no,  que no se pongan al ultimo!!!   y dejen de jorobar..  No es ustedes primero y luego yo no te j... O te pones o te mueres,  asi de claro..";"2020-11-19T04:46:28+0000";"0";"";""
"1";"747";"1";"3060918930674700_3062377620528831";"data";"data.*";"fetched (200)";"2021-08-10 12:52:26.325626";"Facebook:/<post-id>/comments";"QUE HAGAN LOS ENSAYOS CON LOS HJDGP, DE LOS POLÍTICOS!!!!!";"2020-11-19T04:50:46+0000";"0";"";""
"1";"748";"1";"3060918930674700_3062382010528392";"data";"data.*";"fetched (200)";"2021-08-10 12:52:26.325626";"Facebook:/<post-id>/comments";"Los que piensan en bozal, en que estamos dormidos y todas esas tonterías sectarias, están invitados a firmar una renuncia al tratamiento si enferman de covid y a ir a chupar barandillas, pero lejos de los demás, quizás se haga limpia de manera selectiva";"2020-11-19T04:54:02+0000";"3";"";""
"1";"749";"1";"3060918930674700_3062387643861162";"data";"data.*";"fetched (200)";"2021-08-10 12:52:26.325626";"Facebook:/<post-id>/comments";"Que queremos?? La vacuna  Cuando la queremos?? Yaaaaa Ya casi está!!! Que se la pongan los políticos... RIDÍCULO 😂😂😂😂😂";"2020-11-19T04:57:28+0000";"0";"";""
"1";"750";"1";"3060918930674700_3062412910525302";"data";"data.*";"fetched (200)";"2021-08-10 12:52:26.325626";"Facebook:/<post-id>/comments";"Ponérosla vosotros primero, si os salváis sabremos que funciona y si os morís se salvará el país. Mucho ánimo a esos golfos que tenemos como políticos ";"2020-11-19T05:13:48+0000";"0";"";""
"1";"751";"1";"3060918930674700_3062414227191837";"data";"data.*";"fetched (200)";"2021-08-10 12:52:26.325626";"Facebook:/<post-id>/comments";"Inma Picón pues por que si se la ponen y sobreviven sabremos que funcionan y si se mueren se salvará el país ";"2020-11-19T05:14:43+0000";"0";"";""
"1";"752";"1";"3060918930674700_3062429300523663";"data";"data.*";"fetched (200)";"2021-08-10 12:52:26.325626";"Facebook:/<post-id>/comments";"QUE EMPIECEN POR LOS POLITICOS Y LA CASA REAL , ASI SUCESIBA MEMTE !!!";"2020-11-19T05:24:52+0000";"0";"";""
"1";"753";"1";"3060918930674700_3062441230522470";"data";"data.*";"fetched (200)";"2021-08-10 12:52:26.325626";"Facebook:/<post-id>/comments";"Que se la ponga senique pedro sanchez y el coleta los 1";"2020-11-19T05:33:02+0000";"0";"";""
"1";"754";"1";"3060918930674700_3062443450522248";"data";"data.*";"fetched (200)";"2021-08-10 12:52:26.325626";"Facebook:/<post-id>/comments";"Donde se.puede pedir.ser volontario para probar la.vacuna?";"2020-11-19T05:34:31+0000";"0";"";""
"1";"755";"1";"3060918930674700_3062444807188779";"data";"data.*";"fetched (200)";"2021-08-10 12:52:26.325626";"Facebook:/<post-id>/comments";"La cuestión es seguir llenándose los bolsillos los políticos que hasco me dais poneros las vacunas vosotros y vuestras familias yo no la quierooooooo";"2020-11-19T05:35:13+0000";"0";"";""
"1";"756";"1";"164716453628310_3060918930674700";"offcut";"";"fetched (200)";"2021-08-10 12:52:26.325626";"Facebook:/<post-id>/comments";"";"";"";"";""
"1";"757";"1";"164716453628310_3060918930674700";"headers";"";"fetched (200)";"2021-08-10 12:52:26.325626";"Facebook:/<post-id>/comments";"";"";"";"";""
"1";"758";"1";"3060918930674700_3062445027188757";"data";"data.*";"fetched (200)";"2021-08-10 12:52:26.705482";"Facebook:/<post-id>/comments";"NI DE COÑA ,ME PONDRÉ NINGUNA VACUNA NI AHORA NI NUNCA...";"2020-11-19T05:35:25+0000";"0";"";""
"1";"759";"1";"3060918930674700_3062445707188689";"data";"data.*";"fetched (200)";"2021-08-10 12:52:26.705482";"Facebook:/<post-id>/comments";"Esther López, lo que sobran son políticos corruptos y borregos. ";"2020-11-19T05:35:56+0000";"4";"";""
"1";"760";"1";"3060918930674700_3062446267188633";"data";"data.*";"fetched (200)";"2021-08-10 12:52:26.705482";"Facebook:/<post-id>/comments";"Brenda Andreoni ";"2020-11-19T05:36:16+0000";"0";"";""
"1";"761";"1";"3060918930674700_3062452317188028";"data";"data.*";"fetched (200)";"2021-08-10 12:52:26.705482";"Facebook:/<post-id>/comments";"Ana Moreno la que no se entera eres tu. Una vacuna hasta que no sea minimamente segura y con todos los controles de efectos secundarios y efectividad, pasan unos 5 años. Asi que, bonita, vete a plaza de tu pueblo o donde vivas a pronunciarte : ""viva el rey"". Y ahora vas y te la pones tu, a ver si te dan un cortocircuito las pocas neuronas que te deben de quedar.";"2020-11-19T05:40:33+0000";"1";"";""
"1";"762";"1";"3060918930674700_3062455630521030";"data";"data.*";"fetched (200)";"2021-08-10 12:52:26.705482";"Facebook:/<post-id>/comments";"Miriam Moreno García cuando por fin la vacuna este en el mercado y los políticos sean los primeros en ponersela también diremos"" miralos ellos son los primeros, es que sus vidas valen más que las de los demás..... no es justo.... nos están recortando nuestra libertad.. ect. ect. Ya parece que estoy viendo los ""borjamaris"" manifestándose subidos en sus coches de alta gama 😫😫😜😜😜";"2020-11-19T05:42:56+0000";"13";"";""
"1";"763";"1";"3060918930674700_3062465230520070";"data";"data.*";"fetched (200)";"2021-08-10 12:52:26.705482";"Facebook:/<post-id>/comments";"Estitxu HW estimada virologa doctora en coronavirus: Como ya le dije en el anterior post su ignorancia roza lo intolerante. Si supiera un POQUITO de ciencia sabría que en el 2005 ocurrió el primer salto (zoonosis) de un coronavirus al ser humano. Porque sí amiga mía el virus no lo han diseñado los científicos ya estaba en la naturaleza y desde ese año se lleva estudiando y diseñando estrategias para conseguir una vacuna efectiva. Si sabe restar eso son 15 años.  En este país hay años menos dos laboratorios del consejo superior de investigaciones científicas diseñando estrategias para conseguir una vacuna efectiva. Así que señora antes de escribir más memeces le sugiero información científica veraz. No le hablo de publicaciones en revistas serias ya que no creo que pudiera entenderlas (demasiado tecnicas) pero en YouTube existe un canal de ciencia divulgativa del CSIC donde hablan científicos serios y yo creo que con un par de horas diarias igual consigue escribir posts más científicamente válidos y no sandeces como las escritas por usted. Ahh!! Por cierto lamentablemente para usted yo si pongo mi formación en mi perfil no tengo nada que esconder si su hubiera molestado en mirarlo se habría dado cuenta que soy bióloga especializada en bioquímica y biología molecular trabajo en distintos laboratorios desde el 2002 y ahora mismo trabajo con bacterias de cuarentena. Así que sí se de lo que hablo. Un saludo";"2020-11-19T05:49:40+0000";"1";"";""
"1";"764";"1";"3060918930674700_3062469227186337";"data";"data.*";"fetched (200)";"2021-08-10 12:52:26.705482";"Facebook:/<post-id>/comments";"Yo no me la pondría ni, aunque funcionara debido a que el aislamiento social es mi forma de vivir desde antes de la pandemia.";"2020-11-19T05:52:15+0000";"0";"";""
"1";"765";"1";"3060918930674700_3062470247186235";"data";"data.*";"fetched (200)";"2021-08-10 12:52:26.705482";"Facebook:/<post-id>/comments";"Ana Moreno ni me entretengo a leer lo que me has puesto. Paso de tanta estupidez. Que te de el aire. ";"2020-11-19T05:52:58+0000";"0";"";""
"1";"766";"1";"3060918930674700_3062470947186165";"data";"data.*";"fetched (200)";"2021-08-10 12:52:26.705482";"Facebook:/<post-id>/comments";"Ana Amelia Escobero Rivas porque no todos los antivirales son efectivos para el mismo tipo de virus. Lo bueno que tienen los antivirales actuales es que son específicos no es lo mismo el del sida que el de la varicela. El problema es que este tipo de coronavirus es la primera vez que da el salto a humanos desde los animales. Hubi otros de la misma especie pero ninguno tan agresivo y mortal como este. Por eso hay dos vías de estudio la famosa vacuna y otra vía de estudio de medicamentos efectivos para bajar la mortalidad ";"2020-11-19T05:53:31+0000";"0";"";""
"1";"767";"1";"3060918930674700_3062472183852708";"data";"data.*";"fetched (200)";"2021-08-10 12:52:26.705482";"Facebook:/<post-id>/comments";"Miguel Jiménez mira guapo para nada gracias a Dios tengo un buen trabajo que además me gusta y disfruto con el cosa que no se si tu podrías decir";"2020-11-19T05:54:23+0000";"0";"";""
"1";"768";"1";"3060918930674700_3062473380519255";"data";"data.*";"fetched (200)";"2021-08-10 12:52:26.705482";"Facebook:/<post-id>/comments";"Miguel Jiménez te equivocas pero la verdad no me extrañan tus comentarios ya que no sabes de lo que hablas";"2020-11-19T05:55:15+0000";"0";"";""
"1";"769";"1";"3060918930674700_3062473783852548";"data";"data.*";"fetched (200)";"2021-08-10 12:52:26.705482";"Facebook:/<post-id>/comments";"Estitxu HW valiente ignorante";"2020-11-19T05:55:33+0000";"0";"";""
"1";"770";"1";"3060918930674700_3062475400519053";"data";"data.*";"fetched (200)";"2021-08-10 12:52:26.705482";"Facebook:/<post-id>/comments";"Lailo Portland  Tu sigue haciendo caso a lo que diga tu amado líder. Que por buen camino vas. ";"2020-11-19T05:56:38+0000";"3";"";""
"1";"771";"1";"3060918930674700_3062492050517388";"data";"data.*";"fetched (200)";"2021-08-10 12:52:26.705482";"Facebook:/<post-id>/comments";"Como salga  como  el cohete?";"2020-11-19T06:07:40+0000";"0";"";""
"1";"772";"1";"3060918930674700_3062492637183996";"data";"data.*";"fetched (200)";"2021-08-10 12:52:26.705482";"Facebook:/<post-id>/comments";"Ana Moreno por envidiosa... La mia te la cedo a ti.... Asi tenemos una mona más de laboratorio y dejamos a los animales vivir en su hábitat. 🤣🤣🤣🤣🤣";"2020-11-19T06:08:03+0000";"0";"";""
"1";"773";"1";"3060918930674700_3062493047183955";"data";"data.*";"fetched (200)";"2021-08-10 12:52:26.705482";"Facebook:/<post-id>/comments";"Cuidado no caiga por el borde.";"2020-11-19T06:08:21+0000";"2";"";""
"1";"774";"1";"3060918930674700_3062493253850601";"data";"data.*";"fetched (200)";"2021-08-10 12:52:26.705482";"Facebook:/<post-id>/comments";"🖕🖕🖕🖕🖕🖕🖕🖕🖕🖕🖕";"2020-11-19T06:08:29+0000";"0";"";""
"1";"775";"1";"3060918930674700_3062495663850360";"data";"data.*";"fetched (200)";"2021-08-10 12:52:26.705482";"Facebook:/<post-id>/comments";"Viendo la cantidad de terraplanistas rebuznando, una casi desearia que en lugar de tener la letalidad de un resfriado, la tuviese de una fiebre hemorágica.";"2020-11-19T06:10:17+0000";"0";"";""
"1";"776";"1";"3060918930674700_3062498630516730";"data";"data.*";"fetched (200)";"2021-08-10 12:52:26.705482";"Facebook:/<post-id>/comments";"ESPEREMOS   QUE  TODO  SALGA  BIEN. ÉS  NUESTRA   ÚNICA  ESPERANZA   DE   SALIRMOS  DE  ESTA  TERRIBLE   PESADILLA.";"2020-11-19T06:12:05+0000";"0";"";""
"1";"777";"1";"3060918930674700_3062500063849920";"data";"data.*";"fetched (200)";"2021-08-10 12:52:26.705482";"Facebook:/<post-id>/comments";"Jaime Javier Calo esperemoslo.";"2020-11-19T06:13:01+0000";"0";"";""
"1";"778";"1";"3060918930674700_3062500277183232";"data";"data.*";"fetched (200)";"2021-08-10 12:52:26.705482";"Facebook:/<post-id>/comments";"Estitxu HW envidiosa de tu ignorancia??. No gracias. Prefiero invertir en conocimiento.  Es más útil y ne hace decir menos gilipolleces ";"2020-11-19T06:13:10+0000";"1";"";""
"1";"779";"1";"3060918930674700_3062502210516372";"data";"data.*";"fetched (200)";"2021-08-10 12:52:26.705482";"Facebook:/<post-id>/comments";"Oleeeeeeee. Primero que pruebe todos los políticos.";"2020-11-19T06:14:27+0000";"0";"";""
"1";"780";"1";"3060918930674700_3062503620516231";"data";"data.*";"fetched (200)";"2021-08-10 12:52:26.705482";"Facebook:/<post-id>/comments";"Ponerse la vacuna ya el que quiera y dejad tranquilo al que no se la quiera poner 🤬🤬 Los vacunados por favor mantened la distancia de 5 metros, que os convertiréis en super contagiosos ";"2020-11-19T06:15:31+0000";"0";"";""
"1";"781";"1";"3060918930674700_3062511130515480";"data";"data.*";"fetched (200)";"2021-08-10 12:52:26.705482";"Facebook:/<post-id>/comments";"Laura Mampel Vidal y la seguridad social quien la paga, la mona de Tarzán??? 🐒🐒";"2020-11-19T06:20:08+0000";"1";"";""
"1";"782";"1";"3060918930674700_3062513797181880";"data";"data.*";"fetched (200)";"2021-08-10 12:52:26.705482";"Facebook:/<post-id>/comments";"Jaime Javier Calo yo también lo creo.";"2020-11-19T06:21:56+0000";"0";"";""
"1";"783";"1";"164716453628310_3060918930674700";"offcut";"";"fetched (200)";"2021-08-10 12:52:26.705482";"Facebook:/<post-id>/comments";"";"";"";"";""
"1";"784";"1";"164716453628310_3060918930674700";"headers";"";"fetched (200)";"2021-08-10 12:52:26.705482";"Facebook:/<post-id>/comments";"";"";"";"";""
"1";"785";"1";"3060918930674700_3062520763847850";"data";"data.*";"fetched (200)";"2021-08-10 12:52:27.286164";"Facebook:/<post-id>/comments";"Cuidado llegan los zombis!!!!!!!!!!!!!!!!";"2020-11-19T06:26:22+0000";"0";"";""
"1";"786";"1";"3060918930674700_3062520793847847";"data";"data.*";"fetched (200)";"2021-08-10 12:52:27.286164";"Facebook:/<post-id>/comments";"Esta noticia es la mejor desde hace mucho tiempo,  que venga ya animo a los expertos que la fabrican. ";"2020-11-19T06:26:24+0000";"10";"";""
"1";"787";"1";"3060918930674700_3062527207180539";"data";"data.*";"fetched (200)";"2021-08-10 12:52:27.286164";"Facebook:/<post-id>/comments";"No os preocupeis los antivacunas, no habrá para todos y los que no la querais no se os va a obligar a ponerla ya que habrá más gente dispuesta. No olvidemos que gracias a las vacunas se a aumentado la esperanza de vida de la población.";"2020-11-19T06:30:44+0000";"13";"";""
"1";"788";"1";"3060918930674700_3062529330513660";"data";"data.*";"fetched (200)";"2021-08-10 12:52:27.286164";"Facebook:/<post-id>/comments";"Esther López  respeto por la politca?🤣🤣🤣🤣🤣🤣🤣 A Santo de que hay que tener respeto a la política y sobre todo a los politicos y sobre todo a este gobierno ?  Grotesco resulta los que se creen a pies juntillas a estos psicópatas dictadores y sobre todo MENTROSOS COMPULSIVOS ( demostradisimo lo de las mentiras)  y los politicos están a nuestro servicio que se os olvida a los palmeros ";"2020-11-19T06:32:06+0000";"5";"";""
"1";"789";"1";"3060918930674700_3062530073846919";"data";"data.*";"fetched (200)";"2021-08-10 12:52:27.286164";"Facebook:/<post-id>/comments";"PONÉROSLA VOSOTROS, BANDA DE ESTAFADORES.";"2020-11-19T06:32:38+0000";"0";"";""
"1";"790";"1";"3060918930674700_3062537163846210";"data";"data.*";"fetched (200)";"2021-08-10 12:52:27.286164";"Facebook:/<post-id>/comments";"Miquel Vanrell es la selección natural moderna";"2020-11-19T06:37:30+0000";"2";"";""
"1";"791";"1";"3060918930674700_3062540490512544";"data";"data.*";"fetched (200)";"2021-08-10 12:52:27.286164";"Facebook:/<post-id>/comments";"Ana Moreno gracias por tu explicación. ";"2020-11-19T06:39:42+0000";"0";"";""
"1";"792";"1";"3060918930674700_3062541370512456";"data";"data.*";"fetched (200)";"2021-08-10 12:52:27.286164";"Facebook:/<post-id>/comments";"Que empieze con lo politicos ,hombre !";"2020-11-19T06:40:22+0000";"0";"";""
"1";"793";"1";"3060918930674700_3062542680512325";"data";"data.*";"fetched (200)";"2021-08-10 12:52:27.286164";"Facebook:/<post-id>/comments";"Miguel Jiménez no son formas de hablar. Te han enseñado a respetar? Yo no estoy de acuerdo con muchas cosas que leo pero no agredo verbalmente a nadie. Expon sin agredir porque todos queremos aprender";"2020-11-19T06:41:15+0000";"0";"";""
"1";"794";"1";"3060918930674700_3062542997178960";"data";"data.*";"fetched (200)";"2021-08-10 12:52:27.286164";"Facebook:/<post-id>/comments";"Brenda Andreoni no sè si tanta gente està despertando, me da a mí que no. Pero no hagas caso, cada vez que comento algo parecido a lo tuyo, me ponen de vuelta y media. No se dan cuenta de que tanta publicidad de las vacunas, tanta obsesión por ponerlas y tanta creación de miedo con una pandemia que no es tal, tiene un fin y no es precisamente nuestra salud. Son trillones y trillones de dinero, es un negocio por una parte, y por la otra diezmar población, y mantener enfermos crónicos con otras patologías, nunca atribuídsas a la vacuna. Como dice el slogan de las farmacéuticas: "" paciente curado, cliente perdido"". ";"2020-11-19T06:41:26+0000";"27";"";""
"1";"795";"1";"3060918930674700_3062544010512192";"data";"data.*";"fetched (200)";"2021-08-10 12:52:27.286164";"Facebook:/<post-id>/comments";"Es la vais a pinchar vosotros primero, políticos y jefes de farmacéuticas para demostrar su eficacia. Y no nosotros el pueblo de quien vivís y coméis cada mes.  Que no somos conejillos de indias";"2020-11-19T06:42:07+0000";"77";"";""
"1";"796";"1";"3060918930674700_3062546907178569";"data";"data.*";"fetched (200)";"2021-08-10 12:52:27.286164";"Facebook:/<post-id>/comments";"se nota que se preocupan por vuestra salud, ahí os tienen todos los estancos abiertos cuando hasta una peluqueria tiene que cerrar jjajajaja";"2020-11-19T06:44:02+0000";"0";"";""
"1";"797";"1";"3060918930674700_3062547740511819";"data";"data.*";"fetched (200)";"2021-08-10 12:52:27.286164";"Facebook:/<post-id>/comments";"Esther López falta mucho sentido común, aquí y en todo el mundo. Estamos llenos de falsedad, superchería y postureo y dejamos el respeto, el sentido común y a la ciencia, a un lado. Todo un siglo de ilustración se ha desvanecido de la historia. Involución hacia la estulticia. Espero que obtengan magníficos resultados del estudio clínico en el que participas y que pronto todas las mujeres se beneficien de ello. Gracias por poner tu valiente grano de arena. Un saludo.";"2020-11-19T06:44:43+0000";"8";"";""
"1";"798";"1";"3060918930674700_3062550663844860";"data";"data.*";"fetched (200)";"2021-08-10 12:52:27.286164";"Facebook:/<post-id>/comments";"respeto por la política!!! Jajaja pero esto es el grupo de chistes o me he equivocado????";"2020-11-19T06:46:46+0000";"2";"";""
"1";"799";"1";"3060918930674700_3062552453844681";"data";"data.*";"fetched (200)";"2021-08-10 12:52:27.286164";"Facebook:/<post-id>/comments";"Joseba Ot Mi perdona? Me estás diciendo que no me quiero vacunar? Pero si estoy diciendo todo lo contrario. O una de dos: este mensaje iba destinado a otro y me has etiquetado por equivocación o no has entendido nada de nada de lo que he dicho en los comentarios anteriores.";"2020-11-19T06:47:49+0000";"0";"";""
"1";"800";"1";"3060918930674700_3062557303844196";"data";"data.*";"fetched (200)";"2021-08-10 12:52:27.286164";"Facebook:/<post-id>/comments";"Un paso al frente. Hay 450,000 políticos, empecemos con ellos, todos son voluntarios";"2020-11-19T06:51:04+0000";"0";"";""
"1";"801";"1";"3060918930674700_3062561757177084";"data";"data.*";"fetched (200)";"2021-08-10 12:52:27.286164";"Facebook:/<post-id>/comments";"Que me esperen sentao";"2020-11-19T06:53:33+0000";"0";"";""
"1";"802";"1";"3060918930674700_3062564670510126";"data";"data.*";"fetched (200)";"2021-08-10 12:52:27.286164";"Facebook:/<post-id>/comments";"I la gripe  k passa k este anyo no a matodo a nadie. Todo es covit jajajjajajajajjaja algo raro ai";"2020-11-19T06:55:09+0000";"0";"";""
"1";"803";"1";"3060918930674700_3062565240510069";"data";"data.*";"fetched (200)";"2021-08-10 12:52:27.286164";"Facebook:/<post-id>/comments";"Una buena noticia";"2020-11-19T06:55:13+0000";"0";"";""
"1";"804";"1";"3060918930674700_3062566127176647";"data";"data.*";"fetched (200)";"2021-08-10 12:52:27.286164";"Facebook:/<post-id>/comments";"Aver quien son los 30,000 tontos y tintas que se prestan voluntarios... puta plandemia, pite orden mundial no se pueden salir con la suya! A Pedro Sánchez y al coletas se la ponía yo, pero por la raja de l pito..";"2020-11-19T06:55:37+0000";"0";"";""
"1";"805";"1";"3060918930674700_3062566997176560";"data";"data.*";"fetched (200)";"2021-08-10 12:52:27.286164";"Facebook:/<post-id>/comments";"Y Facebook te prestas para anunciar esto verdad? Siempre face miembro del estado profundo";"2020-11-19T06:55:59+0000";"0";"";""
"1";"806";"1";"3060918930674700_3062567370509856";"data";"data.*";"fetched (200)";"2021-08-10 12:52:27.286164";"Facebook:/<post-id>/comments";"Os la poneis vosotros en los huevos y si va bien nos vacunamos nosotros";"2020-11-19T06:56:16+0000";"0";"";""
"1";"807";"1";"3060918930674700_3062568413843085";"data";"data.*";"fetched (200)";"2021-08-10 12:52:27.286164";"Facebook:/<post-id>/comments";"Que practiquen con los políticos";"2020-11-19T06:57:00+0000";"0";"";""
"1";"808";"1";"3060918930674700_3062570150509578";"data";"data.*";"fetched (200)";"2021-08-10 12:52:27.286164";"Facebook:/<post-id>/comments";"Primer ensayo en los políticos ";"2020-11-19T06:58:12+0000";"0";"";""
"1";"809";"1";"3060918930674700_3062574317175828";"data";"data.*";"fetched (200)";"2021-08-10 12:52:27.286164";"Facebook:/<post-id>/comments";"La vacuna es voluntaria. Pero si te hicieran ir por la calle con un certificado de tenerla puesta para poder moverte he ir sin mascarilla y el que no la tenga puesta confinadito en casa y con mascarilla, restricciones. Etc. verás como dejan de pensar que es un engaño y corren a ponérsela! ";"2020-11-19T07:00:51+0000";"11";"";""
"1";"810";"1";"164716453628310_3060918930674700";"offcut";"";"fetched (200)";"2021-08-10 12:52:27.286164";"Facebook:/<post-id>/comments";"";"";"";"";""
"1";"811";"1";"164716453628310_3060918930674700";"headers";"";"fetched (200)";"2021-08-10 12:52:27.286164";"Facebook:/<post-id>/comments";"";"";"";"";""
"1";"812";"1";"3060918930674700_3062574487175811";"data";"data.*";"fetched (200)";"2021-08-10 12:52:27.923799";"Facebook:/<post-id>/comments";"Todassss para vosotro, si  no nos atendemos como es debido cualquiera se fía";"2020-11-19T07:00:57+0000";"0";"";""
"1";"813";"1";"3060918930674700_3062576130508980";"data";"data.*";"fetched (200)";"2021-08-10 12:52:27.923799";"Facebook:/<post-id>/comments";"Brenda Andreoni te invito a que te vayas voluntaria a un hospital a zona covid , pero por supuesto sin protección,a ver si hay huevos ";"2020-11-19T07:02:00+0000";"12";"";""
"1";"814";"1";"3060918930674700_3062577770508816";"data";"data.*";"fetched (200)";"2021-08-10 12:52:27.923799";"Facebook:/<post-id>/comments";"Si mueres durante este ensayo ni el gobierno ni las farmacéuticas serán responsables, se lavan las manos.";"2020-11-19T07:03:06+0000";"0";"";""
