"level";"id";"parent_id";"object_id";"object_type";"object_key";"query_status";"query_time";"query_type";"message";"created_time";"like_count";"comment_count";"error.message"
"0";"1";"None";"164716453628310_3060918930674700";"seed";"";"";"None";"None";"";"";"";"";""
"1";"2";"1";"3060918930674700_3060923540674239";"data";"data.*";"fetched (200)";"2021-08-10 12:52:12.634779";"Facebook:/<post-id>/comments";"Como el cohete español";"2020-11-18T15:16:58+0000";"1";"";""
"1";"3";"1";"3060918930674700_3060926184007308";"data";"data.*";"fetched (200)";"2021-08-10 12:52:12.634779";"Facebook:/<post-id>/comments";"";"2020-11-18T15:18:25+0000";"0";"";""
"1";"4";"1";"3060918930674700_3060930270673566";"data";"data.*";"fetched (200)";"2021-08-10 12:52:12.634779";"Facebook:/<post-id>/comments";"Seguro que hay plaza para vosotros 🤣🤣🐑🐑, vais a ir alguno del gobierno? 🤐😎😎🤣🤣🤣";"2020-11-18T15:20:04+0000";"1";"";""
"1";"5";"1";"3060918930674700_3060934934006433";"data";"data.*";"fetched (200)";"2021-08-10 12:52:12.634779";"Facebook:/<post-id>/comments";"Estupendo Pero... Q esta pasando con vacuna de la  gripe en tres ocasiones he ido a ponermela y para rango de edad de menos de 65 aňos no hay. Vivo en Madrid";"2020-11-18T15:21:38+0000";"2";"";""
"1";"6";"1";"3060918930674700_3060935407339719";"data";"data.*";"fetched (200)";"2021-08-10 12:52:12.634779";"Facebook:/<post-id>/comments";"Buenas tardes. Comentar que hace años se valoró que el efecto de las vacunas no es tan inocuo como parece y que era posible que por deseo de ganar dinero se acorte la esperanza de vida en las personas. Alguien quiso indicar que era labor de los criminólogos el impedir los pedidos, y es una posibilidad aunque la responsabilidad suele ser del que realiza los pedidos y puede tener consecuencias criminales. Aviso que no cotizo. Saludos. ";"2020-11-18T15:21:51+0000";"5";"";""
"1";"7";"1";"3060918930674700_3060939864005940";"data";"data.*";"fetched (200)";"2021-08-10 12:52:12.634779";"Facebook:/<post-id>/comments";"Que se la pongan los del Congreso y Senado y que no se olviden de Fernando Simón...";"2020-11-18T15:24:05+0000";"107";"";""
"1";"8";"1";"3060918930674700_3060944494005477";"data";"data.*";"fetched (200)";"2021-08-10 12:52:12.634779";"Facebook:/<post-id>/comments";"May Srn yo soy grupo de riesgo por embarazo y según mi matrona, este año se ha vacunado más gente que nunca en la vida... Los familiares de grupos de riesgo han aprovechado las citas de ellos para vacunarse en vez de esperar su turno que es en Diciembre y nos hemos quedado los que más la necesitamos a dos velas ...";"2020-11-18T15:26:12+0000";"4";"";""
"1";"9";"1";"3060918930674700_3060945540672039";"data";"data.*";"fetched (200)";"2021-08-10 12:52:12.634779";"Facebook:/<post-id>/comments";"May Srn yo vivo enel pais Vasco y sean vacunado asta chicos de 17 años aqui tellaman acasa y tedicen sí quieres ponertela y tu decides";"2020-11-18T15:26:41+0000";"1";"";""
"1";"10";"1";"3060918930674700_3060950154004911";"data";"data.*";"fetched (200)";"2021-08-10 12:52:12.634779";"Facebook:/<post-id>/comments";"";"2020-11-18T15:28:57+0000";"0";"";""
"1";"11";"1";"3060918930674700_3060950404004886";"data";"data.*";"fetched (200)";"2021-08-10 12:52:12.634779";"Facebook:/<post-id>/comments";"Como sean como los epis que compraron los amigos del gobierno al principio de la pandemia... Que se la pongan ellos.";"2020-11-18T15:29:06+0000";"4";"";""
"1";"12";"1";"3060918930674700_3060953444004582";"data";"data.*";"fetched (200)";"2021-08-10 12:52:12.634779";"Facebook:/<post-id>/comments";"Buena noticia!";"2020-11-18T15:30:34+0000";"2";"";""
"1";"13";"1";"3060918930674700_3060953827337877";"data";"data.*";"fetched (200)";"2021-08-10 12:52:12.634779";"Facebook:/<post-id>/comments";"Susana Ruiz Verdejo pues mal hecho por esos familiares y por el profesional que se las administra sin tener cita para ello";"2020-11-18T15:30:48+0000";"1";"";""
"1";"14";"1";"3060918930674700_3060953950671198";"data";"data.*";"fetched (200)";"2021-08-10 12:52:12.634779";"Facebook:/<post-id>/comments";"";"2020-11-18T15:30:52+0000";"0";"";""
"1";"15";"1";"3060918930674700_3060955464004380";"data";"data.*";"fetched (200)";"2021-08-10 12:52:12.634779";"Facebook:/<post-id>/comments";"Los políticos primero, tienen que dar ejemplo, todo por su país.";"2020-11-18T15:31:38+0000";"12";"";""
"1";"16";"1";"3060918930674700_3060990410667552";"data";"data.*";"fetched (200)";"2021-08-10 12:52:12.634779";"Facebook:/<post-id>/comments";"Primero Pedro Sanchez";"2020-11-18T15:38:25+0000";"7";"";""
"1";"17";"1";"3060918930674700_3061000230666570";"data";"data.*";"fetched (200)";"2021-08-10 12:52:12.634779";"Facebook:/<post-id>/comments";"Probar con el filósofo y con el no doctor simon";"2020-11-18T15:40:58+0000";"15";"";""
"1";"18";"1";"3060918930674700_3061000820666511";"data";"data.*";"fetched (200)";"2021-08-10 12:52:12.634779";"Facebook:/<post-id>/comments";"En mi caso, al convivir con personas de riesgo, me dieron cita y me pudieron la vacuna hace una semana";"2020-11-18T15:41:11+0000";"0";"";""
"1";"19";"1";"3060918930674700_3061001900666403";"data";"data.*";"fetched (200)";"2021-08-10 12:52:12.634779";"Facebook:/<post-id>/comments";"😱😂😂";"2020-11-18T15:41:44+0000";"0";"";""
"1";"20";"1";"3060918930674700_3061003413999585";"data";"data.*";"fetched (200)";"2021-08-10 12:52:12.634779";"Facebook:/<post-id>/comments";"Miguel Miguel Paredes eso eso";"2020-11-18T15:42:35+0000";"1";"";""
"1";"21";"1";"3060918930674700_3061013487331911";"data";"data.*";"fetched (200)";"2021-08-10 12:52:12.634779";"Facebook:/<post-id>/comments";"Primero pedro sanchez y su coleguita pablito y el congreso y luego ya veremos si es efectiva o no";"2020-11-18T15:47:42+0000";"12";"";""
"1";"22";"1";"3060918930674700_3061014657331794";"data";"data.*";"fetched (200)";"2021-08-10 12:52:12.634779";"Facebook:/<post-id>/comments";"La vacuna es otro virus no la pongais";"2020-11-18T15:48:20+0000";"8";"";""
"1";"23";"1";"3060918930674700_3061015890665004";"data";"data.*";"fetched (200)";"2021-08-10 12:52:12.634779";"Facebook:/<post-id>/comments";"Y la Realeza?";"2020-11-18T15:48:53+0000";"7";"";""
"1";"24";"1";"3060918930674700_3061016087331651";"data";"data.*";"fetched (200)";"2021-08-10 12:52:12.634779";"Facebook:/<post-id>/comments";"Qué se la ponga Sánchez ";"2020-11-18T15:48:58+0000";"4";"";""
"1";"25";"1";"3060918930674700_3061017830664810";"data";"data.*";"fetched (200)";"2021-08-10 12:52:12.634779";"Facebook:/<post-id>/comments";"Que paso con el IVA de las mascarillas higiénicas y FFP2?";"2020-11-18T15:49:46+0000";"0";"";""
"1";"26";"1";"3060918930674700_3061020723997854";"data";"data.*";"fetched (200)";"2021-08-10 12:52:12.634779";"Facebook:/<post-id>/comments";"Es la primera vez en la historia de la humanidad que se produce una vacuna para humanos de ARN MENSAJERO, nunca antes probada, sin el tiempo que se requiere para ver sus efectos secundarios a largo plazo que me parece estupido la intencion de inocularla. Una vacuna que no vamos a saber lo que lleva y que han hecho una Ley para blindar a los laboratorios que la producen, si tienes efectos secundarios se apaña la seguridad social y pa’ eso está ultimamente!!!!!. Esto huele mal, muy mal. Ademas por que hacer una vacuna obligatoria cuando mata igual o menos gente que la gripe, que hay aqui que no nos cuentan?. ";"2020-11-18T15:51:05+0000";"103";"";""
"1";"27";"1";"164716453628310_3060918930674700";"offcut";"";"fetched (200)";"2021-08-10 12:52:12.634779";"Facebook:/<post-id>/comments";"";"";"";"";""
"1";"28";"1";"164716453628310_3060918930674700";"headers";"";"fetched (200)";"2021-08-10 12:52:12.634779";"Facebook:/<post-id>/comments";"";"";"";"";""
"1";"29";"1";"3060918930674700_3061023117330948";"data";"data.*";"fetched (200)";"2021-08-10 12:52:13.077545";"Facebook:/<post-id>/comments";"Que se la pongan todos los políticos, empezando por el presidente y el vicepresidente y todos los demás sean del partido que sean .Pero que lo hagan en directo para que todos los veamos.";"2020-11-18T15:52:28+0000";"19";"";""
"1";"30";"1";"3060918930674700_3061026283997298";"data";"data.*";"fetched (200)";"2021-08-10 12:52:13.077545";"Facebook:/<post-id>/comments";"";"2020-11-18T15:54:13+0000";"0";"";""
"1";"31";"1";"3060918930674700_3061027253997201";"data";"data.*";"fetched (200)";"2021-08-10 12:52:13.077545";"Facebook:/<post-id>/comments";"To Lin eso eso que empiecen por el Congreso y el Senado ";"2020-11-18T15:54:37+0000";"7";"";""
"1";"32";"1";"3060918930674700_3061027870663806";"data";"data.*";"fetched (200)";"2021-08-10 12:52:13.077545";"Facebook:/<post-id>/comments";"aconsejamos y deseamos que Los dirigientes de Amps, el ministro, el govierno todo aprovechen...";"2020-11-18T15:54:57+0000";"1";"";""
"1";"33";"1";"3060918930674700_3061030923996834";"data";"data.*";"fetched (200)";"2021-08-10 12:52:13.077545";"Facebook:/<post-id>/comments";"Comenzó la fase 2 del estado profundo... 🤢🤮";"2020-11-18T15:56:19+0000";"4";"";""
"1";"34";"1";"3060918930674700_3061032107330049";"data";"data.*";"fetched (200)";"2021-08-10 12:52:13.077545";"Facebook:/<post-id>/comments";"Miedito me da.....";"2020-11-18T15:57:01+0000";"2";"";""
"1";"35";"1";"3060918930674700_3061036343996292";"data";"data.*";"fetched (200)";"2021-08-10 12:52:13.077545";"Facebook:/<post-id>/comments";"Que se lo pongan primeros los políticos ,se funciona bien ,para ellos ,se no funciona ,bien para nosotros ......";"2020-11-18T15:58:58+0000";"7";"";""
"1";"36";"1";"3060918930674700_3061044227328837";"data";"data.*";"fetched (200)";"2021-08-10 12:52:13.077545";"Facebook:/<post-id>/comments";"Estaría interesado en ser voluntario si fuese posible .. donde podría informarme ??";"2020-11-18T16:02:40+0000";"9";"";""
"1";"37";"1";"3060918930674700_3061046810661912";"data";"data.*";"fetched (200)";"2021-08-10 12:52:13.077545";"Facebook:/<post-id>/comments";"Que pesados todos con lo de que se la pongan los políticos, que se la ponga quien se la tenga que poner y punto, llevamos casi 1 año esperando vacuna y ahora nadie quiere, cualquiera os entiende!!??";"2020-11-18T16:03:58+0000";"32";"";""
"1";"38";"1";"3060918930674700_3061046930661900";"data";"data.*";"fetched (200)";"2021-08-10 12:52:13.077545";"Facebook:/<post-id>/comments";"Y que haya gente que se ofrece. Al virus si le tienen miedo, a inyectarse a saber qué, no.";"2020-11-18T16:04:02+0000";"21";"";""
"1";"39";"1";"3060918930674700_3061049053995021";"data";"data.*";"fetched (200)";"2021-08-10 12:52:13.077545";"Facebook:/<post-id>/comments";"rvutiiho; . . . . . . . . todas las vacunas que estáis proclamando padecen de la ignorancia, querida, de la -esencia de la investigación científica rvutiihoista- que soluciona el actual desastre social, entonces todas las vacunas que estáis proclamando deficientes son y no pueden alcanzar la seguridad total; . . . . . . . . si la mentira os dejaría ustedes mentirías más que la mentira; no es verdad que no hay nadie, como descaradamente dice el enésimo incapaz presidente de la junta de andalucía, que pueda saber cuando termina la pandemia, yo, rvutiiho (antonio bosco), como ya llevo diciendo desde que empezó la pandemia, puedo hacer conseguir la verdadera vacuna a covid19 en horas entonces el tiempo que se tardaría en terminar con la pandemia sería el tiempo que necesitáis en preparar la vacuna y suministrarla pero ustedes os apoyáis en los falsos expertos y en las falsas expertas que ustedes usáis, los mismos expertos y las mismas expertas que provocan el actual desastre social, y hacéis ustedes que se forren a costa no solamente de, ""los andaluces"", como el enésimo incapaz presidente de la junta de andalucía machisticamente cita y proclama en sus ridículas citaciones, también a costa de las andaluces y de quien en andalucía y en el resto de españa vive y paga impuestos como yo, ridículas citaciones con abuso de poder, para intentar llevarse el mérito de una imposible solución al actual desastre social dado que el remedio que usáis es la oficial obsoleta global investigación; hay unas solicitudes, por mi presentadas: en la junta de andalucía , en los ayuntamientos de: sevilla, malaga, jerez de la frontera (cádiz), cádiz, ronda (malaga), ubrique (cádiz), vélez malaga (malaga), villamartin (cádiz), jerez de la frontera (cádiz) y arco de la fronteras (cádiz) y en las universidades de sevilla, malaga y cádiz que habéis encajonados o peor todavía ocultadas, donde pido que se me reciba para explicar el -proyecto científico rvutiihoista de ejecución de actividades originales equilibradas mentalmente y equilibradas físicamente- que soluciona el actual desastre social entonces también soluciona la pandemia  entonces también por vuestra culpa, ayudados y ayudadas por los ayuntamientos de: sevilla, malaga, jerez de la frontera (cádiz), cádiz, ronda (malaga), ubrique (cádiz), vélaz malaga (malaga), villamartin (cádiz), jerez de la frontera (cádiz) y arco de la fronteras (cádiz) y por las universidades de: sevilla, malaga y cádiz, ya van 41668 muertes en españa; . . . . . . . la verdadera vacuna a covid19 estaba y sigue cerca desde febrero de 2020 pero el actual presidente del partido popular, con el uso de la oficial obsoleta global política junto con quien a él se contrapone oficialmente obsoletamente y globalmente con la idea de mantener los inmerecidos cargos que concede quien viviendo de bulto social con derecho a votar, claro, permite y por respaldar a la sirvienta del partido popular, la alcaldesa de prado del rey (cádiz) que con abuso de poder rechaza, por antojo, el - proyecto científico rvutiihoista de ejecución de actividades originales equilibradas mentalmente y equilibradas fisicamente- que soluciona el actual desastre social, suman ya 41668 muertes; ustedes quitáis: serenidad, confianza y cautela, descaradamente claro, mientras respaldáis ustedes, descaradamente, la sirvienta del partido popular, la alcaldesa de prado del rey (cádiz) que con el rechazo antojoso que me dirige hace de principal responsable del actual desastre social; las ridículas recomendaciones que ustedes hacéis, terminan estupidizando aún más a la gente que de bulto social vive con derecho a votar, claro, con la falsa oficial obsoleta global política basada en la ignorancia querida de la -esencia de la consciencia de la esencia del ser científica rvutiihoista-  que demuestra como ustedes hacéis de incapaces gobernando, donde podéis, por idolatrar la oficial obsoleta global gobernanza mientras rechazáis, por ignorancia querida, la - esencia de la gobernanza científica rvutiihoista- que soluciona el actual desastre social; ; . . . . . . . . soy rvutiiho (antonio bosco) y hago el investigador científico; oficialmente, desde septiembre de 2017 en el ayuntamiento del pueblo de prado del rey (cádiz) y en varios organismos públicos y privados del estado español, [consecuencia del rechazo antojoso por parte de la sirvienta del partido popular maría vanesa beltran morales del montón de las maría vanesa beltran morales, como quien le gobierna quiere que ella sea y ella, sumisamente, se deja, concejala y ahora alcaldesa del pueblo de prado del rey (cádiz) que mantiene amordazada la enésima incapaz corporación municipal y de quién parecida estupidez padece, que ustedes respaldáis con oficiales obsoletas leyes y con elecciones políticas basadas en la oficial obsoleta global política], estoy presentando el - proyecto científico rvutiihoista  de ejecución de actividades originales equilibradas mentalmente y equilibradas físicamente  - que soluciona el desastre social que la oficial obsoleta global cultura, que proclamáis, provoca, mantiene y hace practicar a quien se deja, con la ayuda de quién como bulto social vive y vota; covid19 se hubiera podido evitar porqué como en china copian a occidente vistiéndose de chaqueta y corbata o ensuciándose con maquillaje acompañado de moniles para acojonar y tapar verdades, como hacéis ustedes, con quien se deja, también hubieran podido usar el - proyecto científico rvutiihoista de ejecución de actividades originales equilibradas mentalmente y equilibradas físicamente- para prevenir en lugar ahora intentar curar; el estado de alarma es solamente una mísera consecuencia del rechazo antojoso que me dirigís rechazo que ahora estáis obligados y obligadas a usar entre ustedes a menos de antojosos centímetros de distancia establecida a través de la oficial obsoleta global investigación; el estado de alarma termina cuando covid19 lo decide dado el uso que hacéis de la oficial obsoleta global investigación considerada por ustedes presumidamente científica; ustedes me excluyen de la unidad, ustedes me dejan atrás entonces estáis descaradamente atrasando y retrasando el conseguimiento del descubrimiento de la verdadera vacuna a covid19 ya mientras la oficial obsoleta global investigación considerada por ustedes presumidamente científica se entretiene con míseros paliativos que proponen pero dado que covid19 vuelve a cargar ya estáis buscando antiguas excusas para justificar el horroroso fracaso social que toma poquito a poco otra vez protagonismo; si sabéis ustedes por dónde empezar demostráis que me equivoco; rvutiiho (antonio bosco) ";"2020-11-18T16:05:05+0000";"0";"";""
"1";"40";"1";"3060918930674700_3061049357328324";"data";"data.*";"fetched (200)";"2021-08-10 12:52:13.077545";"Facebook:/<post-id>/comments";"Sr Ministro: muy bien la nueva ley de control de ingreso al país con los PCR.  Pero, las familias que viajamos los días posteriores a los festivos (24/25 o 31/1 por ejemplo) NO PODEMOS hacernos las pruebas 72 hs antes ya que las clinicas ( en Uk por ejemplo) NO trabajan porque es festivo.  Entonces ¿ cuál seria la solución?  Poder hacernos la PCR en el aeropuerto de España. Sin embargo la ley ( BOE) dice que ademas seremos MULTADOS!!  ¿Por qué nos multarán, si no es posible encontrar ningun sitio para hacernos la prueba??  Y si recurro a Ud. es porque despues de sendos mails a los Ministerios de Sanidad y del Interior, ninguno ha sabido responderme, más que copiar el BOE, que me sé de memoria.  Ruego que en vista de las Fiestas, revise usted este punto y pueda solucionar este punto, que no se ha tenido en cuenta al momento de redactar la ley.  Muchas gracias de antemano ";"2020-11-18T16:05:16+0000";"7";"";""
"1";"41";"1";"3060918930674700_3061049983994928";"data";"data.*";"fetched (200)";"2021-08-10 12:52:13.077545";"Facebook:/<post-id>/comments";"Así es, lo dice bien claro, EMERGENCIA SANITARIA DEBEMOS DE TENER AGUA ,PORQUE ES UNA CUESTIÓN DE SALUD PÚBLICA! PARA GARANTIZARLA Y PARAR ESTA PANDEMIA. En Toledo, el Casar de Escalona, urb Cerro Alberche no tenemos agua, nos enfrentamos a un virus sin armaduras, ni aceso peatonal hasta el pueblo 3 kilómetros, pues el ayuntamiento no nos da ni agua embotellada, pero si pagamos impuestos solo pozos con arsénico Hiperexplotados, por la construcción masiva sin ningún tipo de control,  cuando vienen nuestros vecinos de los alrededores no sale ni una gota de arsénico del grifo, LA ESPAÑA VACIADA, COMO NO HAGAN ALGO, DESEPARECERA, Y ESTA INSALUBRIDAD NO SE PUEDE CONSENTIR, QUIEN ES EL RESPONSABLE DE NUESTRA SALUD? POR FAVOR NECESITAMOS AYUDA!!!!";"2020-11-18T16:05:33+0000";"3";"";""
"1";"42";"1";"3060918930674700_3061054790661114";"data";"data.*";"fetched (200)";"2021-08-10 12:52:13.077545";"Facebook:/<post-id>/comments";"Muy bien pero que se la ponga todos los políticos y en directo para que no nos engañemos";"2020-11-18T16:07:56+0000";"2";"";""
"1";"43";"1";"3060918930674700_3061060030660590";"data";"data.*";"fetched (200)";"2021-08-10 12:52:13.077545";"Facebook:/<post-id>/comments";"Pues todas todas para el gobierno y los SINVERGUENZAS que tiene a sulado...que son muchos....😈😈😈😈";"2020-11-18T16:10:24+0000";"2";"";""
"1";"44";"1";"3060918930674700_3061065317326728";"data";"data.*";"fetched (200)";"2021-08-10 12:52:13.077545";"Facebook:/<post-id>/comments";"To Lin y si luego resulta que funciona, siempre os podréis consolar diciendo que son unos jetas por que se la pudieron los primeros. ";"2020-11-18T16:12:53+0000";"14";"";""
"1";"45";"1";"3060918930674700_3061068367326423";"data";"data.*";"fetched (200)";"2021-08-10 12:52:13.077545";"Facebook:/<post-id>/comments";"Nacho Palacios soy de riesgo;  me vacuno todos los aňos y todo genial El día 11 fuy , no me la pusieron no había. El 17 llamé no vengas no han llegado .Tengo cita para el próximo día 30 veremos. Espero sea Sí  Tienen para mayores de 65 y niňos pero. La están poniendo desde 60 aňos. No sabia que había rangos de edad en la vacuna. Será en Madrid😕";"2020-11-18T16:14:33+0000";"0";"";""
"1";"46";"1";"3060918930674700_3061070480659545";"data";"data.*";"fetched (200)";"2021-08-10 12:52:13.077545";"Facebook:/<post-id>/comments";"Que se la pongan ellos primero";"2020-11-18T16:15:35+0000";"2";"";""
"1";"47";"1";"3060918930674700_3061070977326162";"data";"data.*";"fetched (200)";"2021-08-10 12:52:13.077545";"Facebook:/<post-id>/comments";"Vania Tutunarova que cohete? ";"2020-11-18T16:15:48+0000";"0";"";""
"1";"48";"1";"3060918930674700_3061078500658743";"data";"data.*";"fetched (200)";"2021-08-10 12:52:13.077545";"Facebook:/<post-id>/comments";"👏👏👏👏👏👏🌹💪";"2020-11-18T16:19:27+0000";"0";"";""
"1";"49";"1";"3060918930674700_3061079830658610";"data";"data.*";"fetched (200)";"2021-08-10 12:52:13.077545";"Facebook:/<post-id>/comments";"Is it really necessary to inject DNA altering genetically modified aborted male fetus, for the survival of humanity???  Research: Recombinant DNA & MRC-5 🐍 https://www.bitchute.com/video/BisZo0p1b9B0/";"2020-11-18T16:20:18+0000";"0";"";""
"1";"50";"1";"3060918930674700_3061079993991927";"data";"data.*";"fetched (200)";"2021-08-10 12:52:13.077545";"Facebook:/<post-id>/comments";"El gobierno los primeros";"2020-11-18T16:20:24+0000";"0";"";""
"1";"51";"1";"3060918930674700_3061080907325169";"data";"data.*";"fetched (200)";"2021-08-10 12:52:13.077545";"Facebook:/<post-id>/comments";"Que pesaditos con que se lo pongan primero los políticos, luego si resulta que funciona diréis que son unos caras que se la pusieron ellos primero, en fin.";"2020-11-18T16:20:52+0000";"54";"";""
"1";"52";"1";"3060918930674700_3061081320658461";"data";"data.*";"fetched (200)";"2021-08-10 12:52:13.077545";"Facebook:/<post-id>/comments";"David De Used cohete con el satélite español Ingenio a los ocho minutos del despegue: ""La misión está perdida""";"2020-11-18T16:21:07+0000";"0";"";""
"1";"53";"1";"3060918930674700_3061081877325072";"data";"data.*";"fetched (200)";"2021-08-10 12:52:13.077545";"Facebook:/<post-id>/comments";"La culpa es de Franco...";"2020-11-18T16:21:25+0000";"0";"";""
"1";"54";"1";"164716453628310_3060918930674700";"offcut";"";"fetched (200)";"2021-08-10 12:52:13.077545";"Facebook:/<post-id>/comments";"";"";"";"";""
"1";"55";"1";"164716453628310_3060918930674700";"headers";"";"fetched (200)";"2021-08-10 12:52:13.077545";"Facebook:/<post-id>/comments";"";"";"";"";""
"1";"56";"1";"3060918930674700_3061082350658358";"data";"data.*";"fetched (200)";"2021-08-10 12:52:13.528338";"Facebook:/<post-id>/comments";"David De Used se estrelló con el IVA de las mascarillas 😱";"2020-11-18T16:21:35+0000";"0";"";""
"1";"57";"1";"3060918930674700_3061083977324862";"data";"data.*";"fetched (200)";"2021-08-10 12:52:13.528338";"Facebook:/<post-id>/comments";"Marta Ortiz de Lanzagorta k verdad !!!! Y luego los k dicen k no serán los primeros k vayan corriendo";"2020-11-18T16:22:30+0000";"6";"";""
"1";"58";"1";"3060918930674700_3061084793991447";"data";"data.*";"fetched (200)";"2021-08-10 12:52:13.528338";"Facebook:/<post-id>/comments";"";"2020-11-18T16:22:50+0000";"0";"";""
"1";"59";"1";"3060918930674700_3061084877324772";"data";"data.*";"fetched (200)";"2021-08-10 12:52:13.528338";"Facebook:/<post-id>/comments";"Que vaya quien kiera y kien no el vera, pero si hay vacuna y punto.";"2020-11-18T16:22:53+0000";"0";"";""
"1";"60";"1";"3060918930674700_3061097570656836";"data";"data.*";"fetched (200)";"2021-08-10 12:52:13.528338";"Facebook:/<post-id>/comments";"To Lin y a mí también, por favor. ";"2020-11-18T16:29:25+0000";"3";"";""
"1";"61";"1";"3060918930674700_3061101000656493";"data";"data.*";"fetched (200)";"2021-08-10 12:52:13.528338";"Facebook:/<post-id>/comments";"Veronica Agustinelli anticipar o retrasar 24 horas el viaje para poder hacer el test ";"2020-11-18T16:31:01+0000";"4";"";""
"1";"62";"1";"3060918930674700_3061103777322882";"data";"data.*";"fetched (200)";"2021-08-10 12:52:13.528338";"Facebook:/<post-id>/comments";"Lolo Castillo Perez , no te preocupes ningún progress estará en la cola para ponérsela.  Allí los progrés mandan a los pringados";"2020-11-18T16:32:18+0000";"1";"";""
"1";"63";"1";"3060918930674700_3061105037322756";"data";"data.*";"fetched (200)";"2021-08-10 12:52:13.528338";"Facebook:/<post-id>/comments";"Jos  el ayuntamiento es responsable ";"2020-11-18T16:32:56+0000";"0";"";""
"1";"64";"1";"3060918930674700_3061110967322163";"data";"data.*";"fetched (200)";"2021-08-10 12:52:13.528338";"Facebook:/<post-id>/comments";"Đåviđ NarroUrones   Son monotema. No dan pa más. ";"2020-11-18T16:35:51+0000";"5";"";""
"1";"65";"1";"3060918930674700_3061112483988678";"data";"data.*";"fetched (200)";"2021-08-10 12:52:13.528338";"Facebook:/<post-id>/comments";"Jose  https://maldita.es/malditaciencia/2020/11/11/vacunas-arn-mensajero-no-modifican-adn/ Lo de ""Resident Evil"" y demás ejemplos son argumentos nuevos que no tenían los antivacunas de hace 100 años ";"2020-11-18T16:36:41+0000";"7";"";""
