"level";"id";"parent_id";"object_id";"object_type";"object_key";"query_status";"query_time";"query_type";"message";"created_time";"like_count";"comment_count";"error.message"
"1";"371";"1";"3060918930674700_3061508847282375";"data";"data.*";"fetched (200)";"2021-08-10 12:52:19.813038";"Facebook:/<post-id>/comments";"Peni Penita x que se creen inteligentes x haber sacado una carrera ,x haber estado en su pupitre tantos i tantos años calladitos como esclavos....... dire a mi favor que conozco a muchísimos de estos con un grado de subnormalidad superior ,sin olvidar su servidumbre .........";"2020-11-18T20:06:51+0000";"0";"";""
"1";"372";"1";"3060918930674700_3061509947282265";"data";"data.*";"fetched (200)";"2021-08-10 12:52:19.813038";"Facebook:/<post-id>/comments";"Aurelio Suero no tan falso como tu perfil de troll asalariado. Aquí tienes la ley firmada.  https://madridmarket.es/los-medicos-bolivianos-de-la-comusav-festejan-la-aprobacion-de-la-ley-del-dioxido-de-cloro-en-la-paz-bolivia/";"2020-11-18T20:07:26+0000";"0";"";""
"1";"373";"1";"3060918930674700_3061511310615462";"data";"data.*";"fetched (200)";"2021-08-10 12:52:19.813038";"Facebook:/<post-id>/comments";"Peni Penita que manía!!! Me rindo, tiro la toalla....  Podemos decir que el cocido no está rico mirando los garbanzos en la tienda, pero lo lógico sería avanzar un poco, comprar, cocinar.... Para llegar a esa conclusión.  Detrás de cualquier vacuna, existe un procedimiento, una regulación, no sé cómo expresarlo para hacerme entender. De verdad, no puedo entender que haya gente, en el año 2020 independientemente del partido que esté en el gobierno, que pueda pensar que nos van a obligar a inyectar en España una vacuna que no ha seguido todas las fases y procedimientos. Confío en la investigación, en la ciencia, en nuestros científicos y me rindo......";"2020-11-18T20:08:08+0000";"1";"";""
"1";"374";"1";"3060918930674700_3061512123948714";"data";"data.*";"fetched (200)";"2021-08-10 12:52:19.813038";"Facebook:/<post-id>/comments";"Peni Penita yo no he dicho que es lejía. Al revés, lea los comentarios.😊";"2020-11-18T20:08:34+0000";"1";"";""
"1";"375";"1";"3060918930674700_3061512753948651";"data";"data.*";"fetched (200)";"2021-08-10 12:52:19.813038";"Facebook:/<post-id>/comments";"Patricia Reviejo Benito... Ya viene, tu vacuna salvadora.";"2020-11-18T20:08:56+0000";"2";"";""
"1";"376";"1";"3060918930674700_3061519970614596";"data";"data.*";"fetched (200)";"2021-08-10 12:52:19.813038";"Facebook:/<post-id>/comments";"Mi cuerpo es mio yo y solamente yo decido si quiero la vacuna oh no lo quiero mas no que si";"2020-11-18T20:11:54+0000";"2";"";""
"1";"377";"1";"3060918930674700_3061520500614543";"data";"data.*";"fetched (200)";"2021-08-10 12:52:19.813038";"Facebook:/<post-id>/comments";"https://m.facebook.com/story.php?story_fbid=10218482655044244&id=1430804941";"2020-11-18T20:12:14+0000";"0";"";""
"1";"378";"1";"164716453628310_3060918930674700";"offcut";"";"fetched (200)";"2021-08-10 12:52:19.813038";"Facebook:/<post-id>/comments";"";"";"";"";""
"1";"379";"1";"164716453628310_3060918930674700";"headers";"";"fetched (200)";"2021-08-10 12:52:19.813038";"Facebook:/<post-id>/comments";"";"";"";"";""
"1";"380";"1";"3060918930674700_3061525473947379";"data";"data.*";"fetched (200)";"2021-08-10 12:52:20.218769";"Facebook:/<post-id>/comments";"La tierra es redonda, gira alrededor del sol, una estrella mediana, es el tercer planeta de nuestro sistema solar, formamos parte de la Vist Láctea, la estrella más cercana es Orion y esto es una mierda de vacuna. Para más información, lee a Carl Sagan";"2020-11-18T20:15:08+0000";"2";"";""
"1";"381";"1";"3060918930674700_3061526163947310";"data";"data.*";"fetched (200)";"2021-08-10 12:52:20.218769";"Facebook:/<post-id>/comments";"Patricia Reviejo Benito ¿ tu te vas a poner la vacuna? ";"2020-11-18T20:15:27+0000";"0";"";""
"1";"382";"1";"3060918930674700_3061526723947254";"data";"data.*";"fetched (200)";"2021-08-10 12:52:20.218769";"Facebook:/<post-id>/comments";"Lucas Molero Matas vamos allá!!!  No sé si será esta la vacuna o si antes llegará un fármaco.... Por el tipo, todo indica que será lo primero. Pero te aseguro que llegará. Y no, por desgracia yo no salvo a nadie. Mi mente no es tan brillante, ni lo será nunca, aunque me sigo formando para ello, al menos, para poder defender una idea sin insultar , sin mofarme de nadie y sin cometer faltas garrafales de ortografía.";"2020-11-18T20:15:44+0000";"4";"";""
"1";"383";"1";"3060918930674700_3061526960613897";"data";"data.*";"fetched (200)";"2021-08-10 12:52:20.218769";"Facebook:/<post-id>/comments";"Carlos Rodríguez Amezqueta  no,  no se puede  solo es un comentario  algunos estudiantes y cse  ..  pueden hacer de rastreadores.. que tambien se pone la piel de gallina.  puedes estudiar para auxiliar de enfermeria o para enfermeria  o pueden estudiar medicina..ser celadores... puedes pedir entrar en el personal de servicio de limpieza que son tambien indispensables o en mantenimiento,hacen falta muchos profesionales.";"2020-11-18T20:15:54+0000";"0";"";""
"1";"384";"1";"3060918930674700_3061527290613864";"data";"data.*";"fetched (200)";"2021-08-10 12:52:20.218769";"Facebook:/<post-id>/comments";"Y vacunate";"2020-11-18T20:16:08+0000";"0";"";""
"1";"385";"1";"3060918930674700_3061528913947035";"data";"data.*";"fetched (200)";"2021-08-10 12:52:20.218769";"Facebook:/<post-id>/comments";"Carmelo Martinez  No hay que tener miedo  Pero ya de tontos vamos sobraos";"2020-11-18T20:16:59+0000";"0";"";""
"1";"386";"1";"3060918930674700_3061529800613613";"data";"data.*";"fetched (200)";"2021-08-10 12:52:20.218769";"Facebook:/<post-id>/comments";"Patricia Reviejo Benito..Buena suerte";"2020-11-18T20:17:31+0000";"0";"";""
"1";"387";"1";"3060918930674700_3061531187280141";"data";"data.*";"fetched (200)";"2021-08-10 12:52:20.218769";"Facebook:/<post-id>/comments";"Patricia Reviejo Benito como dicen en mi pueblo ""Chominá que briegues"" no entres al trapo... ";"2020-11-18T20:18:17+0000";"0";"";""
"1";"388";"1";"3060918930674700_3061535920613001";"data";"data.*";"fetched (200)";"2021-08-10 12:52:20.218769";"Facebook:/<post-id>/comments";"Jose Lopez Lopez los laboratorios de coronavirus llevan estudiando estos virus desde el 2005 con lo que no es verdad que lleven desde Marzo entiendo que no dedicandote a la ciencia lo ignores pero por eso mismo no deberías hablar sin antes informarte. Te recomiendo do el camal divulgativo de ciencia de YouTube del Consejo Superior de Investigaciones Cientificas";"2020-11-18T20:21:04+0000";"8";"";""
"1";"389";"1";"3060918930674700_3061539130612680";"data";"data.*";"fetched (200)";"2021-08-10 12:52:20.218769";"Facebook:/<post-id>/comments";"anda paí con un cohete";"2020-11-18T20:22:51+0000";"0";"";""
"1";"390";"1";"3060918930674700_3061543753945551";"data";"data.*";"fetched (200)";"2021-08-10 12:52:20.218769";"Facebook:/<post-id>/comments";"Pues espero que los primeros voluntarios sean los Políticos.";"2020-11-18T20:25:30+0000";"3";"";""
"1";"391";"1";"3060918930674700_3061544497278810";"data";"data.*";"fetched (200)";"2021-08-10 12:52:20.218769";"Facebook:/<post-id>/comments";"Y porque no asen los ensallos con todos los politicos? O sus familiares y si pasa algo que les pase a ellos";"2020-11-18T20:25:56+0000";"2";"";""
"1";"392";"1";"3060918930674700_3061546057278654";"data";"data.*";"fetched (200)";"2021-08-10 12:52:20.218769";"Facebook:/<post-id>/comments";"Patricia Reviejo Benito pues que no se la pongan, yo desde luego sí.";"2020-11-18T20:26:53+0000";"1";"";""
"1";"393";"1";"3060918930674700_3061547250611868";"data";"data.*";"fetched (200)";"2021-08-10 12:52:20.218769";"Facebook:/<post-id>/comments";"Jose Lopez Lopez estás confundiendo ""ensayo clínico"" (puede durar semanas) con ""desarrollo clínico"" (suele durar de 8 a 10 años). El desarrollo clínico es más largo porque tiene una buena cantidad de tiempo dedicado a buscar ""la mejor dosis"" por lo que tiene varios ensayos de fase I y II. Además en esos 8-10 años se incluye muchiiisima burocracia y meses y meses de reclutamiento, cosas que con dinero o con prisa se acelera. Estas vacunas no serán lo mejor de lo mejor pero serán lo sufici3ntemente seguras y eficaces para salvar la situación.  Lamentable para tu retahíla de orangutanadas antiabortistas no hay vacuna :-) aún así te doy la bienvenida al siglo XXI, donde el aborto es legal y es un derecho. ";"2020-11-18T20:27:42+0000";"20";"";""
"1";"394";"1";"3060918930674700_3061547563945170";"data";"data.*";"fetched (200)";"2021-08-10 12:52:20.218769";"Facebook:/<post-id>/comments";"Manoli Fernández . Lo mismo estába pensando yo. Lo de muñeca me llegó al alma. 🤮🤦‍♀️";"2020-11-18T20:27:54+0000";"1";"";""
"1";"395";"1";"3060918930674700_3061548297278430";"data";"data.*";"fetched (200)";"2021-08-10 12:52:20.218769";"Facebook:/<post-id>/comments";"Si un proyecto espacial de 13 años y 200 millones de euros, no ha durado ni 8 minutos...  Que podemos esperar de una vacuna que han desarrollado en menos de 8 meses??  Yo creo que deberían los políticos dar ejemplo, y ponérsela ellos los primeros.";"2020-11-18T20:28:19+0000";"16";"";""
"1";"396";"1";"3060918930674700_3061549280611665";"data";"data.*";"fetched (200)";"2021-08-10 12:52:20.218769";"Facebook:/<post-id>/comments";"Vacunarse joeeeé, que es signo de haber evoluSIONado. Y un montón, menos.... 😎";"2020-11-18T20:28:59+0000";"0";"";""
"1";"397";"1";"3060918930674700_3061549777278282";"data";"data.*";"fetched (200)";"2021-08-10 12:52:20.218769";"Facebook:/<post-id>/comments";"Peni Penita todo lo que dices es mentira! Da asco tu comentario 🤮. Los negacionistas iréis a la cárcel muy pronto. Espero que te denuncien ";"2020-11-18T20:29:17+0000";"1";"";""
"1";"398";"1";"3060918930674700_3061551900611403";"data";"data.*";"fetched (200)";"2021-08-10 12:52:20.218769";"Facebook:/<post-id>/comments";"Se puede pedir por AliExpress?";"2020-11-18T20:30:27+0000";"1";"";""
"1";"399";"1";"3060918930674700_3061553090611284";"data";"data.*";"fetched (200)";"2021-08-10 12:52:20.218769";"Facebook:/<post-id>/comments";"Se la va a poner tu gran pta madre en patinete";"2020-11-18T20:31:11+0000";"0";"";""
"1";"400";"1";"3060918930674700_3061554483944478";"data";"data.*";"fetched (200)";"2021-08-10 12:52:20.218769";"Facebook:/<post-id>/comments";"No me creo nada de sanidad como pa ponerme una vacuna.";"2020-11-18T20:32:02+0000";"0";"";""
"1";"401";"1";"3060918930674700_3061556200610973";"data";"data.*";"fetched (200)";"2021-08-10 12:52:20.218769";"Facebook:/<post-id>/comments";"Lo mismo que llamas a urgencias y no te atienden.La vacuna se la van poner ellos";"2020-11-18T20:33:09+0000";"2";"";""
"1";"402";"1";"3060918930674700_3061557050610888";"data";"data.*";"fetched (200)";"2021-08-10 12:52:20.218769";"Facebook:/<post-id>/comments";"Jose Ramon Andres Bernad busca TÚ información, te pongo las noticias? ";"2020-11-18T20:33:40+0000";"0";"";""
"1";"403";"1";"3060918930674700_3061557617277498";"data";"data.*";"fetched (200)";"2021-08-10 12:52:20.218769";"Facebook:/<post-id>/comments";"Bla bla bla que experimenten con ratas";"2020-11-18T20:34:00+0000";"0";"";""
"1";"404";"1";"3060918930674700_3061560047277255";"data";"data.*";"fetched (200)";"2021-08-10 12:52:20.218769";"Facebook:/<post-id>/comments";"Adelina Fuentes Jajajaja que sensibles las señoras.. 🤭😏";"2020-11-18T20:35:23+0000";"0";"";""
"1";"405";"1";"164716453628310_3060918930674700";"offcut";"";"fetched (200)";"2021-08-10 12:52:20.218769";"Facebook:/<post-id>/comments";"";"";"";"";""
"1";"406";"1";"164716453628310_3060918930674700";"headers";"";"fetched (200)";"2021-08-10 12:52:20.218769";"Facebook:/<post-id>/comments";"";"";"";"";""
"1";"407";"1";"3060918930674700_3061561203943806";"data";"data.*";"fetched (200)";"2021-08-10 12:52:20.762479";"Facebook:/<post-id>/comments";"";"2020-11-18T20:35:58+0000";"0";"";""
"1";"408";"1";"3060918930674700_3061561913943735";"data";"data.*";"fetched (200)";"2021-08-10 12:52:20.762479";"Facebook:/<post-id>/comments";"Peni Penita debería estar penada la defensa de la no vacunación, la difusión de bulos y la desinformación.";"2020-11-18T20:36:20+0000";"3";"";""
"1";"409";"1";"3060918930674700_3061563307276929";"data";"data.*";"fetched (200)";"2021-08-10 12:52:20.762479";"Facebook:/<post-id>/comments";"Amparito Capilla Sanchez Supongo que uno no puede decidir dónde hace falta personal y meterse a trabajar. Lo que quiero decir es que usted ha dicho a alguien que haga algo que no puede hacer para intentar refutar las afirmaciones que ha hecho. Nadie no profesional puede entrar en una planta de enfermos de Covid ( tampoco en una UCI) ¿por qué le dice que lo haga?. ¿Lo ha hecho usted?. ¿ Se lo han contado o se lo imagina?.  Si se pide a alguien que sea riguroso con lo que dice, hay que empezar por serlo uno mismo.";"2020-11-18T20:37:12+0000";"0";"";""
"1";"410";"1";"3060918930674700_3061564933943433";"data";"data.*";"fetched (200)";"2021-08-10 12:52:20.762479";"Facebook:/<post-id>/comments";"Yo soy voluntario para ponerla";"2020-11-18T20:38:10+0000";"1";"";""
"1";"411";"1";"3060918930674700_3061565833943343";"data";"data.*";"fetched (200)";"2021-08-10 12:52:20.762479";"Facebook:/<post-id>/comments";"Como la vacuna sea igual de efectiva que el cohete del satélite vamos apañaos.";"2020-11-18T20:38:38+0000";"1";"";""
"1";"412";"1";"3060918930674700_3061567397276520";"data";"data.*";"fetched (200)";"2021-08-10 12:52:20.762479";"Facebook:/<post-id>/comments";"Kevin Martinez Alonso . Bien rectificado. 👏";"2020-11-18T20:39:35+0000";"0";"";""
"1";"413";"1";"3060918930674700_3061568687276391";"data";"data.*";"fetched (200)";"2021-08-10 12:52:20.762479";"Facebook:/<post-id>/comments";"Por dios cualquier cosa que te tomes tiene efecto secundarios, hasta una aspirina te da un trombo, venga ya dejaros de quejaros";"2020-11-18T20:40:17+0000";"1";"";""
"1";"414";"1";"3060918930674700_3061570710609522";"data";"data.*";"fetched (200)";"2021-08-10 12:52:20.762479";"Facebook:/<post-id>/comments";"Maria Jesus Chusa Xena obedece y calla🐑🐑🐑🐑";"2020-11-18T20:41:26+0000";"0";"";""
"1";"415";"1";"3060918930674700_3061572693942657";"data";"data.*";"fetched (200)";"2021-08-10 12:52:20.762479";"Facebook:/<post-id>/comments";"Nora Bakkali";"2020-11-18T20:42:41+0000";"1";"";""
"1";"416";"1";"3060918930674700_3061576237275636";"data";"data.*";"fetched (200)";"2021-08-10 12:52:20.762479";"Facebook:/<post-id>/comments";"Jose Lopez Lopez primero los politicos del gobierno y sus Amiguetes";"2020-11-18T20:44:48+0000";"3";"";""
"1";"417";"1";"3060918930674700_3061576543942272";"data";"data.*";"fetched (200)";"2021-08-10 12:52:20.762479";"Facebook:/<post-id>/comments";"Đåviđ NarroUrones  tú te crees lo que sale tele y poco más!! Que te mean y te dicen que llueve y te lo crees!! ";"2020-11-18T20:45:00+0000";"0";"";""
"1";"418";"1";"3060918930674700_3061576820608911";"data";"data.*";"fetched (200)";"2021-08-10 12:52:20.762479";"Facebook:/<post-id>/comments";"https://m.facebook.com/story.php?story_fbid=2822696151348728&id=2065768223708195";"2020-11-18T20:45:13+0000";"0";"";""
"1";"419";"1";"3060918930674700_3061577093942217";"data";"data.*";"fetched (200)";"2021-08-10 12:52:20.762479";"Facebook:/<post-id>/comments";"Jose Ramon  En este enlace tienes un primer gráfico que muestra las diferencias entre un 0 a un 95% https://www.abc.es/salud/sanidad/abci-vacunas-como-inmunidad-grupo-puede-impedir-epidemia-sarampion-201808220138_noticia.html#vca=amp-rrss-inducido&vmc=abc-es&vso=wh&vli=noticia.foto  Si no quieres leer mucho: La inmunidad de grupo permite evitar el contagio. «De forma natural, cuando se produce un brote, al avanzar la epidemia y aumentar el número de individuos inmunes, disminuye la probabilidad de contacto entre un susceptible y un infectado, hasta que llega un momento en el que se bloquea la transmisión del agente infeccioso»  «El hecho de vacunarse implica no solamente la protección individual, sino que mediante ella se está contribuyendo por solidaridad a la protección de toda la población»";"2020-11-18T20:45:23+0000";"0";"";""
"1";"420";"1";"3060918930674700_3061577267275533";"data";"data.*";"fetched (200)";"2021-08-10 12:52:20.762479";"Facebook:/<post-id>/comments";"#falsapandemia #Ridiculacuarentena #farsacoronavirus #gobiernomarioneta #bastadementiras #naousomasca #OMSGenocida #nosoyesclavo #sinmascara #sinvacunas #MafiaFarmaceutica #falsamedicina #notequedesencasa #masabrazosymasbesos #salmo91";"2020-11-18T20:45:30+0000";"0";"";""
"1";"421";"1";"3060918930674700_3061577367275523";"data";"data.*";"fetched (200)";"2021-08-10 12:52:20.762479";"Facebook:/<post-id>/comments";"Cómo sería si en lugar de ver cuántos casos hay por día , se dictará una ley mundial que inundara de información de cómo hacernos más fuerte inmunologícamente? ? Que pasaría?  . .  Del muro de Jose Gorrochategui (Gracias )  Texto de un naturópata francés .:  “Molesto de que día tras día y cada vez un poco más, en el corazón de la pandemia, los medios no dan explicaciones sobre el funcionamiento de nuestro sistema inmunológico.  Constantemente, se nos insta a buscar protección externa que nos salve: comprar máscaras, comprar geles hidroalcohólicos (sin especificar que estos geles no deben usarse durante varios días seguidos porque, a base de etanol, eliminarán la primera barrera inmune natural de nuestro cuerpo: las bacterias y la película de lípidos de nuestra piel, que es una barrera para los virus ... [Esto también se debe al uso excesivo de productos antibacterianos en los últimos años, y un malentendido sobre el papel de las bacterias en nuestra inmunidad, que nuestros cuerpos se vuelven más sensibles año con año.]  Cuanto más usamos estos geles a base de alcohol, más permeables y sensibles a la epidermis son los virus ... ¡Démosle prioridad a los jabones clásicos!  Luego, los medios comienzan a hablarnos de una solución que también vendría de afuera: un futuro tratamiento farmacológico o una vacuna cuyas evaluaciones de autorización de comercialización seguramente serán descuidadas por razones de ""emergencia"". ..  ¿En qué MOMENTO, se le ha explicado a la población que todos tienen la capacidad de fortalecer naturalmente su sistema inmunológico en unos pocos días (los jóvenes) o en unas pocas semanas? Esto ciertamente no evitaría la propagación del virus, sino que fortalecería nuestras defensas contra él y, por lo tanto, reduciría la proporción de casos graves, para sanar mucho más rápido en el hogar.  ¿Por qué no involucrar en los canales de información de las plataformas, que dedican el 95% de su tiempo sobre este tema durante varias semanas, a profesionales de la salud que hablan sobre prevención, como nutricionistas, naturópatas, fitoterapeutas, que podrían realizar un inmenso trabajo de información y prevención cerca del público y así aliviar a los médicos que están en el frente?  ¿Por qué no decirle a la gente que comer basura, como los productos industriales, procesados ​​y refinados es lo primero que destruye nuestras defensas inmunes?  Que la eficiencia de nuestro sistema inmunitario depende estrechamente de la calidad de nuestra flora intestinal (y, por lo tanto, de la calidad de lo que comemos)  De modo que las verduras y frutas vivas, crudas, locales y de temporada son la mejor manera de fortalecer rápidamente nuestras reservas minerales, necesarias para la inmunidad.  ¿Por qué no explicar que el ayuno fortalece el sistema inmunitario en solo 3 días?  ¿Por qué no hablar sobre los beneficios de la ducha fría que en pocos días aumenta el nivel de ciertos linfocitos T?  ¿Por qué no explicar que plantas como la equinácea, el astrágalo, el saúco, el escaramujo, en sus formas concentradas, aumentan las defensas inmunes en unas pocas semanas? (entonces habríamos tenido tiempo desde que apareció el virus ...)  ¿Por qué no hablar sobre la efectividad de los aceites esenciales antivirales? Además de vit C en altas dosis y minerales traza como zinc y selenio?  ¿Por qué no hablar sobre la importancia de la actividad física y los estudios recientes que prueban la rápida efectividad del yoga para fortalecer el sistema inmunológico?  ¿Por qué no explicar que el miedo es inmunosupresor? (Sin embargo, es la única emoción transmitida en este momento por los principales medios de comunicación ...) un nivel de ansiedad que lo debilita a diario ...  ¿Por qué no explicar a las personas que tienen dentro de ellas un potencial de defensa y curación que es infinitamente más poderoso que cualquier droga en el mundo y que puede activarse rápidamente? Nuestro CUERPO es una verdadera máquina de curación.  En este período cuando finalmente tenemos tiempo, es hora de interesarnos en nuestro propio funcionamiento, reclamar nuestro poder personal, tomar el control de nuestra salud y nuestro futuro.";"2020-11-18T20:45:34+0000";"3";"";""
"1";"422";"1";"3060918930674700_3061577517275508";"data";"data.*";"fetched (200)";"2021-08-10 12:52:20.762479";"Facebook:/<post-id>/comments";"EL USO DE LA MARCARILLA, BARBIJO O TAPABOCAS PUEDE INTOXICARTE. El uso prolongado de barbijo produce hipoxia -Respirar una y otra vez aire exhalado se convierte en dióxido de carbono- Por eso nos sentimos mareados. Esto intoxica al usuario y mucho más cuando debe movilizarse, realizar acciones de desplazamiento.  Provoca malestar, pérdida de reflejos y de pensamiento consciente.  Genera gran cansancio. Además, la carencia de oxígeno produce descomposición de la glucosa y la subida peligrosísima del ácido láctico. Algunas personas manejan su auto con el tapabocas, eso es muy peligroso, porque, el aire viciado puede hacer perder el conocimiento al conductor. También me gustaría que alguien piense una solución para los empleados que atienden público y son obligados al uso permanente, durante todas sus horas de trabajo, sumándole, a muchos, la máscara transparente. Los empresarios o gobernantes deberían establecer algún reglamento para su uso apropiado. Lo recomendable es usarlo sólo si tienes a alguien enfrente o muy cercano, y es importante recordar levantarlo cada 10 minutos para seguir sintiéndote saludable. Es contraproducente para las personas que atienden 8 horas al público, pues se están intoxicando sin saberlo. ¡Todas las vidas son importantes.!""";"2020-11-18T20:45:38+0000";"1";"";""
"1";"423";"1";"3060918930674700_3061577710608822";"data";"data.*";"fetched (200)";"2021-08-10 12:52:20.762479";"Facebook:/<post-id>/comments";"EL CORONA VIRUS SI EXISTE LES DIRÉ LOS SÍNTOMAS: Comienza a propagarse en los medios de❌ información masiva.  Se apodera de la mente haciéndola dócil miedosa y obediente.❌ Transforma tu voluntad en sometimiento❌ Tú valor en cobardía❌ Tú inteligencia en estupidez❌ Tú alegría en depresión❌ Tú entusiasmo en indiferencia❌ Tú estabilidad en desequilibrio❌ Tú comunicación en aislamiento❌ Tú productividad en pobreza❌ Tú libertad en prisión❌ Tú creatividad en somnolencia❌ Es un virus que se contagia por medio de la mediocridad y la indiferencia que brindan los medios de comunicación masiva llegando a cada rincón del planeta.  Es un virus que está destruyendo a la economía y a las familias.  Al hombre como individuo Y a la sociedad en conjunto.  Un virus que destruye al cerebro Transformándo al hombre en un zombie.  Que solo despierta come y duerme,  Con un tapabocas que le impide expresar su sentir.  Un zombie que ya no lucha Por alcanzar sus sueños.  Un zombie que ya no sabe lo que es Vivir para disfrutar la vida Ahora el zombie vive atrapado Escondido entre sus sombras.  Ya no aspira a nada más.  Ya no tiene más anhelos.  El virus lo ha carcomido Destruyendole el cerebro.  Ahora los zombies defienden Su vida de miedo y su encierro.  Así es como actúa ese virus Y como se propaga.  La verdadera pandemia Que está desatada en el mundo DESPIERTA!!!!";"2020-11-18T20:45:45+0000";"3";"";""
"1";"424";"1";"3060918930674700_3061578120608781";"data";"data.*";"fetched (200)";"2021-08-10 12:52:20.762479";"Facebook:/<post-id>/comments";"Carmen  En este enlace tienes un primer gráfico que muestra las diferencias entre un 0 a un 95% https://www.abc.es/salud/sanidad/abci-vacunas-como-inmunidad-grupo-puede-impedir-epidemia-sarampion-201808220138_noticia.html#vca=amp-rrss-inducido&vmc=abc-es&vso=wh&vli=noticia.foto  Si no quieres leer mucho: La inmunidad de grupo permite evitar el contagio. «De forma natural, cuando se produce un brote, al avanzar la epidemia y aumentar el número de individuos inmunes, disminuye la probabilidad de contacto entre un susceptible y un infectado, hasta que llega un momento en el que se bloquea la transmisión del agente infeccioso»  «El hecho de vacunarse implica no solamente la protección individual, sino que mediante ella se está contribuyendo por solidaridad a la protección de toda la población» ";"2020-11-18T20:46:02+0000";"0";"";""
"1";"425";"1";"3060918930674700_3061580117275248";"data";"data.*";"fetched (200)";"2021-08-10 12:52:20.762479";"Facebook:/<post-id>/comments";"Maribel Sánchez Pastor https://www.facebook.com/pishacomico/videos/373450407321387/?sfnsn=scwspmo&d=n&vh=ehttps://www.facebook.com/pishacomico/videos/373450407321387/?sfnsn=scwspmo&d=n&vh=ehttps://www.facebook.com/pishacomico/videos/373450407321387/?sfnsn=scwspmo&d=n&vh=ehttps://www.facebook.com/pishacomico/videos/373450407321387/?sfnsn=scwspmo&d=n&vh=e";"2020-11-18T20:47:19+0000";"0";"";""
"1";"426";"1";"3060918930674700_3061580153941911";"data";"data.*";"fetched (200)";"2021-08-10 12:52:20.762479";"Facebook:/<post-id>/comments";"Loli Teba Torres ";"2020-11-18T20:47:20+0000";"1";"";""
