"level";"id";"parent_id";"object_id";"object_type";"object_key";"query_status";"query_time";"query_type";"message";"created_time";"like_count";"comment_count";"error.message"
"1";"1059";"1";"3060918930674700_135160904657651";"data";"data.*";"fetched (200)";"2021-08-10 12:52:33.834720";"Facebook:/<post-id>/comments";"Leo comentarios qué dan pena. Gracias a tantísimas personas  que son voluntarias en  investigacion se pueden curar muchisimas enfermedades  Yo soy voluntaria en la investigación del cancer de colon están  estudiando las células madre también donare mi cuerpo para. La ciencia ,, Nunca llueve a gustó de todos Pero un poco más de respeto para todos los científicos que están luchando por sacarla lo antes posible... FELICIDADES 👏👏👏👏👏👏👏👏👏👏👏 Yo si me la pondre....";"2020-11-19T11:32:34+0000";"0";"";""
"1";"1060";"1";"3060918930674700_135161171324291";"data";"data.*";"fetched (200)";"2021-08-10 12:52:33.834720";"Facebook:/<post-id>/comments";"Brenda Andreoni que llenos de odio están por favor gente";"2020-11-19T11:33:10+0000";"0";"";""
"1";"1061";"1";"3060918930674700_135162124657529";"data";"data.*";"fetched (200)";"2021-08-10 12:52:33.834720";"Facebook:/<post-id>/comments";"Hay que ver como se preocupa el gobierno de nosotros que a todos nos quieren meter la vacuna por nuestra salud.Pero no se preocupan de los que mueren de otras enfermedades,ni se preocupan de la cantidad de gente que no tiene para comer,gente que duerme en las calles etc etc.Solo vacuna y más vacuna,ahí está el verdadero interés de todos estos hdp.";"2020-11-19T11:35:30+0000";"0";"";""
"1";"1062";"1";"3060918930674700_127470088902422";"data";"data.*";"fetched (200)";"2021-08-10 12:52:33.834720";"Facebook:/<post-id>/comments";"Estuve yo en las últimas elecciones en España y nadie movía en toto para salir a votar .... bueno joder son ustedes el pueblo los que eligen sus gobernantes ... las próximas elecciones suelten la caña del domingo un rato voten y luego si se quejan por que ya se que van a venir a decirme yo voté yo voté... pero no alcanza con 4 o 5 el país debe ponerse de pie si tan mal se sienten y cambiarlo.con el voto que por lo que vi a nadie le interesa ir a colocar en la urna !";"2020-11-19T11:36:24+0000";"0";"";""
"1";"1063";"1";"3060918930674700_127471792235585";"data";"data.*";"fetched (200)";"2021-08-10 12:52:33.834720";"Facebook:/<post-id>/comments";"Virginia y de gripe? cuantos? o de cancer? o accidentes de coche?? dime🤔 o esos da igual?  y si..me jode porqe no me dejan trabajar..ni a mi ni a mi marido y mi familia se hunde en la miseria por culpa de como lo estan gestionando...";"2020-11-19T11:40:10+0000";"0";"";""
"1";"1064";"1";"3060918930674700_127471902235574";"data";"data.*";"fetched (200)";"2021-08-10 12:52:33.834720";"Facebook:/<post-id>/comments";"Ole esos políticos y presos que se ofrecen voluntarios para probar las vacunas 👏👏👏👏";"2020-11-19T11:40:22+0000";"0";"";""
"1";"1065";"1";"3060918930674700_135164757990599";"data";"data.*";"fetched (200)";"2021-08-10 12:52:33.834720";"Facebook:/<post-id>/comments";"Lailo  Portland creo que nadie te prohíbe a ti hacer de conejillo de indias. Creo que deberías mejorar mucho tu educación y respeto. Para disentir de alguien no hace falta insultar.";"2020-11-19T11:42:06+0000";"4";"";""
"1";"1066";"1";"3060918930674700_135164811323927";"data";"data.*";"fetched (200)";"2021-08-10 12:52:33.834720";"Facebook:/<post-id>/comments";"Veremos dentro de un tiempo qué derechos tienen los vacunados y los no. COVID : Certificated Of Vaccination ID";"2020-11-19T11:42:13+0000";"0";"";""
"1";"1067";"1";"3060918930674700_127473485568749";"data";"data.*";"fetched (200)";"2021-08-10 12:52:33.834720";"Facebook:/<post-id>/comments";"Empezad por los del congreso, que los necesitamos sanos!!!!!!!";"2020-11-19T11:43:43+0000";"0";"";""
"1";"1068";"1";"3060918930674700_135165887990486";"data";"data.*";"fetched (200)";"2021-08-10 12:52:33.834720";"Facebook:/<post-id>/comments";"Fran Sua con los políticos hay suficiente si tenemos más que en cualquier país de Europa que valgan para algo ";"2020-11-19T11:44:27+0000";"1";"";""
"1";"1069";"1";"3060918930674700_135166364657105";"data";"data.*";"fetched (200)";"2021-08-10 12:52:33.834720";"Facebook:/<post-id>/comments";"Fran Sua esos que se pegan en el Congreso de los diputados el día durmiendo pues vacunita para ellos";"2020-11-19T11:45:41+0000";"1";"";""
"1";"1070";"1";"3060918930674700_135166411323767";"data";"data.*";"fetched (200)";"2021-08-10 12:52:33.834720";"Facebook:/<post-id>/comments";"Full Spiteri también volaron por los aires la única fábrica de clorito de España en el mes de abril. Sospechoso?";"2020-11-19T11:45:47+0000";"1";"";""
"1";"1071";"1";"3060918930674700_127475642235200";"data";"data.*";"fetched (200)";"2021-08-10 12:52:33.834720";"Facebook:/<post-id>/comments";"Alicia Wonderland no fue así amiga. Se reprodujo un incendio por el exceso de producción que hubo durante el confinamiento. Estuvo agotado durante meses.😊 Ya lo aclararon.";"2020-11-19T11:47:29+0000";"1";"";""
"1";"1072";"1";"3060918930674700_135167257990349";"data";"data.*";"fetched (200)";"2021-08-10 12:52:33.834720";"Facebook:/<post-id>/comments";"Esther López veo que o vives deceso o estás muy perdida. Verás, los primeros que no respetan al ciudadano ni hacen su trabajo son los políticos. Hay que pedirles cuentas y resultados. Si, porque están a nuestro servicio. Igual que los funcionarios. Y por otro lado llamar conspiranoicas al que ya ha abierto los ojos es ser muy cortito en los tiempos de la información  verdadera que puedes encontrar, eso sí, fuera de los medios sometidos y comprador por el gobierno. Si lo quieres entender lo entiendes y si no tiempo has tenido. ";"2020-11-19T11:47:47+0000";"3";"";""
"1";"1073";"1";"3060918930674700_135167314657010";"data";"data.*";"fetched (200)";"2021-08-10 12:52:33.834720";"Facebook:/<post-id>/comments";"Inma Picón tú no ves las noticias...si dijeron hace días q en principio voluntaria, pero que podría haber una posibilidad de q fuera obligatoria ..  Si ya nos han obligado a llevar las mascarillas con amenaza de multa si ven q no las llevamos, y tienes q llevarlas hasta para pasear al perro cuando en otros países no la llevan ni en la peluquería ni en ciertos sitios..";"2020-11-19T11:48:01+0000";"0";"";""
"1";"1074";"1";"3060918930674700_127476738901757";"data";"data.*";"fetched (200)";"2021-08-10 12:52:33.834720";"Facebook:/<post-id>/comments";"Javier Otero Fuentes ellos no nos van a dar un certificado de garantía de la vacuna. Están exonerados de cualquier daño posterior. ";"2020-11-19T11:49:56+0000";"2";"";""
"1";"1075";"1";"3060918930674700_135168484656893";"data";"data.*";"fetched (200)";"2021-08-10 12:52:33.834720";"Facebook:/<post-id>/comments";"Javier Otero Fuentes eso es acerles el juego de esclavos";"2020-11-19T11:50:39+0000";"3";"";""
"1";"1076";"1";"3060918930674700_127477795568318";"data";"data.*";"fetched (200)";"2021-08-10 12:52:33.834720";"Facebook:/<post-id>/comments";"Inma Picón exoneraron la responsabilidad por daños posteriores. Tú te la pondrías sin garantías??? Venga. Empieza tu. Valiente!!! ";"2020-11-19T11:52:11+0000";"0";"";""
"1";"1077";"1";"3060918930674700_127478145568283";"data";"data.*";"fetched (200)";"2021-08-10 12:52:33.834720";"Facebook:/<post-id>/comments";"Que empiecen por toda la clase política!!!!";"2020-11-19T11:52:54+0000";"1";"";""
"1";"1078";"1";"3060918930674700_127478338901597";"data";"data.*";"fetched (200)";"2021-08-10 12:52:33.834720";"Facebook:/<post-id>/comments";"Si hombre! Como el cohete🚀 de más de 200millones de €";"2020-11-19T11:53:26+0000";"0";"";""
"1";"1079";"1";"3060918930674700_135169664656775";"data";"data.*";"fetched (200)";"2021-08-10 12:52:33.834720";"Facebook:/<post-id>/comments";"Si Vacuna de la morte !!!";"2020-11-19T11:53:44+0000";"0";"";""
"1";"1080";"1";"164716453628310_3060918930674700";"offcut";"";"fetched (200)";"2021-08-10 12:52:33.834720";"Facebook:/<post-id>/comments";"";"";"";"";""
"1";"1081";"1";"164716453628310_3060918930674700";"headers";"";"fetched (200)";"2021-08-10 12:52:33.834720";"Facebook:/<post-id>/comments";"";"";"";"";""
"1";"1082";"1";"3060918930674700_127478545568243";"data";"data.*";"fetched (200)";"2021-08-10 12:52:34.348167";"Facebook:/<post-id>/comments";"Casiopea Mj Casiopea Mj incoherente y criminal es pensar que se le tenga que quitar atención médica a alguien que se niega a usar una mascarilla que si no estuvieras un poco perdida y empapada del relato terroristico oficial, te darías cuenta de por lo menos dos cosas:  1, que la mascarilla no protege de un virus, y lo dice la mismísima OMS a pesar de la escasa credibilidad que tiene. 2, que estamos hechos de energía, y esta viene de algo tan natural como el oxígeno al inspirar y la eliminación de CO2 al expirar. Si crees que la mascarilla no limita ese pasaje natural de aire, pues, entonces convendrás que no sirve de nada, ni mucho menos a parar eventuales partículas de un virus bastante más pequeño en tamaño que la partículas de oxígeno, y si en cambio crees que para el aire... Pues, me está impidiendo respirar como es debido, con todo lo que ello conlleva. No te digo de despertar porque eso va de cada uno, solo es una cuestión de tiempo de que veas de qué va todo esto, tanto tú como yo como todos, pero un consejo... Escucha alguna de las razones de los que defines ""negacionistas"" (termino por cierto equivocado) y sin muchos prejuicios, usa los datos y tu sentido común, apuesto a que algunas cosas te resultarán más sensatas que la gran cantidad de normas ilógicas, contradictorias, estúpidas cuando no criminales que aquí y en todo el mundo se están aplicando. Por cierto, alguien podría definirte ""negacionista"" a ti también si niegas la realidad de la opresión de nuestras libertades más básicas que cada día estamos viendo... O no creerás que con la vacuna todo volverá como antes, verdad?";"2020-11-19T11:53:52+0000";"1";"";""
"1";"1083";"1";"3060918930674700_127478855568212";"data";"data.*";"fetched (200)";"2021-08-10 12:52:34.348167";"Facebook:/<post-id>/comments";"Chema Imp joder, vaya lío que me he montado, perdona, ni me acuerdo para quien iba, contesté a varios, pero estoy seguro de que tu no estabas, de hecho como no quiero perder tiempo con cierta gente, los bloqueo directamente a no ser que sea gente que conozco, siempre que haya respeto. Perdona perono era para tí, la contestación, Saludos y ánimo en éstos dificiles tiempos  que estamos pasando.";"2020-11-19T11:54:33+0000";"0";"";""
"1";"1084";"1";"3060918930674700_127480635568034";"data";"data.*";"fetched (200)";"2021-08-10 12:52:34.348167";"Facebook:/<post-id>/comments";"que se la pongan los políticos y asídan ejemplo para todos los demás   y si va bien   ya nos  fijamos algo más !!";"2020-11-19T11:58:32+0000";"0";"";""
"1";"1085";"1";"3060918930674700_135171931323215";"data";"data.*";"fetched (200)";"2021-08-10 12:52:34.348167";"Facebook:/<post-id>/comments";"Para mi está claro. Se culpa al covid pero nos están dando caña con otra cosa mucho peor. Aprovecharán todo esto para recortarnos más libertades, en nombre de nuestra salud. De hecho ya lo están haciendo. Un atentado de falsa bandera. Más viejo que mear contra un muro";"2020-11-19T11:59:05+0000";"1";"";""
"1";"1086";"1";"3060918930674700_127481585567939";"data";"data.*";"fetched (200)";"2021-08-10 12:52:34.348167";"Facebook:/<post-id>/comments";"https://m.facebook.com/story.php?story_fbid=3445442582213956&id=100002447433714";"2020-11-19T12:00:40+0000";"1";"";""
"1";"1087";"1";"3060918930674700_127482415567856";"data";"data.*";"fetched (200)";"2021-08-10 12:52:34.348167";"Facebook:/<post-id>/comments";"Que lo prueben con los políticos españoles que seguro que por mucho que digan no se vacuna ni uno hasta que este mas que demostrado sus efectos secundarios y efectividad...";"2020-11-19T12:01:58+0000";"0";"";""
"1";"1088";"1";"3060918930674700_127483008901130";"data";"data.*";"fetched (200)";"2021-08-10 12:52:34.348167";"Facebook:/<post-id>/comments";"Full Spiteri en la pagina del foro económico mundial ya lo puedes ver. The Great Reset. Están creando un colapso intencionado de la economía para implantar un nuevo sistema socioeconómico, el Nuevo Orden Mundial. Pero señores del ministerio de sanidad os puedo asegurar que no os lo vamos a permitir. ¿ Habéis leído? Que os quede bien claro.";"2020-11-19T12:03:27+0000";"1";"";""
"1";"1089";"1";"3060918930674700_135174637989611";"data";"data.*";"fetched (200)";"2021-08-10 12:52:34.348167";"Facebook:/<post-id>/comments";"La evolución de los balconazis de quédatencasa sí. Ahora será ""vacunate por tus seres queridos"" o algún slogan vomitivo similar";"2020-11-19T12:04:43+0000";"7";"";""
"1";"1090";"1";"3060918930674700_127483708901060";"data";"data.*";"fetched (200)";"2021-08-10 12:52:34.348167";"Facebook:/<post-id>/comments";"Belen Martin  vaya tontería has escrito. Pero tú que te crees que somos jovencitas irresponsables? Pues es todo lo contrario, yo tengo hijos y nietos y precisamente por ellos, no me voy a quedar en el sofá viendo como les destruyen. Y que cuando legue el momento me pregunten qué hice por ellos para estar así. Que les diría?. Buenl, yo hice lo que me decían, fuí obediente. Pues va a ser que no. ";"2020-11-19T12:05:04+0000";"1";"";""
"1";"1091";"1";"3060918930674700_135175857989489";"data";"data.*";"fetched (200)";"2021-08-10 12:52:34.348167";"Facebook:/<post-id>/comments";"En cualquier caso, gracias a esta operación de hipnosis colectiva mundial todos somos  potenciales armas letales. Por muy sano que te creas puedes matar a todo tu barrio. Antivacunas, los nuevos terroristas 😂";"2020-11-19T12:07:21+0000";"5";"";""
"1";"1092";"1";"3060918930674700_127484778900953";"data";"data.*";"fetched (200)";"2021-08-10 12:52:34.348167";"Facebook:/<post-id>/comments";"";"2020-11-19T12:07:44+0000";"0";"";""
"1";"1093";"1";"3060918930674700_135176007989474";"data";"data.*";"fetched (200)";"2021-08-10 12:52:34.348167";"Facebook:/<post-id>/comments";"Jose Lopez Lopez creen en conspiraciones pero no en la ciencia. La indigencia intelectual está a la orden del día.  Estos "" expertos"" son  licenciados en  ""todismo"" y no saben ni donde poner la h. ";"2020-11-19T12:07:47+0000";"2";"";""
"1";"1094";"1";"3060918930674700_127485148900916";"data";"data.*";"fetched (200)";"2021-08-10 12:52:34.348167";"Facebook:/<post-id>/comments";"PRIMEROS LOS POLÍTICOS Y TODOS LOS CERCANOS A ELLOS.... Y SI NO REVIENTAN.... YA VEREMOS...";"2020-11-19T12:08:29+0000";"0";"";""
"1";"1095";"1";"3060918930674700_135176494656092";"data";"data.*";"fetched (200)";"2021-08-10 12:52:34.348167";"Facebook:/<post-id>/comments";"Cambiad la cantinela de vez en cuando.";"2020-11-19T12:08:44+0000";"0";"";""
"1";"1096";"1";"3060918930674700_135176527989422";"data";"data.*";"fetched (200)";"2021-08-10 12:52:34.348167";"Facebook:/<post-id>/comments";"Tal cual ";"2020-11-19T12:08:48+0000";"0";"";""
"1";"1097";"1";"3060918930674700_127487805567317";"data";"data.*";"fetched (200)";"2021-08-10 12:52:34.348167";"Facebook:/<post-id>/comments";"In Spanien kein Wunder, hier können sie richtig Gas geben. Auszug aus meinem Buch: Am 20. März scharte Pedro Sánchez ein „hochkarätiges“ Team um sich, das ihn in Corona-Fragen beraten sollte. Dieses Komitee, bestehend aus sechs Wissenschaftlern von nationalem und internationalem Renommee, wie die Tageszeitungen pflichteifrig berichteten, werde vom Direktor des Centro de Coordinación de Alertas y Emergencias Sani-tarias (CCAES), Fernando Simón, geleitet. Auch zuvor hätten diese Wissenschaftler dem Staatsoberhaupt und Gesundheitsminister Salvador Illa bereits mit guten Ratschlägen zur Seite gestanden. Ich schaute mir die Expertenliste genauer an. Zu diesem Team gehörten Epidemiologen und Virologen aus Madrid, Barcelona oder Valencia, ein Professor für Biostatistik der öffentlichen Gesundheitsschule an der Harvard-Universität und – da kam ich aus dem Staunen gar nicht mehr raus – der Verantwortliche des amtlichen Arzneimittelkontrolllabors für Produkte wie Impfstoffe und Blutprodukte der spanischen Agentur AEMPS, Agustín Portela Moreira. Hatte man da nicht den Bock zum Gärtner gemacht? Könnte man nicht von Interessenskonflikten sprechen? War Big Pharma nicht viel zu nah am Beratungsstab? In Spanien überhaupt kein Problem, solche „Zufälle“ sind möglich. ";"2020-11-19T12:14:17+0000";"0";"";""
"1";"1098";"1";"3060918930674700_127488698900561";"data";"data.*";"fetched (200)";"2021-08-10 12:52:34.348167";"Facebook:/<post-id>/comments";"Y luego la Fase 5";"2020-11-19T12:16:20+0000";"0";"";""
"1";"1099";"1";"3060918930674700_127489108900520";"data";"data.*";"fetched (200)";"2021-08-10 12:52:34.348167";"Facebook:/<post-id>/comments";"Michael J Fox segurissimo que no...🤣";"2020-11-19T12:17:06+0000";"0";"";""
"1";"1100";"1";"3060918930674700_127490342233730";"data";"data.*";"fetched (200)";"2021-08-10 12:52:34.348167";"Facebook:/<post-id>/comments";"Miriam Moreno García... Y luego direis que ellos tienen preferencias, lo que digo menudo pais lleno de gente sin neuronas... Te vas a quedar sin el chip?? 😂😂😂😂😂😂";"2020-11-19T12:19:12+0000";"4";"";""
"1";"1101";"1";"3060918930674700_135183141322094";"data";"data.*";"fetched (200)";"2021-08-10 12:52:34.348167";"Facebook:/<post-id>/comments";"A mi personalmente me parecería muy bien que los primeros en probarla fueran los políticos,como también son los primeros en hacer las pruebas pcr siempre que quieren mientras a los demás como poco y con suerte te la hacen a los diez días de estar con un contacto directo";"2020-11-19T12:22:48+0000";"4";"";""
"1";"1102";"1";"3060918930674700_135183811322027";"data";"data.*";"fetched (200)";"2021-08-10 12:52:34.348167";"Facebook:/<post-id>/comments";"Pues yo soy de riesgo y me pienso vacunar";"2020-11-19T12:24:23+0000";"0";"";""
"1";"1103";"1";"3060918930674700_127496325566465";"data";"data.*";"fetched (200)";"2021-08-10 12:52:34.348167";"Facebook:/<post-id>/comments";"A poner la vacuna en el culo de los políticos genocidas";"2020-11-19T12:31:11+0000";"0";"";""
"1";"1104";"1";"3060918930674700_127496688899762";"data";"data.*";"fetched (200)";"2021-08-10 12:52:34.348167";"Facebook:/<post-id>/comments";"Esther López para tener respeto por la política los políticos tienen que tener respeto por el pueblo. El día que hagan política entonces aplaudiremos y serán respetados, mientras haya asesinos y ladrones gobernando  seguiremos tomándonos todo a cachondeo... Así nos va.... ";"2020-11-19T12:31:49+0000";"2";"";""
"1";"1105";"1";"3060918930674700_135187541321654";"data";"data.*";"fetched (200)";"2021-08-10 12:52:34.348167";"Facebook:/<post-id>/comments";"Alicia Wonderland de que bozal..!!!?";"2020-11-19T12:32:13+0000";"0";"";""
"1";"1106";"1";"3060918930674700_127496938899737";"data";"data.*";"fetched (200)";"2021-08-10 12:52:34.348167";"Facebook:/<post-id>/comments";"Los primeros deberían ser los políticos a ver que tal";"2020-11-19T12:32:21+0000";"0";"";""
"1";"1107";"1";"164716453628310_3060918930674700";"offcut";"";"fetched (200)";"2021-08-10 12:52:34.348167";"Facebook:/<post-id>/comments";"";"";"";"";""
"1";"1108";"1";"164716453628310_3060918930674700";"headers";"";"fetched (200)";"2021-08-10 12:52:34.348167";"Facebook:/<post-id>/comments";"";"";"";"";""
"1";"1109";"1";"3060918930674700_135187787988296";"data";"data.*";"fetched (200)";"2021-08-10 12:52:34.825377";"Facebook:/<post-id>/comments";"Fina Joyanes yo si me voy a poner la vacuna como voluntario pero no por el gobierno. Te has informado sobre la vacuna?? ";"2020-11-19T12:32:45+0000";"0";"";""
"1";"1110";"1";"3060918930674700_135188027988272";"data";"data.*";"fetched (200)";"2021-08-10 12:52:34.825377";"Facebook:/<post-id>/comments";"Cuántos gili*****s hay y se creen eminencias en Virologia. Qué pena millones de gorriones desaparecidos, pero los Idiotas son cómo las cucarachas.";"2020-11-19T12:33:17+0000";"2";"";""
"1";"1111";"1";"3060918930674700_127498045566293";"data";"data.*";"fetched (200)";"2021-08-10 12:52:34.825377";"Facebook:/<post-id>/comments";"Espero que no salga como lo del cohete.";"2020-11-19T12:34:36+0000";"0";"";""
"1";"1112";"1";"3060918930674700_135189144654827";"data";"data.*";"fetched (200)";"2021-08-10 12:52:34.825377";"Facebook:/<post-id>/comments";"María Xestal Vidal no te fíes k seguro les ponen placebo y dicen k es la vacuna te digo yo los veo por la tele poniéndose la vacuna y no me lo trago";"2020-11-19T12:35:42+0000";"0";"";""
"1";"1113";"1";"3060918930674700_127500765566021";"data";"data.*";"fetched (200)";"2021-08-10 12:52:34.825377";"Facebook:/<post-id>/comments";"Esther López vete al carajo tú, tú elegancia y tus modales, ah! Y tú puto gobierno mentiroso comunista. Un saludete paniaguada";"2020-11-19T12:40:25+0000";"2";"";""
"1";"1114";"1";"3060918930674700_135192021321206";"data";"data.*";"fetched (200)";"2021-08-10 12:52:34.825377";"Facebook:/<post-id>/comments";"Primero que se vacunen los políticos";"2020-11-19T12:41:40+0000";"0";"";""
"1";"1115";"1";"3060918930674700_127501518899279";"data";"data.*";"fetched (200)";"2021-08-10 12:52:34.825377";"Facebook:/<post-id>/comments";"Veronica Alvarez Lopez ¡¡¡¡¡ TOTALMENTE DE ACUERDO, Y MI CONSEJO ES QUE LOS PENSIONISTAS, Y EN SU DEFECTO LOS FAMILIARES DE ELLOS, NO NOS DEJEMOS ENGAÑAR, YA SON MUCHOS LOS QUE SE HAN """"IDO"""" EN VENEFICIO DE QUIEN SE BENEFICIA DE ESAS PENSIONES QUE YA NO TIENEN QUE PAGAR Y QUE APROVECHAN PARA AUMENTAR EL NUMERO DE SERVILISTAS A CUALQUIER PRECIO. !!!!!!!!!!";"2020-11-19T12:41:55+0000";"2";"";""
"1";"1116";"1";"3060918930674700_135193211321087";"data";"data.*";"fetched (200)";"2021-08-10 12:52:34.825377";"Facebook:/<post-id>/comments";"Primero que se la inyecten los gobernantes .pero que se la pongan en directo retransmitido en todas las cadenas de TV y después ya me lo pensaré ......que lo.dudo";"2020-11-19T12:44:12+0000";"0";"";""
"1";"1117";"1";"3060918930674700_1050655298731189";"data";"data.*";"fetched (200)";"2021-08-10 12:52:34.825377";"Facebook:/<post-id>/comments";"Viktoria Corradi Shvoren pero nunca hubo una pandemia planetaria como hoy y ya estoy hasta el gorro de antivacunas. Saludos";"2020-11-19T12:50:49+0000";"1";"";""
"1";"1118";"1";"3060918930674700_1050657942064258";"data";"data.*";"fetched (200)";"2021-08-10 12:52:34.825377";"Facebook:/<post-id>/comments";"Vange Gutierrez no se si a ti te ha pasado que te la hicieran a los 10 días . Ha mi me la hicieron el mismo día . ";"2020-11-19T12:55:58+0000";"1";"";""
"1";"1119";"1";"3060918930674700_1050658198730899";"data";"data.*";"fetched (200)";"2021-08-10 12:52:34.825377";"Facebook:/<post-id>/comments";"me apunto...pero hoy no!!!...MAÑAAAAAANA!";"2020-11-19T12:56:24+0000";"0";"";""
"1";"1120";"1";"3060918930674700_1050658728730846";"data";"data.*";"fetched (200)";"2021-08-10 12:52:34.825377";"Facebook:/<post-id>/comments";"";"2020-11-19T12:57:27+0000";"0";"";""
"1";"1121";"1";"3060918930674700_182720616781362";"data";"data.*";"fetched (200)";"2021-08-10 12:52:34.825377";"Facebook:/<post-id>/comments";"Javier Otero Fuentes y te parecerá normal e ilícito tu argumento!!! Madre mía... Te habran educado con premio-castigo y lo habrás normalizado de tal forma que dices barbaridades sin parpadear. Nada, tu vacúnate que llegado el caso, cuando efectivamente no nos dejen ejercer nuestro derecho de libre movimiento, de respirar sin bozal saldremos a la calle. Lo triste es q esto ya está sucediendo y este país de mierda no reacciona en masa aún... Llegará!";"2020-11-19T12:58:28+0000";"5";"";""
"1";"1122";"1";"3060918930674700_182721386781285";"data";"data.*";"fetched (200)";"2021-08-10 12:52:34.825377";"Facebook:/<post-id>/comments";"Que se la pongan primero todos los políticos de cada país, uno detrás de otro y luego nos cuenten😉";"2020-11-19T13:00:01+0000";"1";"";""
"1";"1123";"1";"3060918930674700_1050662692063783";"data";"data.*";"fetched (200)";"2021-08-10 12:52:34.825377";"Facebook:/<post-id>/comments";"Adila Rodriguez Rubio no metas el tema de pensiones, nada tiene que ver. Como pensionista NO ACEPTO QUE SE ME UTILICE PARA NADA. No tiene sentido la comparación ";"2020-11-19T13:04:55+0000";"0";"";""
"1";"1124";"1";"3060918930674700_182725466780877";"data";"data.*";"fetched (200)";"2021-08-10 12:52:34.825377";"Facebook:/<post-id>/comments";"Creo q puesto dicen los políticos que será segura y efectiva, pues q se la. Pongan ellos los primero .🙄 No sabe uno a q atenerse cada científico dice una cosa diferente !!! A quien creemos!!!???🤷🤦esto no hay quien lo entienda.";"2020-11-19T13:06:13+0000";"0";"";""
"1";"1125";"1";"3060918930674700_1050664038730315";"data";"data.*";"fetched (200)";"2021-08-10 12:52:34.825377";"Facebook:/<post-id>/comments";"Carlos Dyze   ¡Joder¡ No tienes ni idea de ciencia ni tampoco de geografía.   El senado de Bolivia estudiaba el uso del dióxido de cloro para la COVID e inmediatamente el Ministerio de Salud reaccionó en contra, ya desde antes de su aprobación en Julio. https://pbs.twimg.com/media/EbfK4BrX0AE83Fq?format=jpg&name=large  Insistes con una noticia de La Paz (no de toda Bolivia) fechada en septiembre. Aquí tienes la reacción, octubre, del Ministerio de Sanidad ratificando la prohibición en todo el territorio nacional de Bolivia. https://es.scribd.com/document/480671906/Comunicado-del-Ministerio-de-Salud-de-Bolivia#from_embed";"2020-11-19T13:07:01+0000";"0";"";""
