"level";"id";"parent_id";"object_id";"object_type";"object_key";"query_status";"query_time";"query_type";"message";"created_time";"like_count";"comment_count";"error.message"
"1";"990";"1";"3643723515727569_3644448492321738";"data";"data.*";"fetched (200)";"2021-08-04 13:29:49.694093";"Facebook:/<post-id>/comments";"Eva Arniello Costa  Vuelve a leer el artículo el tratamiento no la vacuna que gana de marear la perdiz";"2021-06-21T13:23:07+0000";"0";"";""
"1";"991";"1";"3643723515727569_3644448548988399";"data";"data.*";"fetched (200)";"2021-08-04 13:29:49.694093";"Facebook:/<post-id>/comments";"Pues espero que espabilen en mi pueblo  Cerca de un mes lleva mi hermano pidiendo cita y yo igual.No estamos vacunados";"2021-06-21T13:23:10+0000";"0";"";""
"1";"992";"1";"3643723515727569_3644449305654990";"data";"data.*";"fetched (200)";"2021-08-04 13:29:49.694093";"Facebook:/<post-id>/comments";"Tomas Martin que no son vacunas ...que no os enteráis ..🤦🏻‍♀️";"2021-06-21T13:23:32+0000";"2";"";""
"1";"993";"1";"3643723515727569_3644450178988236";"data";"data.*";"fetched (200)";"2021-08-04 13:29:49.694093";"Facebook:/<post-id>/comments";"Celeste Aguilar la María da vergüenza ajena, seguro es de las que está dispuesta a vacunar a los niños con todo lo que han sufrido psicológicamente por estos borregos, para salvar su culo, así son, por el bien común, no, es por el miedo que tienen a la muerte.";"2021-06-21T13:23:53+0000";"0";"";""
"1";"994";"1";"3643723515727569_3644450848988169";"data";"data.*";"fetched (200)";"2021-08-04 13:29:49.694093";"Facebook:/<post-id>/comments";"Lidia Ridao Enri es lo que hay, a mi hoy me han dicho que porque tienen de buscar la información ";"2021-06-21T13:24:10+0000";"0";"";""
"1";"995";"1";"3643723515727569_3644450928988161";"data";"data.*";"fetched (200)";"2021-08-04 13:29:49.694093";"Facebook:/<post-id>/comments";"MArtina Cn yo tengo 38 ,mi hermano 42 y tampoco podemos coger citas";"2021-06-21T13:24:12+0000";"0";"";""
"1";"996";"1";"3643723515727569_3644451428988111";"data";"data.*";"fetched (200)";"2021-08-04 13:29:49.694093";"Facebook:/<post-id>/comments";"María José Aldrey Benito En mi familia hay de todo. Mi hija le toco Astra Zeneca y el primer dia tuvo algo de indisposición, pero a la segunda dosis, nada. A mi me administraron la Phizer y nada.";"2021-06-21T13:24:20+0000";"0";"";""
"1";"997";"1";"3643723515727569_3644452565654664";"data";"data.*";"fetched (200)";"2021-08-04 13:29:49.694093";"Facebook:/<post-id>/comments";"Sandra Samarra Capilla Si lo dice la diputada de Vox ya está todo dicho ";"2021-06-21T13:24:52+0000";"0";"";""
"1";"998";"1";"3643723515727569_3644454198987834";"data";"data.*";"fetched (200)";"2021-08-04 13:29:49.694093";"Facebook:/<post-id>/comments";"Muchas vacunas, pero en Madrid lleva mucho retraso. Por qué?";"2021-06-21T13:25:30+0000";"4";"";""
"1";"999";"1";"164716453628310_3643723515727569";"offcut";"";"fetched (200)";"2021-08-04 13:29:49.694093";"Facebook:/<post-id>/comments";"";"";"";"";""
"1";"1000";"1";"164716453628310_3643723515727569";"headers";"";"fetched (200)";"2021-08-04 13:29:49.694093";"Facebook:/<post-id>/comments";"";"";"";"";""
"1";"1001";"1";"3643723515727569_3644454295654491";"data";"data.*";"fetched (200)";"2021-08-04 13:29:50.222790";"Facebook:/<post-id>/comments";"Carolina Barceloperez jajajak, cuanto negacionista hay ";"2021-06-21T13:25:32+0000";"0";"";""
"1";"1002";"1";"3643723515727569_184119543649594";"data";"data.*";"fetched (200)";"2021-08-04 13:29:50.222790";"Facebook:/<post-id>/comments";"En el centre de salud me han dicho que sé puede poner gasta las 16 semanas  la vacuna Astrazeneca";"2021-06-21T13:25:56+0000";"0";"";""
"1";"1003";"1";"3643723515727569_184119700316245";"data";"data.*";"fetched (200)";"2021-08-04 13:29:50.222790";"Facebook:/<post-id>/comments";"Jose Maria García Merino Le serviria mas de ayuda, llamar por telefono y que le den hora.";"2021-06-21T13:26:18+0000";"0";"";""
"1";"1004";"1";"3643723515727569_184119860316229";"data";"data.*";"fetched (200)";"2021-08-04 13:29:50.222790";"Facebook:/<post-id>/comments";"Hola";"2021-06-21T13:26:45+0000";"0";"";""
"1";"1005";"1";"3643723515727569_203921804819759";"data";"data.*";"fetched (200)";"2021-08-04 13:29:50.222790";"Facebook:/<post-id>/comments";"Manu LG a muerto muchísima gente joven no solo han muerto personas mayores y aunque los q mueran sean personas mayores no es justo ellos son los q han levantado este país de verdad los verdaderos luchadores no lo q ahí hoy en día….si están tan leve no se yo por q nos encerraron, se montó IFEMA se acabaron no había respiradores etc y no vale decir q es q este país no está preparado para nada por q ningún país está preparad para esto,,,,,, ";"2021-06-21T13:26:45+0000";"0";"";""
"1";"1006";"1";"3643723515727569_184119976982884";"data";"data.*";"fetched (200)";"2021-08-04 13:29:50.222790";"Facebook:/<post-id>/comments";"Faltan más dosis .. tengo 65 y solo una dosis de Astra zeneca";"2021-06-21T13:26:53+0000";"0";"";""
"1";"1007";"1";"3643723515727569_184120303649518";"data";"data.*";"fetched (200)";"2021-08-04 13:29:50.222790";"Facebook:/<post-id>/comments";"Meteosla por donde os quepa.estafadores";"2021-06-21T13:27:32+0000";"1";"";""
"1";"1008";"1";"3643723515727569_184120386982843";"data";"data.*";"fetched (200)";"2021-08-04 13:29:50.222790";"Facebook:/<post-id>/comments";"María Pilar Saiz Vadillo en cambio a mi todavía no me han puesto la 2 dosis de astra tb en Burgos y ya me toca";"2021-06-21T13:27:41+0000";"0";"";""
"1";"1009";"1";"3643723515727569_184120423649506";"data";"data.*";"fetched (200)";"2021-08-04 13:29:50.222790";"Facebook:/<post-id>/comments";"Aureliano Gómez Barrancos Esacto ,en la segunda dosis,da menos problemas,que Pfizzer.";"2021-06-21T13:27:45+0000";"0";"";""
"1";"1010";"1";"3643723515727569_203922624819677";"data";"data.*";"fetched (200)";"2021-08-04 13:29:50.222790";"Facebook:/<post-id>/comments";"Raquel Díaz Hernández si";"2021-06-21T13:28:36+0000";"0";"";""
"1";"1011";"1";"3643723515727569_184120956982786";"data";"data.*";"fetched (200)";"2021-08-04 13:29:50.222790";"Facebook:/<post-id>/comments";"MArtina Cn yo vivo em Andalucía y col 40ya me am puesto la primera";"2021-06-21T13:28:40+0000";"0";"";""
"1";"1012";"1";"3643723515727569_203922694819670";"data";"data.*";"fetched (200)";"2021-08-04 13:29:50.222790";"Facebook:/<post-id>/comments";"LOS TRIBUNALES OS ESPERAN, OMS, BANDA KRIMINAL";"2021-06-21T13:28:46+0000";"3";"";""
"1";"1013";"1";"3643723515727569_184121590316056";"data";"data.*";"fetched (200)";"2021-08-04 13:29:50.222790";"Facebook:/<post-id>/comments";"Vacuna experimental para los niños por el bien común, No de eso nada, por egoismo puro, el que crea que se debe vacunar a los niños es porque es una persona cobarde tiene miedo a la muerte y quiere salvar su culo a cuenta de los niños que no padecen la enfermedad de forma grave, a saber que consecuencias podría traer la vacuna para esos niños, que vergüenza de humanidad.";"2021-06-21T13:29:53+0000";"3";"";""
"1";"1014";"1";"3643723515727569_184121593649389";"data";"data.*";"fetched (200)";"2021-08-04 13:29:50.222790";"Facebook:/<post-id>/comments";"Carmen Valero Villena Son las televisiones y los medios de comunicación, comprados por el Gobierno los que meten miedo. El miedo bloquea y no deja pensar te lleva hasta enfermar, no sé cómo no te has dado cuenta todavía, qué el virus son los políticos y las televisiones. ";"2021-06-21T13:29:54+0000";"2";"";""
"1";"1015";"1";"3643723515727569_184121740316041";"data";"data.*";"fetched (200)";"2021-08-04 13:29:50.222790";"Facebook:/<post-id>/comments";"Africa Salva que los casos de trombos han sido a gente menor de 60, y casi todos los casos mujeres, por lo tanto esa vacuna se usa a partir de 60 para minimizar riesgos ";"2021-06-21T13:30:12+0000";"3";"";""
"1";"1016";"1";"3643723515727569_184122016982680";"data";"data.*";"fetched (200)";"2021-08-04 13:29:50.222790";"Facebook:/<post-id>/comments";"Enrique Fernandez Martinez  🤣🤣🤣🤣🤣! Y pa que contestas?? Vete a que te mediquen y deja el Facebook anda. ";"2021-06-21T13:30:40+0000";"3";"";""
"1";"1017";"1";"3643723515727569_184122376982644";"data";"data.*";"fetched (200)";"2021-08-04 13:29:50.222790";"Facebook:/<post-id>/comments";"Carmen Martinez Garcia 👏👏👏👏👏👏👏👏por fin alguien q investiga un poco, aki no hay más q gente cerrada y con poco ánimo de investigar, ya queda poco para q saquen la ""cepa nepalí"" y nos vuelvan a crugir mientras siguen inoculado y exparciendo proteínas de espiga, yo ahora me intento mantener alejada de los vacunados porq serán los q nos infecten al resto aunq la mayoría sigan pensando lo contrario. Parece q nadie ve más allá de lo q dicen en la tele, muy triste 🤦";"2021-06-21T13:31:33+0000";"2";"";""
"1";"1018";"1";"3643723515727569_184123173649231";"data";"data.*";"fetched (200)";"2021-08-04 13:29:50.222790";"Facebook:/<post-id>/comments";"Txingurri Txingu Ariza Soto Yo lo que me pregunto es...si tan jodido es el virus, por qué dejaron los aeropuertos abiertos? si tan jodido es, porque no hacían una triste autopsia? que solo las realizaron a partir de Noviembre del año pasado, por la presión de una parte de médicos forenses? Muchos murieron por los protocolos seguidos, muchos otros por la falta de atención primaria... Partiendo de que no hacían autopsias, de que cerraban plantas enteras de otras patologías para meter camas UCI para frenar el covid sin llenarlas, quién me dice a mí que esas cifras no se han inflado con muertos de otras patologías y siendo apuntados como muertos por covid? ";"2021-06-21T13:33:12+0000";"0";"";""
"1";"1019";"1";"3643723515727569_203924721486134";"data";"data.*";"fetched (200)";"2021-08-04 13:29:50.222790";"Facebook:/<post-id>/comments";"Y los universitarios y veinteañeros , cuando?";"2021-06-21T13:33:21+0000";"2";"";""
"1";"1020";"1";"3643723515727569_203925138152759";"data";"data.*";"fetched (200)";"2021-08-04 13:29:50.222790";"Facebook:/<post-id>/comments";"No me fio.. no quiero la vacuna";"2021-06-21T13:34:14+0000";"9";"";""
"1";"1021";"1";"3643723515727569_203925281486078";"data";"data.*";"fetched (200)";"2021-08-04 13:29:50.222790";"Facebook:/<post-id>/comments";"Mireia Long y tú qué bióloga a que también vacunarias a los niños por el bien común? El egoísmo común de salvar vuestro culo por el miedo que os metió la tv diría yo.";"2021-06-21T13:34:29+0000";"0";"";""
"1";"1022";"1";"3643723515727569_184123936982488";"data";"data.*";"fetched (200)";"2021-08-04 13:29:50.222790";"Facebook:/<post-id>/comments";"Avi Cachafeiro Do Barro A ver si dejáis de molestar a la gente que sí que quiera vacunarse y no digáis chorradas de descerebrados";"2021-06-21T13:35:02+0000";"0";"";""
"1";"1023";"1";"3643723515727569_184123963649152";"data";"data.*";"fetched (200)";"2021-08-04 13:29:50.222790";"Facebook:/<post-id>/comments";"https://m.facebook.com/story.php?story_fbid=4435237619842803&id=100000698253625";"2021-06-21T13:35:04+0000";"0";"";""
"1";"1024";"1";"3643723515727569_184124176982464";"data";"data.*";"fetched (200)";"2021-08-04 13:29:50.222790";"Facebook:/<post-id>/comments";"Yo tambien quiero vacunar me de verdad";"2021-06-21T13:35:34+0000";"0";"";""
"1";"1025";"1";"3643723515727569_184124723649076";"data";"data.*";"fetched (200)";"2021-08-04 13:29:50.222790";"Facebook:/<post-id>/comments";"Ani Redondo 👍👍👍";"2021-06-21T13:36:45+0000";"0";"";""
"1";"1026";"1";"164716453628310_3643723515727569";"offcut";"";"fetched (200)";"2021-08-04 13:29:50.222790";"Facebook:/<post-id>/comments";"";"";"";"";""
"1";"1027";"1";"164716453628310_3643723515727569";"headers";"";"fetched (200)";"2021-08-04 13:29:50.222790";"Facebook:/<post-id>/comments";"";"";"";"";""
"1";"1028";"1";"3643723515727569_203926264819313";"data";"data.*";"fetched (200)";"2021-08-04 13:29:50.900401";"Facebook:/<post-id>/comments";"Elena Bga la vacuna es experimental, ellos no se van a hacer responsable, pero usted sea responsable y obedezca, de un virus que no ha sido encontrado ni fotografiado, qué es super inteligente, sabe cuando te levantaste de la silla de un bar, sabe de cuántos nos juntamos, hasta sabe de horarios. ";"2021-06-21T13:36:55+0000";"2";"";""
"1";"1029";"1";"3643723515727569_184125466982335";"data";"data.*";"fetched (200)";"2021-08-04 13:29:50.900401";"Facebook:/<post-id>/comments";"María José Aldrey Benito tu médico de cabecera tiene que mandar el informe médico a la Consejería de Sanidad y te vacunan con la mejor para ti";"2021-06-21T13:38:07+0000";"3";"";""
"1";"1030";"1";"3643723515727569_203927021485904";"data";"data.*";"fetched (200)";"2021-08-04 13:29:50.900401";"Facebook:/<post-id>/comments";"Vanesa Escribano Cabezuelo Pero si te dicen que para apaciguar los síntomas de la vacuna, te tomes uno, te lo tomas... Todo muy de sentido común...es tan malo el ibu como la vacuna, pero me pongo tibio de ambas cosas... Yo esperaré a después del invierno...No hay más que ver como están en Chile, con el 70% de vacunados...";"2021-06-21T13:38:54+0000";"0";"";""
"1";"1031";"1";"3643723515727569_184125930315622";"data";"data.*";"fetched (200)";"2021-08-04 13:29:50.900401";"Facebook:/<post-id>/comments";"UNA MIERDAAAAA ";"2021-06-21T13:39:12+0000";"0";"";""
"1";"1032";"1";"3643723515727569_184126113648937";"data";"data.*";"fetched (200)";"2021-08-04 13:29:50.900401";"Facebook:/<post-id>/comments";"Eva Arniello Costa  que yo sepa solo Noruega y Dinamarca han dejado de administrarla..  El resto de paises en Europa   continua con ella...   Y si no sabes  la distinción entre un medicamento o un fármaco y  una vacuna... pues   ya ni hablamos de que puedas comprender el articulo.. Te doy un ejemplo: el sida es un virus, aun no han logrado  una vacuna   que produzca inmunidad,  sin embargo si que existen  fármacos y medicamentos  eficaces y  aùn, sin vacuna, ha pasado de ser  una enfermedad mortal,  como lo era  en los primeros años  de su aparicion,  a  poder llevar una vida practicamente normal   siendo un enfermo de sida.  En resumen.. vuelve a leer el articulo que se refiere ensayos de farmacos   en No Vacunados..no tiene nada que ver con la vacuna.";"2021-06-21T13:39:39+0000";"0";"";""
"1";"1033";"1";"3643723515727569_203927358152537";"data";"data.*";"fetched (200)";"2021-08-04 13:29:50.900401";"Facebook:/<post-id>/comments";"María José Aldrey Benito póntelo ya";"2021-06-21T13:39:52+0000";"0";"";""
"1";"1034";"1";"3643723515727569_184126540315561";"data";"data.*";"fetched (200)";"2021-08-04 13:29:50.900401";"Facebook:/<post-id>/comments";"Mentiroso";"2021-06-21T13:40:40+0000";"0";"";""
"1";"1035";"1";"3643723515727569_184127080315507";"data";"data.*";"fetched (200)";"2021-08-04 13:29:50.900401";"Facebook:/<post-id>/comments";"Dany Fernández Sánchez TU él primero";"2021-06-21T13:41:54+0000";"0";"";""
"1";"1036";"1";"3643723515727569_203928304819109";"data";"data.*";"fetched (200)";"2021-08-04 13:29:50.900401";"Facebook:/<post-id>/comments";"Paloma del Cerro si quieres elegir a la carta te recomiendo que vayas a un restaurante";"2021-06-21T13:42:04+0000";"2";"";""
"1";"1037";"1";"3643723515727569_184127256982156";"data";"data.*";"fetched (200)";"2021-08-04 13:29:50.900401";"Facebook:/<post-id>/comments";"Manuela Marin Suarez ";"2021-06-21T13:42:17+0000";"0";"";""
"1";"1038";"1";"3643723515727569_203928391485767";"data";"data.*";"fetched (200)";"2021-08-04 13:29:50.900401";"Facebook:/<post-id>/comments";"Yo tengo casi 64 años, soy de riesgo debido a mis patologías, entre ellas una TVP, una embolia pulmonar y además tengo un factor de la coagulación alterado, tomo anticoagulantes desde el año 98, me han llamado dos veces para la Astrazeneca, una coincidía con un TAC con contraste para la revisión de un cáncer, tengo un informe que aconsejar se me ponga otra vacuna, he llamado a Sanidad y al Centro de Salud y de nuevo estoy a la espera de hablar por tercera vez con mi médico a ver si me vacunan, voy a trabajar, a comprar y a veces cuido a mis nietos, tengo miedo de contagio";"2021-06-21T13:42:17+0000";"0";"";""
"1";"1039";"1";"3643723515727569_203928601485746";"data";"data.*";"fetched (200)";"2021-08-04 13:29:50.900401";"Facebook:/<post-id>/comments";"Me río yo de esta noticia llevo más de dos semanas llamando por teléfono y no ai cita por la app no ai cita por Clí Salud no ai cita así que como coño me vacunó y trabajo en un supermercado durante toda la pandemia esto es un descontrol ";"2021-06-21T13:42:43+0000";"0";"";""
"1";"1040";"1";"3643723515727569_184127700315445";"data";"data.*";"fetched (200)";"2021-08-04 13:29:50.900401";"Facebook:/<post-id>/comments";"Txingurri Txingu Ariza Soto Y vacunan a gente con anticuerpos, que ya lo han pasado...todo muy lógico.... Ya verás lo que va a producir un sobre exceso de anticuerpos en un organismo...Guarda el comentario y en Enero hablamos...";"2021-06-21T13:43:16+0000";"0";"";""
"1";"1041";"1";"3643723515727569_203928811485725";"data";"data.*";"fetched (200)";"2021-08-04 13:29:50.900401";"Facebook:/<post-id>/comments";"Rocio Garcia ole ole, ya van llegando otra vez";"2021-06-21T13:43:16+0000";"0";"";""
"1";"1042";"1";"3643723515727569_184127836982098";"data";"data.*";"fetched (200)";"2021-08-04 13:29:50.900401";"Facebook:/<post-id>/comments";"Maria Gutierrez si, pero no será un suicidio voluntario como el vuestro ni estamos con tanto puto miedo a vivir. Es más si este invierno no empiezan a caer vacunados como moscas (deseo q no)  entonces podría pensar qe equivoqué y no pasaría nada, habéis pensado q pasaría si los equivocados son los vacunados? para nosotros hay solución para vosotros no la habría, una vez pinchado no hay marcha atras";"2021-06-21T13:43:29+0000";"2";"";""
"1";"1043";"1";"3643723515727569_184127843648764";"data";"data.*";"fetched (200)";"2021-08-04 13:29:50.900401";"Facebook:/<post-id>/comments";"Maite Patiño Oliver y Cris Camuñas Estrada  ahí viene vuestra dosis 👏🏻👏🏻";"2021-06-21T13:43:30+0000";"0";"";""
"1";"1044";"1";"3643723515727569_203929144819025";"data";"data.*";"fetched (200)";"2021-08-04 13:29:50.900401";"Facebook:/<post-id>/comments";"Jose M. Tini exacto así es ";"2021-06-21T13:44:04+0000";"0";"";""
"1";"1045";"1";"3643723515727569_184128076982074";"data";"data.*";"fetched (200)";"2021-08-04 13:29:50.900401";"Facebook:/<post-id>/comments";"Manu LG ahí cosas q no se hicieron por estaban Colapsados,ni hay personal suficiente ni aquí ni en la China para hacer 1000 autopsias diarias es de lógica,y perdone q le diga a mi me han mandado fotos de Marzo del año pasado y había hasta 4 camas y 5 camas en la misma habitación la UCIS improvisadas no había respiradores etc usted cree q eso es inflar cifras ???? Usted a visto las cifras de Estados Unidos????en un día ??? Es totalmente al revés ellos intentaron desinflar cifras todavía hoy en día no se sabe ni los muertos reales q ha habido,no creo yo q al día mueran 500 personas en madres Barcelona o Sevilla porque ejemplo de cancer,paradas cardiacas etc era una pandemia 😷 lo queráis ver como lo queráis ver el virus es real existe y está hay, lo q pasa q hasta q no te coge de cerca y ves q no puedes respirar y te va a entubar por q ya tu cuerpo no da mas hasta q no pase eso ahí gente q no se lo cree y después si sales de esa sepárate a las secuelas q ahí personas q se han quedado jodid.. para toda su vida ";"2021-06-21T13:44:06+0000";"0";"";""
"1";"1046";"1";"3643723515727569_203929348152338";"data";"data.*";"fetched (200)";"2021-08-04 13:29:50.900401";"Facebook:/<post-id>/comments";"Delia Jimenez Ruiz totalmente 😩😩😩";"2021-06-21T13:44:32+0000";"0";"";""
"1";"1047";"1";"3643723515727569_184128300315385";"data";"data.*";"fetched (200)";"2021-08-04 13:29:50.900401";"Facebook:/<post-id>/comments";"A mi me vacunaron ayer la primera dosis de pzifer y m entró dolor de cabeza,mareo, fatiga ya eso pasó lo q más es el brazo y deseando mi segunda dosis";"2021-06-21T13:44:34+0000";"0";"";""
"1";"1048";"1";"3643723515727569_203929404818999";"data";"data.*";"fetched (200)";"2021-08-04 13:29:50.900401";"Facebook:/<post-id>/comments";"Alejandro Gonzalez Fernandez puedes dar motivos para decir tal insensatez,por que no encuentro a qué viene esa falta de respeto hacia esta persona!!";"2021-06-21T13:44:41+0000";"2";"";""
"1";"1049";"1";"3643723515727569_184128410315374";"data";"data.*";"fetched (200)";"2021-08-04 13:29:50.900401";"Facebook:/<post-id>/comments";"Madurga Joset la payasa de turno";"2021-06-21T13:44:48+0000";"0";"";""
"1";"1050";"1";"3643723515727569_184128460315369";"data";"data.*";"fetched (200)";"2021-08-04 13:29:50.900401";"Facebook:/<post-id>/comments";"Manu LG no perdona , estas muy equivocado lo que mandan es paracetamol no ibuprofeno 🤣🤣 ";"2021-06-21T13:44:51+0000";"0";"";""
"1";"1051";"1";"3643723515727569_184128503648698";"data";"data.*";"fetched (200)";"2021-08-04 13:29:50.900401";"Facebook:/<post-id>/comments";"Manuela Marin Suarez habra que seguir mirando";"2021-06-21T13:44:54+0000";"0";"";""
"1";"1052";"1";"3643723515727569_203929658152307";"data";"data.*";"fetched (200)";"2021-08-04 13:29:50.900401";"Facebook:/<post-id>/comments";"Raquel Díaz Hernández Yo también Pfizer";"2021-06-21T13:45:09+0000";"1";"";""
"1";"1053";"1";"164716453628310_3643723515727569";"offcut";"";"fetched (200)";"2021-08-04 13:29:50.900401";"Facebook:/<post-id>/comments";"";"";"";"";""
"1";"1054";"1";"164716453628310_3643723515727569";"headers";"";"fetched (200)";"2021-08-04 13:29:50.900401";"Facebook:/<post-id>/comments";"";"";"";"";""
"1";"1055";"1";"3643723515727569_184129163648632";"data";"data.*";"fetched (200)";"2021-08-04 13:29:50.900401";"Facebook:/<post-id>/comments";"Beni Nogales en serio???? 😡";"2021-06-21T13:45:14+0000";"0";"";""
"1";"1056";"1";"3643723515727569_203930021485604";"data";"data.*";"fetched (200)";"2021-08-04 13:29:50.900401";"Facebook:/<post-id>/comments";"Gertru Asamot es lo unico que sabe poner, tonterias";"2021-06-21T13:46:01+0000";"0";"";""
"1";"1057";"1";"3643723515727569_184129546981927";"data";"data.*";"fetched (200)";"2021-08-04 13:29:50.900401";"Facebook:/<post-id>/comments";"Tengo 61 años me quiero vacunar pero NO quiero ponerme la que me toca que es astrazenica, quiero ponerme Pfizer y no me dejan porfa no es lógico ni entendible cuando hay muchas personas que no se quieren poner ninguna, deseamos una solución porque como yo hay varias personas, en espera de alguna solución, gracias y Dios bendiga a toda persona que esta dirigiendo esta vacunación que Dios le de sabiduría de lo alto y haga lo correcto para todos";"2021-06-21T13:46:04+0000";"14";"";""
"1";"1058";"1";"3643723515727569_184129556981926";"data";"data.*";"fetched (200)";"2021-08-04 13:29:50.900401";"Facebook:/<post-id>/comments";"TG Burgos todo llega";"2021-06-21T13:46:06+0000";"0";"";""
"1";"1059";"1";"3643723515727569_203930858152187";"data";"data.*";"fetched (200)";"2021-08-04 13:29:50.900401";"Facebook:/<post-id>/comments";"Manu LG te equivocas amigo los anticuerpos después de haberte pasado COVID no están más de 4 o 5 meses en el cuerpo y eso si q te lo digo con mucha mucha experiencia por q me ha tocado muy muy de cerca, y por cierto no te vacunan hasta q no hayas pasado mínimo 6 meses después de haber pasado la enfermedad ";"2021-06-21T13:48:08+0000";"0";"";""
"1";"1060";"1";"3643723515727569_203930888152184";"data";"data.*";"fetched (200)";"2021-08-04 13:29:50.900401";"Facebook:/<post-id>/comments";"Txingurri Txingu Ariza Soto Y a mí que me cuentas!! ni que hubiese sido mi culpa el encerrarlos en residencias sin poder ver a sus familiares (psicológicamente es lo más rastrero que hay...) y con unos protocolos eugenistas del copón...";"2021-06-21T13:48:13+0000";"0";"";""
"1";"1061";"1";"3643723515727569_184130700315145";"data";"data.*";"fetched (200)";"2021-08-04 13:29:50.900401";"Facebook:/<post-id>/comments";"Amparo Marti Mafe igual, tenía 2 dosis para el día 29, anulada y sin saber nada.....";"2021-06-21T13:48:21+0000";"0";"";""
"1";"1062";"1";"3643723515727569_203930994818840";"data";"data.*";"fetched (200)";"2021-08-04 13:29:50.900401";"Facebook:/<post-id>/comments";"Mi  madre con 80 mi hermano con 56 y yo con  57 estamos vacunados de las dos dosis .Mi sobrino con 32 ya está apuntado para vacunarse somos  de un pueblo extremeño";"2021-06-21T13:48:34+0000";"0";"";""
"1";"1063";"1";"3643723515727569_203931021485504";"data";"data.*";"fetched (200)";"2021-08-04 13:29:50.900401";"Facebook:/<post-id>/comments";"En vuestras comunidades podéis pedir cita en la farmacia? En Zaragoza en mi barrio sí, y nos Dan las dos citas, hora  en el ambulatorio etc.";"2021-06-21T13:48:38+0000";"0";"";""
"1";"1064";"1";"3643723515727569_203931134818826";"data";"data.*";"fetched (200)";"2021-08-04 13:29:50.900401";"Facebook:/<post-id>/comments";"David Barcia Cerqueiro yo puse Astreneca y la 2 dosis el 8 de julio y aquí estoy y con enfermeda y a ti por rechazarla te tenían q6 vacunar la última";"2021-06-21T13:48:52+0000";"2";"";""
"1";"1065";"1";"3643723515727569_203931258152147";"data";"data.*";"fetched (200)";"2021-08-04 13:29:50.900401";"Facebook:/<post-id>/comments";"Jaime Piza Serra sí, como tú puta madre";"2021-06-21T13:49:12+0000";"0";"";""
