"level";"id";"parent_id";"object_id";"object_type";"object_key";"query_status";"query_time";"query_type";"message";"created_time";"like_count";"comment_count";"error.message"
"1";"525";"1";"3643723515727569_3644143485685572";"data";"data.*";"fetched (200)";"2021-08-04 13:29:40.960210";"Facebook:/<post-id>/comments";"Angie Bares ";"2021-06-21T10:32:20+0000";"2";"";""
"1";"526";"1";"3643723515727569_3644145442352043";"data";"data.*";"fetched (200)";"2021-08-04 13:29:40.960210";"Facebook:/<post-id>/comments";"Txingurri Txingu Ariza Soto por eso me he vacunado yo 😞 porque gracia no me hacía...pero menos gracia me hace la UCI 😭😭";"2021-06-21T10:33:36+0000";"3";"";""
"1";"527";"1";"3643723515727569_3644145859018668";"data";"data.*";"fetched (200)";"2021-08-04 13:29:40.960210";"Facebook:/<post-id>/comments";"Maria Garcia Cazorla yo estoy muy tranquila y con ganas de que me pongan la segunda";"2021-06-21T10:33:54+0000";"2";"";""
"1";"528";"1";"3643723515727569_3644145892351998";"data";"data.*";"fetched (200)";"2021-08-04 13:29:40.960210";"Facebook:/<post-id>/comments";"Los mugrosos de ustedes me habéis citado mañana para que me ponga la segunda dosis de Astrazeneca, yo no se como tenéis el cerebro, pero cuando vaya al ambulatorio que me conocen les pienso llamar de todo PUTREFACTOS, SIDAS, MUGRES, PESTOSOS DE TODO en sus caras, y me voy a poner la segunda dosis para ver si reviento y os meto tal querella criminal que me dais un paga de por vida P U T R E F A C T O S MUGROSOS.  Al primer efecto secundario que tenga me voy a ir direct al cuartel de la guardia civil a poneros una querella.";"2021-06-21T10:33:55+0000";"0";"";""
"1";"529";"1";"3643723515727569_3644146395685281";"data";"data.*";"fetched (200)";"2021-08-04 13:29:40.960210";"Facebook:/<post-id>/comments";"Michele PsyWorld.. No te preocupes por tus errores... Se te ha entendido perfectamente... Además, los errores son de los que se están vacunando. ";"2021-06-21T10:34:12+0000";"4";"";""
"1";"530";"1";"3643723515727569_3644146652351922";"data";"data.*";"fetched (200)";"2021-08-04 13:29:40.960210";"Facebook:/<post-id>/comments";"Solo faltareia pensar en esto : porque antes de ponertela, tu tienes que firmar un papel para quitar todas las responsabilidades a todos y tomarlas tu?? 🙄😐 🧠";"2021-06-21T10:34:22+0000";"0";"";""
"1";"531";"1";"3643723515727569_3644147089018545";"data";"data.*";"fetched (200)";"2021-08-04 13:29:40.960210";"Facebook:/<post-id>/comments";"Diego Vaz Quez lo ves que te limitas solo a creerte todo lo que el gobierno quiere...no te cuestiona nada tan solo por que es ese organismo el que te lo dice😂😂😂cuando justamente debería ser al contrario...el ministerio de sanidad!!!! El mismo que el pasado año actualizaba mensualmente las cifras de fallecidos por el chinavirus y resultó ser el cómputo general INFERIOR A LOS 4 AÑOS ANTERIORES!!! 😂🤦‍♀️EN ""PLENA PANDEMIA""!!!!! y ya luego , como el descaro era tan grande , le subieron las cifras a finales de febrero😂😂😂😂. Tu sigue creyendo fielmente a tu gobierno, vacunate y no te cuestiones NADA...TODO LO QUE DIGA TU GOBIERNO ESTARÁ BIEN";"2021-06-21T10:34:35+0000";"0";"";""
"1";"532";"1";"3643723515727569_3644147449018509";"data";"data.*";"fetched (200)";"2021-08-04 13:29:40.960210";"Facebook:/<post-id>/comments";"Magdalena Magala JAJAJAJAJAJAJAJA";"2021-06-21T10:34:51+0000";"0";"";""
"1";"533";"1";"3643723515727569_3644148092351778";"data";"data.*";"fetched (200)";"2021-08-04 13:29:40.960210";"Facebook:/<post-id>/comments";"Maria Gutierrez si si pero los vacunados caireis antes acuerdate de mi nombre para cuando tengas que escribirme😗😗";"2021-06-21T10:35:14+0000";"0";"";""
"1";"534";"1";"3643723515727569_3644148275685093";"data";"data.*";"fetched (200)";"2021-08-04 13:29:40.960210";"Facebook:/<post-id>/comments";"Maria Garcia Cazorla... Yo no me he puesto nada y estoy también muy tranquilo. ";"2021-06-21T10:35:22+0000";"6";"";""
"1";"535";"1";"3643723515727569_3644149129018341";"data";"data.*";"fetched (200)";"2021-08-04 13:29:40.960210";"Facebook:/<post-id>/comments";"";"2021-06-21T10:35:59+0000";"0";"";""
"1";"536";"1";"3643723515727569_3644150229018231";"data";"data.*";"fetched (200)";"2021-08-04 13:29:40.960210";"Facebook:/<post-id>/comments";"Al primer dolor de cabeza, al primer mareo, al primer caida en el suelo, vomito , diarrea que sufra por la vacuna os voy a meter una querella criminal por PUTREFACTOS y MALNACIDOS. Y al médico que me la pincha le voy a dar tal susto que se va a quedar acojonado el resto de su vida hasta cuando me vea por la calle.";"2021-06-21T10:36:43+0000";"0";"";""
"1";"537";"1";"3643723515727569_3644150362351551";"data";"data.*";"fetched (200)";"2021-08-04 13:29:40.960210";"Facebook:/<post-id>/comments";"Juan Carlos Rodríguez Sánchez lastima que no sea contra la ignorancia porque ya llegabas tarde a la cola.";"2021-06-21T10:36:51+0000";"0";"";""
"1";"538";"1";"3643723515727569_3644150429018211";"data";"data.*";"fetched (200)";"2021-08-04 13:29:40.960210";"Facebook:/<post-id>/comments";"Madurga Joset coño! 😂😂😂 Qué ánimos nos dais a los hipocondríacos 😂😂😂😂😂";"2021-06-21T10:36:53+0000";"0";"";""
"1";"539";"1";"3643723515727569_3644150452351542";"data";"data.*";"fetched (200)";"2021-08-04 13:29:40.960210";"Facebook:/<post-id>/comments";"Carmen Valero Villena mucha verdad";"2021-06-21T10:36:54+0000";"0";"";""
"1";"540";"1";"164716453628310_3643723515727569";"offcut";"";"fetched (200)";"2021-08-04 13:29:40.960210";"Facebook:/<post-id>/comments";"";"";"";"";""
"1";"541";"1";"164716453628310_3643723515727569";"headers";"";"fetched (200)";"2021-08-04 13:29:40.960210";"Facebook:/<post-id>/comments";"";"";"";"";""
"1";"542";"1";"3643723515727569_3644150845684836";"data";"data.*";"fetched (200)";"2021-08-04 13:29:41.954160";"Facebook:/<post-id>/comments";"Antonia Jiménez López jaja que interés porque vacunen a todo el mundo,¿ tu te piensas que mi cuerpo pertenece al estado hasta el punto de no poder decidir qué inyectarme? Piensa.. ";"2021-06-21T10:37:07+0000";"11";"";""
"1";"543";"1";"3643723515727569_3644151002351487";"data";"data.*";"fetched (200)";"2021-08-04 13:29:41.954160";"Facebook:/<post-id>/comments";"Provi Jimenez Rodriguez yo no soy quien para decir que hacer cada cual aprecia su vida. La mia vale mucho como para inocularme algo que no sabemos como afectara al cuerpo humano a largo plazo";"2021-06-21T10:37:14+0000";"1";"";""
"1";"544";"1";"3643723515727569_3644151535684767";"data";"data.*";"fetched (200)";"2021-08-04 13:29:41.954160";"Facebook:/<post-id>/comments";"Josefina Parra Diaz por dios";"2021-06-21T10:37:34+0000";"0";"";""
"1";"545";"1";"3643723515727569_3644151659018088";"data";"data.*";"fetched (200)";"2021-08-04 13:29:41.954160";"Facebook:/<post-id>/comments";"Josefina Parra Diaz con cualquier medicamento te puede dar, tu no te vacunes pero deja a lo que quieren vacunarse que lo hagan, que hartazgo";"2021-06-21T10:37:37+0000";"1";"";""
"1";"546";"1";"3643723515727569_3644151709018083";"data";"data.*";"fetched (200)";"2021-08-04 13:29:41.954160";"Facebook:/<post-id>/comments";"MArtina Cn Es fácil ve a Francia y te vacunas.";"2021-06-21T10:37:40+0000";"1";"";""
"1";"547";"1";"3643723515727569_3644152429018011";"data";"data.*";"fetched (200)";"2021-08-04 13:29:41.954160";"Facebook:/<post-id>/comments";"A mi la segunda me da respeto...el 8 de julio la tengo...";"2021-06-21T10:38:07+0000";"1";"";""
"1";"548";"1";"3643723515727569_3644152572351330";"data";"data.*";"fetched (200)";"2021-08-04 13:29:41.954160";"Facebook:/<post-id>/comments";"Raquel Díaz Hernández a nadie nos hace gracias vacunarnos Raquel,cada uno es libre de hacer lo q uno quiera pero de hay a q digan q el virus no existe es muy fuerte,por entonces q lo q ha estado matando a tantísima gente ??? El aire? Por q montaron IFEMA por gusto ?? Hay q saber de lo q se habla o hablar con respeto cosa q hay gente q no hace *NO ES USTED* para mi es mil veces mejor vacunarme q llamar a tu familia un día por videollamada desde el hospital para decirle q te van a entubar y no sabes si vas a volver a despertar 😞tengamos un poquito de conciencia tod@s y esto será más liviano ";"2021-06-21T10:38:14+0000";"3";"";""
"1";"549";"1";"3643723515727569_3644153305684590";"data";"data.*";"fetched (200)";"2021-08-04 13:29:41.954160";"Facebook:/<post-id>/comments";"Sí, todo muy bien mucho tanto % de vacunacion..... pero yo con 68 años sin vacunar.... a dónde de van las 0 Pfizer q se reciben??? En Francia vacunado a todos los españoles que se precien y eligiendo vacuna. COMI DEBERÍA DE SER";"2021-06-21T10:38:38+0000";"20";"";""
"1";"550";"1";"3643723515727569_3644154045684516";"data";"data.*";"fetched (200)";"2021-08-04 13:29:41.954160";"Facebook:/<post-id>/comments";"A vacunarse y dejarse de rollos";"2021-06-21T10:39:11+0000";"0";"";""
"1";"551";"1";"3643723515727569_3644155365684384";"data";"data.*";"fetched (200)";"2021-08-04 13:29:41.954160";"Facebook:/<post-id>/comments";"Eriugena Scotus , yo vivo en Alcalá de Henares, Madrid, tengo 45 años y hoy me he vacunado en mi ciudad, en la comunidad de Madrid están dando cita a los mayores de 43 años.";"2021-06-21T10:39:59+0000";"2";"";""
"1";"552";"1";"3643723515727569_3644155629017691";"data";"data.*";"fetched (200)";"2021-08-04 13:29:41.954160";"Facebook:/<post-id>/comments";"Legalización Deno Moreno joer! A mi la del tétanos me pegó más fuerte que la primera de pfizer! A quien me dirijo para denunciar? ";"2021-06-21T10:40:09+0000";"0";"";""
"1";"553";"1";"3643723515727569_3644156322350955";"data";"data.*";"fetched (200)";"2021-08-04 13:29:41.954160";"Facebook:/<post-id>/comments";"Lucas Molero Matas porqué eres tan dictatorial que no respetas las opiniones contrarias a las tuyas. Por la imagen que has puesto a Angie Bares te defines.";"2021-06-21T10:40:36+0000";"0";"";""
"1";"554";"1";"3643723515727569_3644156722350915";"data";"data.*";"fetched (200)";"2021-08-04 13:29:41.954160";"Facebook:/<post-id>/comments";"Porfavor, hermanos, almas, no quiero buscar peleas, discusiones inutil, reirme de alguien, ni nada asì... Yo solo pulsè el nombre de el grupo porque creo que es algo que TODOS deberian saber...NESSUNA CORRELAZIONE 2...Asì que ustede tambien puedan ir a ver! Y llegar a su propria opinion... Esta en italiano pero creo que se va a entender igual... Saludos 🙏🍀✌️🤗";"2021-06-21T10:40:50+0000";"0";"";""
"1";"555";"1";"3643723515727569_3644158099017444";"data";"data.*";"fetched (200)";"2021-08-04 13:29:41.954160";"Facebook:/<post-id>/comments";"Antonia Jiménez López  ";"2021-06-21T10:41:45+0000";"0";"";""
"1";"556";"1";"3643723515727569_3644158312350756";"data";"data.*";"fetched (200)";"2021-08-04 13:29:41.954160";"Facebook:/<post-id>/comments";"Carmen Valero Villena estamos de acuerdo ";"2021-06-21T10:41:52+0000";"0";"";""
"1";"557";"1";"3643723515727569_3644158565684064";"data";"data.*";"fetched (200)";"2021-08-04 13:29:41.954160";"Facebook:/<post-id>/comments";"Enhorabuena a los vacunados con la proteína spike... Y mucha suerte!!!";"2021-06-21T10:42:02+0000";"0";"";""
"1";"558";"1";"3643723515727569_3644158885684032";"data";"data.*";"fetched (200)";"2021-08-04 13:29:41.954160";"Facebook:/<post-id>/comments";"Por edad me pusieron astra  zaneca , y ahora la segunda no lo se a ver este Gobierno, 👉";"2021-06-21T10:42:16+0000";"0";"";""
"1";"559";"1";"3643723515727569_3644158955684025";"data";"data.*";"fetched (200)";"2021-08-04 13:29:41.954160";"Facebook:/<post-id>/comments";"Estamos muy preocupados nos toca la segunda dosis y no sabemos nada";"2021-06-21T10:42:18+0000";"2";"";""
"1";"560";"1";"3643723515727569_3644159205684000";"data";"data.*";"fetched (200)";"2021-08-04 13:29:41.954160";"Facebook:/<post-id>/comments";"Montserrat Salas Comunidad Valenciana.";"2021-06-21T10:42:31+0000";"0";"";""
"1";"561";"1";"3643723515727569_3644159305683990";"data";"data.*";"fetched (200)";"2021-08-04 13:29:41.954160";"Facebook:/<post-id>/comments";"Oscar RG Eres un genio cara de ello tienes";"2021-06-21T10:42:34+0000";"0";"";""
"1";"562";"1";"3643723515727569_3644160142350573";"data";"data.*";"fetched (200)";"2021-08-04 13:29:41.954160";"Facebook:/<post-id>/comments";"Mery PQ ¿es en serio??😯yo también me sé persons que se vacunaron y se sintieron mal.........";"2021-06-21T10:43:07+0000";"0";"";""
"1";"563";"1";"3643723515727569_3644160152350572";"data";"data.*";"fetched (200)";"2021-08-04 13:29:41.954160";"Facebook:/<post-id>/comments";"Carmen Valero Villena... Es una troll, esa es la verdad. ";"2021-06-21T10:43:07+0000";"0";"";""
"1";"564";"1";"3643723515727569_3644160285683892";"data";"data.*";"fetched (200)";"2021-08-04 13:29:41.954160";"Facebook:/<post-id>/comments";"Síle Walsh Villar a mi también el brazo pero me dolió menos que la del tétanos...cansancio al día siguiente, dolor de barriga y rara...pero muy llevable";"2021-06-21T10:43:13+0000";"2";"";""
"1";"565";"1";"3643723515727569_3644160882350499";"data";"data.*";"fetched (200)";"2021-08-04 13:29:41.954160";"Facebook:/<post-id>/comments";"Diego Vaz Quez Nada, todos los científicos que dan veracidad a la versión oficial están comprados por el gobierno. Por qué crees si no que todos los científicos españoles tienen la cuenta corriente tan abultada? Hasta el alumno de universidad que está con una beca o haciendo el TFG miente por las grandes sumas de dinero que reciben. Es mucho mejor fiarte de datos empíricos como si tu vecina la Paquita dice que se le pegan las cucharas desde que se vacunó.   De todas formas, tranquilo, si te has vacunado y tienes miedo ahora, hay formas de expulsar la vacuna, ya sea mediante infusiones de cúrcuma y jengibre o usando imanes en el brazo.   PD: era ironía, eh, que aún habrá algún negacionista que se lo crea y me aplauda 😂";"2021-06-21T10:43:38+0000";"0";"";""
"1";"566";"1";"3643723515727569_3644161875683733";"data";"data.*";"fetched (200)";"2021-08-04 13:29:41.954160";"Facebook:/<post-id>/comments";"No me lo creo...hay tantos fakes...";"2021-06-21T10:44:20+0000";"3";"";""
"1";"567";"1";"164716453628310_3643723515727569";"offcut";"";"fetched (200)";"2021-08-04 13:29:41.954160";"Facebook:/<post-id>/comments";"";"";"";"";""
"1";"568";"1";"164716453628310_3643723515727569";"headers";"";"fetched (200)";"2021-08-04 13:29:41.954160";"Facebook:/<post-id>/comments";"";"";"";"";""
"1";"569";"1";"3643723515727569_3644162345683686";"data";"data.*";"fetched (200)";"2021-08-04 13:29:42.539741";"Facebook:/<post-id>/comments";"En nuestra ciudad ya hay lista de espera para gente de 60 así que a ese paso llegan a los 2030 sin vacuna";"2021-06-21T10:44:38+0000";"0";"";""
"1";"570";"1";"3643723515727569_3644162572350330";"data";"data.*";"fetched (200)";"2021-08-04 13:29:42.539741";"Facebook:/<post-id>/comments";"Una pregunta,por favor si alguien me puede informar  a las personas q o no estamos com la seguridad social q pasa .";"2021-06-21T10:44:47+0000";"0";"";""
"1";"571";"1";"3643723515727569_3644162722350315";"data";"data.*";"fetched (200)";"2021-08-04 13:29:42.539741";"Facebook:/<post-id>/comments";"Ma Dominguez Hernandez Entonces vamos todos 😂😂😂";"2021-06-21T10:44:54+0000";"0";"";""
"1";"572";"1";"3643723515727569_3644162739016980";"data";"data.*";"fetched (200)";"2021-08-04 13:29:42.539741";"Facebook:/<post-id>/comments";"Rafael Pascual Garcia jo tengo hora 2 dosis día 23 de momento no me lan anulado soy de Cataluña.";"2021-06-21T10:44:55+0000";"0";"";""
"1";"573";"1";"3643723515727569_3644162902350297";"data";"data.*";"fetched (200)";"2021-08-04 13:29:42.539741";"Facebook:/<post-id>/comments";"Paloma del Cerro 😱68 sin vacunar???? Mira si tienes los datos actualizados en tu centro de salud.yo con 44 ya tengo una dosis...ya se que eso depende de la comunidad pero lo tuyo no es normal!";"2021-06-21T10:44:58+0000";"4";"";""
"1";"574";"1";"3643723515727569_3644163082350279";"data";"data.*";"fetched (200)";"2021-08-04 13:29:42.539741";"Facebook:/<post-id>/comments";"Carmen Valero Villena para solucionar lo tuyo y el miedo a la caja de pino, que te meten en la chorla a todas horas, deja de ver la tele";"2021-06-21T10:45:04+0000";"5";"";""
"1";"575";"1";"3643723515727569_3644163479016906";"data";"data.*";"fetched (200)";"2021-08-04 13:29:42.539741";"Facebook:/<post-id>/comments";"David Esteban pues yo no juego. no me arriesgo y estaré bien. ";"2021-06-21T10:45:20+0000";"0";"";""
"1";"576";"1";"3643723515727569_3644164279016826";"data";"data.*";"fetched (200)";"2021-08-04 13:29:42.539741";"Facebook:/<post-id>/comments";"Jose Manuel Ollero Ramos no te preocupes! Es peor el covid ( ese virus que dice gente que no existe) 😮";"2021-06-21T10:45:49+0000";"0";"";""
"1";"577";"1";"3643723515727569_3644164792350108";"data";"data.*";"fetched (200)";"2021-08-04 13:29:42.539741";"Facebook:/<post-id>/comments";"Que subidón no? El otro día fueron 333.000 y hoy 1.6 millones jajajajajaa se os acaba el tiempo y ya no dais abasto con tanta cepa 🤦‍♂️ .. De la variante India a cual pasaremos.. La tibetana?  Tenéis mucha prisa por inmunizar a la gente que no acaba inmunizada y puede acabar contagiandose? No será la gripe y estais metiendo mucha mierda en los pinchazos de los cuales NADIE se hace responsable??.... Estaréis orgullosos de matar a la gente en favor de vuestra agenda elitista";"2021-06-21T10:46:09+0000";"5";"";""
"1";"578";"1";"3643723515727569_3644166165683304";"data";"data.*";"fetched (200)";"2021-08-04 13:29:42.539741";"Facebook:/<post-id>/comments";"También los niños vacunar pa septiembre";"2021-06-21T10:47:04+0000";"0";"";""
"1";"579";"1";"3643723515727569_3644166809016573";"data";"data.*";"fetched (200)";"2021-08-04 13:29:42.539741";"Facebook:/<post-id>/comments";"¿ Porque no adelantan la 2° Dosis de AstraZeneca en toda España como están haciendo algunas comuidades";"2021-06-21T10:47:25+0000";"1";"";""
"1";"580";"1";"3643723515727569_3644167722349815";"data";"data.*";"fetched (200)";"2021-08-04 13:29:42.539741";"Facebook:/<post-id>/comments";"Antonio A. Jimenez pero qué interés tienen en meternos una mierda? Es que no lo entiendo, no sé qué intereses más allá de lo económico ( que a nosotros no nos cuesta nada) puede haber😞";"2021-06-21T10:48:00+0000";"2";"";""
"1";"581";"1";"3643723515727569_3644167885683132";"data";"data.*";"fetched (200)";"2021-08-04 13:29:42.539741";"Facebook:/<post-id>/comments";"";"2021-06-21T10:48:06+0000";"0";"";""
"1";"582";"1";"3643723515727569_3644167932349794";"data";"data.*";"fetched (200)";"2021-08-04 13:29:42.539741";"Facebook:/<post-id>/comments";"Martinez Martinez María Jose  la preocupación de las vacuna es que todos tenemos niños y quieren experimentar con ellos, yo creo que aquí ya no se debe de permitir";"2021-06-21T10:48:08+0000";"0";"";""
"1";"583";"1";"3643723515727569_3644169435682977";"data";"data.*";"fetched (200)";"2021-08-04 13:29:42.539741";"Facebook:/<post-id>/comments";"Roberto Garcia por eso pamies y otros iluminados del estilo, en cuanto les aparece algo serio van a hospitales de verdad.....para que les salga un sexto dedo....  Lo de cuidarse y demás que dices está bien, pero lo del sexto dedo.....lo mata un poco";"2021-06-21T10:49:06+0000";"0";"";""
"1";"584";"1";"3643723515727569_3644169679016286";"data";"data.*";"fetched (200)";"2021-08-04 13:29:42.539741";"Facebook:/<post-id>/comments";"Tengo 37 ¿¿¿cuando me toca???";"2021-06-21T10:49:14+0000";"0";"";""
"1";"585";"1";"3643723515727569_3644169765682944";"data";"data.*";"fetched (200)";"2021-08-04 13:29:42.539741";"Facebook:/<post-id>/comments";"Cuando tocará que nos vacunen?? Yo tengo 45 años y no nos han llamado! ";"2021-06-21T10:49:19+0000";"0";"";""
"1";"586";"1";"3643723515727569_3644170072349580";"data";"data.*";"fetched (200)";"2021-08-04 13:29:42.539741";"Facebook:/<post-id>/comments";"Dany Fernández Sánchez xk van a caer a pares?";"2021-06-21T10:49:30+0000";"0";"";""
"1";"587";"1";"3643723515727569_3644170355682885";"data";"data.*";"fetched (200)";"2021-08-04 13:29:42.539741";"Facebook:/<post-id>/comments";"Teresa García me parece bien ,siempre esperen a que todos los que les toca y si quieren se acaben de vacunar... porque es España no se puede elegir vacuna . cuando acaben la primera ronda ( adolescentes incluidos ) que les pregunten a los que rechazaron en su día vacunarse si cambiaron de opinión.";"2021-06-21T10:49:41+0000";"1";"";""
"1";"588";"1";"3643723515727569_3644171979016056";"data";"data.*";"fetched (200)";"2021-08-04 13:29:42.539741";"Facebook:/<post-id>/comments";"Veka Angelova yo vivo en sevilla y mis suegros tmb y los dos están ya vacunados con las dos dosis tienen 79 y 72 años ";"2021-06-21T10:50:54+0000";"1";"";""
"1";"589";"1";"3643723515727569_3644172879015966";"data";"data.*";"fetched (200)";"2021-08-04 13:29:42.539741";"Facebook:/<post-id>/comments";"Ana Cano Marquez pues que no hay. A mí me vacunaron ayer dela primera😡😡";"2021-06-21T10:51:33+0000";"1";"";""
"1";"590";"1";"3643723515727569_3644173462349241";"data";"data.*";"fetched (200)";"2021-08-04 13:29:42.539741";"Facebook:/<post-id>/comments";"MArtina Cn aquí en Castilla y León igual en mi ciudad a los de 60 años hay lista de espera hasta que lleguen las vacunaa";"2021-06-21T10:51:58+0000";"0";"";""
"1";"591";"1";"3643723515727569_3644173612349226";"data";"data.*";"fetched (200)";"2021-08-04 13:29:42.539741";"Facebook:/<post-id>/comments";"Ithaisa Cabrera seguimos esperando que comparta esas fuentes más fidedignas que las del propio ministerio o del resto de científicos de la comunidad internacional.";"2021-06-21T10:52:06+0000";"0";"";""
"1";"592";"1";"3643723515727569_3644173782349209";"data";"data.*";"fetched (200)";"2021-08-04 13:29:42.539741";"Facebook:/<post-id>/comments";"Danielle Létard las estadisticas confirman lo que tú dices,incluso en paises donde no hubo confinamiento. Además ya hay prensa (locales e independientes) que confirman el ingreso en UCIs de vacunados. En Cataluña ahora van a separar los positivos no vacunados de los sí vacunados. Reino Unido, que empezó la vacunacion en Diciembre, y lleva ""meses"" con restrincciones y cierres, tiene un aumento de infectados...  en USA -la FDA- acaban de declarar nulos los test y software Covid, al ser un peligro de salud (vaya, eso no se sabia...) y por el alto indice de errores que dan... Cada cual saque sus conclusiones. Las estadisticas estan ahi. Los numeros no fallan. Los datos de muertes y personas con efectos graves tambien. (14000 fallecidos y mas de 3 millones con efectos adversos graves- European database.) Es lo que tienen los medicamentos experimentales.. ";"2021-06-21T10:52:11+0000";"3";"";""
"1";"593";"1";"3643723515727569_3644174535682467";"data";"data.*";"fetched (200)";"2021-08-04 13:29:42.539741";"Facebook:/<post-id>/comments";"Caterina Katy  y como lo hiciste.?";"2021-06-21T10:52:35+0000";"0";"";""
"1";"594";"1";"164716453628310_3643723515727569";"offcut";"";"fetched (200)";"2021-08-04 13:29:42.539741";"Facebook:/<post-id>/comments";"";"";"";"";""
"1";"595";"1";"164716453628310_3643723515727569";"headers";"";"fetched (200)";"2021-08-04 13:29:42.539741";"Facebook:/<post-id>/comments";"";"";"";"";""
"1";"596";"1";"3643723515727569_3644175189015735";"data";"data.*";"fetched (200)";"2021-08-04 13:29:42.850561";"Facebook:/<post-id>/comments";"esas ""sandeces"" estan siendo dichas por virologos de prestigio mundial, , premios nobel de medicina y otros mas de 100.000 medicos, y en 2 semanas empieza el juicio por delitos de lesa humanidad en el tribunal supremo , por la denuncia interpuesta por 1000 abogados y 10.000 medicos osea que no vuelvas a decir que son sandeces y ten un poquito de respeto que no tienes ni idea de lo que estan arriesgando estas personas,  literalmente sus vidas....  Que no habeis movido un dedo en 15 meses y catalogais de sandeces cosas de las que no teneis ni p idea. Ya esta bien. Irresponsables";"2021-06-21T10:53:00+0000";"7";"";""
"1";"597";"1";"3643723515727569_3644175275682393";"data";"data.*";"fetched (200)";"2021-08-04 13:29:42.850561";"Facebook:/<post-id>/comments";"Maria Stutzenstein en eso he pensado yo para dar el paso. Y porque toda mi familia y todos mis amigos se están vacunando y al final pensaba yo...a que viene el virus a por mí? 😅";"2021-06-21T10:53:02+0000";"1";"";""
"1";"598";"1";"3643723515727569_3644176455682275";"data";"data.*";"fetched (200)";"2021-08-04 13:29:42.850561";"Facebook:/<post-id>/comments";"Yo la verdad totalmente  decepcionada del sistema sanitario, no me he puesto la vacuna y ahora no sé que puedo hacer, no me dan ningúna opción y tengo verdaderamente miedo. Pase en abril del año pasado el covid  bastante mal, desde entonces tengo el indice de coagulación alto, hace 15 dias después del año y algo aún tenia 1200 y pico cuando lo normal es que no suba de 500. Quiero ponerme la VACUNA  pero no Astrazeneca y no hay protócolo pues aqui estoy en tierra de nadie, por cierto encantada con mi médico de cabecera pero no puede hacer nada. Que haré ni idea, y soy provacunas. Y aqui te sientes como a la deriva por pedir otra vacuna que no te dan. Si llega a pasar algo pues eres ese % por ciento pequeño de trombos.Enfin......";"2021-06-21T10:53:47+0000";"34";"";""
"1";"599";"1";"3643723515727569_3644176565682264";"data";"data.*";"fetched (200)";"2021-08-04 13:29:42.850561";"Facebook:/<post-id>/comments";"Jorge Rincon Becerra eso ya lo explicaron es por el sudor de cada tipo de piel no tiene que ver con la vacuna";"2021-06-21T10:53:51+0000";"0";"";""
