"level";"id";"parent_id";"object_id";"object_type";"object_key";"query_status";"query_time";"query_type";"message";"created_time";"like_count";"comment_count";"error.message"
"1";"1352";"1";"3643723515727569_1181135485697563";"data";"data.*";"fetched (200)";"2021-08-04 13:29:57.636050";"Facebook:/<post-id>/comments";"Jose Antonio Mendoza Carretero A mi me pusieron la primera el 2 de abril, y no me han enviado mensaje para la segunda, he llamado 2 veces y me dicen que no está previsto el mensaje ,que ya me llamarán.....y están vacunando a personas que se la pusieron el 10 y 12 de abril ,ya con mensajes  para poner seña esta semana ....no entiendo la gestión,...a este paso me ponen segunda dosis a las 14 o 16 semanas ....aburrida estoy .. ";"2021-06-21T16:06:45+0000";"0";"";""
"1";"1353";"1";"3643723515727569_1181136189030826";"data";"data.*";"fetched (200)";"2021-08-04 13:29:57.636050";"Facebook:/<post-id>/comments";"Carolina Barceloperez los hay es q tener cabeza q todos vais a lo contrario q se dice q hay q hacer por el bien común,como cómo sois unos anti reglas pues haya ustedes,bastante trabajo tengo yo al cabo del día como para ponerme a ver la tv para eso paso el tiempo con mis dos hijos 😊";"2021-06-21T16:07:59+0000";"0";"";""
"1";"1354";"1";"3643723515727569_1144832622665513";"data";"data.*";"fetched (200)";"2021-08-04 13:29:57.636050";"Facebook:/<post-id>/comments";"Hola querido individuo.  Una empresa privada local ofrece un préstamo garantizado y garantizado.  Ofrecemos a cualquier persona seria y capaz de devolver nuestro préstamo de 5.000 € a 50.000.000 €.  Nuestro préstamo se realiza sin un trámite bancario complicado.  Si está interesado díganos:  Díganos el monto de su préstamo, la duración de su reembolso y el propósito del préstamo.  Whatsapp: +33752742019";"2021-06-21T16:08:11+0000";"0";"";""
"1";"1355";"1";"3643723515727569_1144832915998817";"data";"data.*";"fetched (200)";"2021-08-04 13:29:57.636050";"Facebook:/<post-id>/comments";"Marta Melendi Qué cojones va a desaparecer la gripe? si llevamos desde antes de cristo con ella...os lo dicen en la tele y os lo creéis?...en fin...";"2021-06-21T16:08:55+0000";"0";"";""
"1";"1356";"1";"3643723515727569_1144833072665468";"data";"data.*";"fetched (200)";"2021-08-04 13:29:57.636050";"Facebook:/<post-id>/comments";"A alguien le pusieron la primera de Astrazeneca y ahora para la Segunda le llego un escrito que la Segunda dosis tocaría Pfizer , y si quiero AstraZeneca debo llevar un papel firmado.Tengo 56 años me tocaría el 4 de julio.";"2021-06-21T16:09:14+0000";"0";"";""
"1";"1357";"1";"3643723515727569_1144833145998794";"data";"data.*";"fetched (200)";"2021-08-04 13:29:57.636050";"Facebook:/<post-id>/comments";"Hipatia Irene no hace falta k la llame la seguridad social ya habilitado citas que puedes pedir tu por internet si esta en la franja de edad como veis no es tan difícil y esta en su pleno derecho de no haber querido astrazeneca como cualquiera hubiera hecho";"2021-06-21T16:09:26+0000";"5";"";""
"1";"1358";"1";"3643723515727569_1144833525998756";"data";"data.*";"fetched (200)";"2021-08-04 13:29:57.636050";"Facebook:/<post-id>/comments";"Po una de estas será pa mi😂😂😂😂";"2021-06-21T16:10:09+0000";"0";"";""
"1";"1359";"1";"3643723515727569_1144833955998713";"data";"data.*";"fetched (200)";"2021-08-04 13:29:57.636050";"Facebook:/<post-id>/comments";"Muchos bebes fueron asesinados a propósito para conseguir la línea celular HEK-293 de fetos abortados  de la ""vacuna"" de Pfizer. Unknowns of the Pfizer vaccine Letter to the Editor | Thursday, April 8, 2021 Dear Student Body of Notre Dame,  The recent announcement from the Office of the President mandating that all students, both undergraduate and graduate, receive the COVID-19 vaccine before the fall 2021 semester brings to the forefront the vaccine’s controversial connection to abortion. In an effort to encourage and now mandate vaccination against COVID-19, the University of Notre Dame has deliberately failed to acknowledge the morally compromised origin of the Pfizer vaccine that will be distributed to the student body. As a Catholic university dedicated to the pursuit of truth and open discussion, Notre Dame cannot shy away from this difficult discussion for the sake of convenience. We would like to take this opportunity to explain the involvement of the Pfizer vaccine with morally compromised fetal cell lines and to petition the University to instead advocate for morally acceptable vaccines that do not cooperate with the evil of abortion.  To date, we have encountered few students who are aware of the association of the Pfizer vaccine with abortion. The administration’s official communications have made no mention of this connection and have taken on an enthusiastic tone rather than a somber one reflecting that this vaccine benefited from the murder of an innocent human being. While the Catholic Church has taught that it is not obligatory to avoid morally compromised vaccines if there is a “grave danger,” the Church also teaches us that it is our “duty to make known [our] disagreement and to ask that [our] healthcare system make other types of vaccines available.” The Church teaches that everyone, including the University, in making use of these vaccines, has a serious obligation to make known the truth and wield its voice in advocating for moral vaccines so that we do not live in a world where we are forced to choose between safeguarding our health and violating our conscience. If Our Lady’s University remains silent, it risks being complicit in creating a world where such ethically compromised vaccines are ubiquitous.   The Pfizer vaccine made use of an aborted fetal cell line called HEK-293, for confirmatory testing during its research and development. It also likely makes ongoing use of the same cell line for quality control testing as new batches of vaccine are produced. HEK-293 stands for Human Embryonic Kidney, experiment number 293. This kidney was taken from an innocent child murdered in 1972 during an abortion in the Netherlands. There were likely multiple children killed for the purpose of gathering enough fetal tissue to facilitate the 293 experiments needed to produce the HEK-293 cell line. Bishop Athanasius Schneider of the Diocese of Astana reminds us that “when we use vaccines or medicines which utilize cell lines originating from aborted babies, we physically benefit from the “fruits” of one of the greatest evils of mankind — the cruel genocide of the unborn.” While these crimes took place in the past, the murder of innocent children in the womb for the purpose of scientific research and the trafficking of aborted fetal tissue is still extremely prevalent in our own day. Silence in regard to the use of aborted fetal cell lines encourages their broader acceptance in society and the continued murder and exploitation of the unborn for future research. Indeed the Church teaches that it is not acceptable to use morally compromised vaccines unless there is a grave danger and there are no alternatives. We invite each of you to consider your own role in this dilemma. Do your individual circumstances regarding your health and the health of those you come into regular contact with constitute a grave danger that warrants the acceptance of a morally compromised vaccine? If your answer is yes and you do choose to get the vaccine, I urge you to write to Pfizer and demand ethical alternatives in the future. However, we believe it is also worth considering the broader picture. In the United States, more lives are lost to abortion each year than have been lost in the course of this entire pandemic. This statistic is not to downplay the tragic impact of COVID-19, but rather to put into perspective the modern holocaust that plagues our society. As John Paul II said in his 1988 letter Christifideles Laici, we have an obligation to defend the unborn with “maximum determination” and we urge you to make your decision regarding this vaccine reflect such conviction. Actions speak louder than words and the strongest form of opposition is to refuse this abortion tainted vaccine outright. As students in an age group with an extremely low mortality from COVID-19 and who largely live and interact with peers of the same age group, we have the opportunity to wait for an ethical vaccine, the soonest of which could be ready in a matter of months. An ethically sourced vaccine made by the pharmaceutical company Sanofi entered human trials in March of this year. They are scheduled to start the production of 100 million doses later this year, some of which, with the cooperation of the University, could be made available to students this fall. The United States Conference of Catholic Bishops, in a letter signed by our own Bishop Rhoades of the Diocese of Fort-Wayne South Bend states that “Catholics and men and women of good will must continue to do what we can to ensure the development, production, and distribution of a COVID-19 vaccine without any connection to abortion and to help change what has become the standard practice in much medical research, a practice in which certain morally compromised cell lines are routinely used as a matter of course, with no consideration of the moral question concerning the origins of those cell lines.” We join with Bishop Rhoades in calling on all people of good will, and specifically the University, to do all they can to ensure the distribution of a coronavirus vaccine with no connection to one of the greatest evils of mankind. We ask the University to make the Sanofi or another ethically acceptable vaccine available to the student body this fall. We also implore the University to promote and defend our freedom of conscience with regard to accepting the vaccine and not coerce students to take a vaccine against their will. We remind the University that the Congregation for the Doctrine of Faith stated that “the vaccination is not a moral obligation” and in light of its connection to abortion, “it must be voluntary.” We should not accept a world where vaccines derived from abortion are so commonplace that their use is not given a word of mention by the administration at a Catholic university. Going forward, more and more vaccines will be developed immorally if we continue in silence. As University founder Fr. Edward Sorin said, the University has an opportunity to be “one of the most powerful forces for doing good in the country.” Let us, the students, faculty, and staff of Notre Dame, be a force for good and advocate for a morally acceptable vaccine that does not cooperate with the evil of abortion. Sincerely, Christopher Romanoski Master’s Candidate Department of Aerospace and Mechanical Engineering Joseph Klatt Master’s Candidate Department of Civil and Environmental Engineering and Earth Sciences April 6   ";"2021-06-21T16:11:10+0000";"0";"";""
"1";"1360";"1";"3643723515727569_1144834215998687";"data";"data.*";"fetched (200)";"2021-08-04 13:29:57.636050";"Facebook:/<post-id>/comments";"JesusySusana Barrull para salvar tu culo hay que vacunar a los niños, no os merecéis el oxígeno que respiramos, por eso lleváis el trapo en la boca hasta para dormir.";"2021-06-21T16:11:46+0000";"0";"";""
"1";"1361";"1";"3643723515727569_1144834225998686";"data";"data.*";"fetched (200)";"2021-08-04 13:29:57.636050";"Facebook:/<post-id>/comments";"Marta Melendi Recomiendan ($)  Menudo negociazo se han montado.  Entonces cada seis meses a vacunar a la peña para que estén ""sanos y fuertes""... Pero no os dais cuenta de las cosas?";"2021-06-21T16:11:47+0000";"0";"";""
"1";"1362";"1";"3643723515727569_1144834409332001";"data";"data.*";"fetched (200)";"2021-08-04 13:29:57.636050";"Facebook:/<post-id>/comments";"Isabel Garcia me refiero que me ha tocado por la franja de edad, estoy en la de 60 a 68 y me fío más de los expertos que de los sabiondos que circulan por las redes.Tu ponte la que quieras o no te pongas ninguna, nadie te obliga a inocularte la vacuna, yo sigo estando a favor de ella. Saludos";"2021-06-21T16:12:11+0000";"0";"";""
"1";"1363";"1";"3643723515727569_1181138255697286";"data";"data.*";"fetched (200)";"2021-08-04 13:29:57.636050";"Facebook:/<post-id>/comments";"Esa quiero yo";"2021-06-21T16:12:22+0000";"0";"";""
"1";"1364";"1";"3643723515727569_1181138649030580";"data";"data.*";"fetched (200)";"2021-08-04 13:29:57.636050";"Facebook:/<post-id>/comments";"Karina G. Rafaele  gracias, tengo dudas...si una persona ha pasado la enfermedad no tiene esas células T? . Y otra duda si te vacunas ahora, lo tendrás que hacer cada año? ";"2021-06-21T16:13:13+0000";"0";"";""
"1";"1365";"1";"3643723515727569_1144835622665213";"data";"data.*";"fetched (200)";"2021-08-04 13:29:57.636050";"Facebook:/<post-id>/comments";"Bien, las víctimas son los vacunados, no nos riamos de ellos, va a tocar ayudarlos.";"2021-06-21T16:14:18+0000";"3";"";""
"1";"1366";"1";"3643723515727569_1144835712665204";"data";"data.*";"fetched (200)";"2021-08-04 13:29:57.636050";"Facebook:/<post-id>/comments";"Pucela Resiste cierto...una auténtica verguenza !!";"2021-06-21T16:14:31+0000";"3";"";""
"1";"1367";"1";"3643723515727569_1144835822665193";"data";"data.*";"fetched (200)";"2021-08-04 13:29:57.636050";"Facebook:/<post-id>/comments";"Ya veremos dentro de poco.Veo que de ALMA QUE DIOS NE LO DEJO ya NO interesa a nadie.POIS  YO NO ME VACUNO NUNCA";"2021-06-21T16:14:45+0000";"0";"";""
"1";"1368";"1";"3643723515727569_1144835912665184";"data";"data.*";"fetched (200)";"2021-08-04 13:29:57.636050";"Facebook:/<post-id>/comments";"Sara Esteban Velasco  si has pasado la enfermedad, tienes células T de memoria. Lo segundo, no te puedo contestar con total exactitud, pero si se transforma en enfermedad endémica (como la gripe), sí sería necesario revacunarse.";"2021-06-21T16:14:54+0000";"1";"";""
"1";"1369";"1";"3643723515727569_1144836005998508";"data";"data.*";"fetched (200)";"2021-08-04 13:29:57.636050";"Facebook:/<post-id>/comments";"Ministerio REPITO que no os enteráis, que no podéis hablar en la televisión de la variante Delta e India sin decir: A QUIERES AFECTA, ANCIANOS JÓVENES, NIÑOS, BÉBES RECIEN NACIDOS, a por quieres van estas variantes ahora y si los que ya han pasado el covid les pueden afectar estas variantes. No tenéis nada que decir ni con que meter miedo otra vez ya se os ha acaba el chiste este. Lo que no entiendo es porque decir estas gilipolleces ahora si ya hay 30 millones de vacunados más o menos y los ancianos ya se la pusieron y a la gente joven pacticamente les obligáis a chutarse estas vacunas. O es que las vacunas no valen un mojón, mira que como tengáis que revacunar a ancianos de nuevo xD";"2021-06-21T16:15:11+0000";"0";"";""
"1";"1370";"1";"3643723515727569_1181140639030381";"data";"data.*";"fetched (200)";"2021-08-04 13:29:57.636050";"Facebook:/<post-id>/comments";"Cris Mingo pues fatal, la gente tiene derecho a saber que le inyectan antes de entrar, imagina que tienes problemas de coagulación de la sangre y te ponen AstraZeneca y encima tú no dices nada🙄, no es cuestión de la comunidad, es cuestión de ir informado.";"2021-06-21T16:17:03+0000";"0";"";""
"1";"1371";"1";"3643723515727569_1144838399331602";"data";"data.*";"fetched (200)";"2021-08-04 13:29:57.636050";"Facebook:/<post-id>/comments";"Paloma del Cerro yo también rechace  AstraZeneca y ahora me pondrán faiser tengo 68años";"2021-06-21T16:19:06+0000";"2";"";""
"1";"1372";"1";"3643723515727569_1181141965696915";"data";"data.*";"fetched (200)";"2021-08-04 13:29:57.636050";"Facebook:/<post-id>/comments";"Juana Ortega Lopez instalate la tarjeta sanitaria virtual y tienes una opción de autocita para los que ya se han podido vacunar";"2021-06-21T16:19:56+0000";"0";"";""
"1";"1373";"1";"3643723515727569_1181142335696878";"data";"data.*";"fetched (200)";"2021-08-04 13:29:57.636050";"Facebook:/<post-id>/comments";"Amparo Aguilera cómo hiciste para conseguir Pfizer??  ";"2021-06-21T16:20:44+0000";"0";"";""
"1";"1374";"1";"3643723515727569_1144840072664768";"data";"data.*";"fetched (200)";"2021-08-04 13:29:57.636050";"Facebook:/<post-id>/comments";"Escribano Peribañez Carmen Yo elegí también, y me esperé hasta que  me han puesto pfizer que haga cada uno lo que quiera pero jugar con la vida misma yo no lo hago.";"2021-06-21T16:22:38+0000";"2";"";""
"1";"1375";"1";"3643723515727569_1144840362664739";"data";"data.*";"fetched (200)";"2021-08-04 13:29:57.636050";"Facebook:/<post-id>/comments";"da igual cuantas dosis den por que no es una solución al problema. y si no mirar las noticias de chile. ";"2021-06-21T16:23:18+0000";"1";"";""
"1";"1376";"1";"3643723515727569_1181144835696628";"data";"data.*";"fetched (200)";"2021-08-04 13:29:57.636050";"Facebook:/<post-id>/comments";"Bueno! Ya que estás todos por la vacuna! Yo estoy preocupado por todas las subidas electricidad y etc no tiene sentido seguir! Si economía tampoco ay salud!suerte a todos !";"2021-06-21T16:25:23+0000";"4";"";""
"1";"1377";"1";"164716453628310_3643723515727569";"offcut";"";"fetched (200)";"2021-08-04 13:29:57.636050";"Facebook:/<post-id>/comments";"";"";"";"";""
"1";"1378";"1";"164716453628310_3643723515727569";"headers";"";"fetched (200)";"2021-08-04 13:29:57.636050";"Facebook:/<post-id>/comments";"";"";"";"";""
"1";"1379";"1";"3643723515727569_1144841552664620";"data";"data.*";"fetched (200)";"2021-08-04 13:29:58.037820";"Facebook:/<post-id>/comments";"Madrid era la más contagiosa os dieron libertad para k la votarán innorartes";"2021-06-21T16:25:44+0000";"0";"";""
"1";"1380";"1";"3643723515727569_1181145772363201";"data";"data.*";"fetched (200)";"2021-08-04 13:29:58.037820";"Facebook:/<post-id>/comments";"Pucela Resiste No les importáis, pero seguro que pondréis el brazo...";"2021-06-21T16:27:15+0000";"1";"";""
"1";"1381";"1";"3643723515727569_1144842509331191";"data";"data.*";"fetched (200)";"2021-08-04 13:29:58.037820";"Facebook:/<post-id>/comments";"Sandra Garcia ... Pues así haré yo. Si me la ponen perfecto, si no pues no será culpa mia";"2021-06-21T16:28:04+0000";"0";"";""
"1";"1382";"1";"3643723515727569_1181146189029826";"data";"data.*";"fetched (200)";"2021-08-04 13:29:58.037820";"Facebook:/<post-id>/comments";"Me tocará por fin a mi??";"2021-06-21T16:28:22+0000";"0";"";""
"1";"1383";"1";"3643723515727569_1181146309029814";"data";"data.*";"fetched (200)";"2021-08-04 13:29:58.037820";"Facebook:/<post-id>/comments";"Danut Sverenko Y los hay...muchos además...";"2021-06-21T16:28:37+0000";"0";"";""
"1";"1384";"1";"3643723515727569_1144842872664488";"data";"data.*";"fetched (200)";"2021-08-04 13:29:58.037820";"Facebook:/<post-id>/comments";"Escribano Peribañez Carmen Habla con el centro médico y diselo ,que estás más segura con pfizer y que te esperas.";"2021-06-21T16:28:55+0000";"1";"";""
"1";"1385";"1";"3643723515727569_1144842915997817";"data";"data.*";"fetched (200)";"2021-08-04 13:29:58.037820";"Facebook:/<post-id>/comments";"Jaime Piza Serra estas loco si crees ue de verdad hay una pandemia mundial jajaa";"2021-06-21T16:29:02+0000";"1";"";""
"1";"1386";"1";"3643723515727569_1144842942664481";"data";"data.*";"fetched (200)";"2021-08-04 13:29:58.037820";"Facebook:/<post-id>/comments";"Pucela Resiste si es cierto pero también transportistas por todos lados Esenciales y también están por franjas de edades. Y los conductores de autobuses igualmente.";"2021-06-21T16:29:06+0000";"5";"";""
"1";"1387";"1";"3643723515727569_1181146539029791";"data";"data.*";"fetched (200)";"2021-08-04 13:29:58.037820";"Facebook:/<post-id>/comments";"Maria Gutierrez si eso puede pasar pero lo curioso es q los vacunados también se están muriendo entonces cuál es la ventaja? donde está el beneficio? yo de momento no veo ninguno, y la info q cada día sale a la luz menos confianza me da, ojalá al final la solución sea buena para todos y no tengamos q dar la razón al otro por la perdida de más herman@s y si hay engaño q lo paguen cómo deben 🌟🌟🌟";"2021-06-21T16:29:06+0000";"0";"";""
"1";"1388";"1";"3643723515727569_1181147359029709";"data";"data.*";"fetched (200)";"2021-08-04 13:29:58.037820";"Facebook:/<post-id>/comments";"Yazmina Ojeda .. supongo que te darían algún corticoide por precaución? Espero que la reacción fuese leve!";"2021-06-21T16:30:48+0000";"0";"";""
"1";"1389";"1";"3643723515727569_1144843615997747";"data";"data.*";"fetched (200)";"2021-08-04 13:29:58.037820";"Facebook:/<post-id>/comments";"Llegarán millones , pero es una vergüenza de que no haya forma de coger cita , no por app de salud responde ,ni web ,ni tlf , valla mierda y grande .";"2021-06-21T16:30:53+0000";"0";"";""
"1";"1390";"1";"3643723515727569_1181148095696302";"data";"data.*";"fetched (200)";"2021-08-04 13:29:58.037820";"Facebook:/<post-id>/comments";"Disculpe… no quise molestar a un fan covid… ahí va… puede usted mismo entrar en la página oficial del Reino Unido y mirarlo…   https://www.facebook.com/100003666717237/posts/2365141443618056/?d=n";"2021-06-21T16:32:02+0000";"1";"";""
"1";"1391";"1";"3643723515727569_1181148565696255";"data";"data.*";"fetched (200)";"2021-08-04 13:29:58.037820";"Facebook:/<post-id>/comments";"Manu LG cuando ya la gente tenga el detalle de vacunarse y /o hallamos pasado la enfermedad muchos pues ya no habrá tantos contagios a la vez que hacen que se colapsen los hospitales porque al ser algo totalmente nuevo nada más que te expones a ello sin anticuerpos bien naturales o por vacuna te contagias en nada como sucedió el año pasado ,en un futuro próximo el cuerpo ya reconoce el virus y ya sabe cómo actuar pronto y no será tan grave la situación y por lo tanto llegará a ser como la gripe y se vacunarán sólo los que tengan más riesgo no creo que si no fuese una situación crítica por ser algo nuevo y que nuestro cuerpo no conocía nos hubiésemos vacunado masivamente ,para mí vacunarme no es un hobby lo hice porque me pareció que era lo que tengo que hacer y eso que para mi el Covid fue un catarro simplemente ,yo decidí escuchar a mis médicos de confianza y dejarme aconsejar por ellos ";"2021-06-21T16:32:58+0000";"0";"";""
"1";"1392";"1";"3643723515727569_1181148709029574";"data";"data.*";"fetched (200)";"2021-08-04 13:29:58.037820";"Facebook:/<post-id>/comments";"Escribano Peribañez Carmen si algo así, pero mi experiencia muy mala gracias a que me pusieron adrenalina, pero no todos los cuerpos son iguales aún así me pondré la segunda dosis.";"2021-06-21T16:33:19+0000";"0";"";""
"1";"1393";"1";"3643723515727569_1181149622362816";"data";"data.*";"fetched (200)";"2021-08-04 13:29:58.037820";"Facebook:/<post-id>/comments";"A mi llego la semana pasada SMS y he cogido rápido la vacuna y ayer me vacunaron del faizzer y estoy contenta. Si no has llamado tenéis que ir a vuestros ambulatorios y decir que os pasa que me quiero vacunar. Y os dan un teléfono para que llaméis. También el ambulatorio os llaman para SMS y si no recibís SMS igual no tienen vuestros teléfonos igual tienen el viejo.";"2021-06-21T16:35:32+0000";"0";"";""
"1";"1394";"1";"3643723515727569_1181149852362793";"data";"data.*";"fetched (200)";"2021-08-04 13:29:58.037820";"Facebook:/<post-id>/comments";"Mari Tere Garcia Garcia no me parece poco, evitar en un 70%, los ingresos en uci Lo que me parece fatal es el monopolio de marcas que nos Dan e la efectividad y la falta de conocimiento de efectos secundarios a largo plazo Irresponsable, como mínimo administrar un medicamento en fase experimental";"2021-06-21T16:35:58+0000";"1";"";""
"1";"1395";"1";"3643723515727569_1181150249029420";"data";"data.*";"fetched (200)";"2021-08-04 13:29:58.037820";"Facebook:/<post-id>/comments";"Sandra Garcia ... Ya lo hice, pero ni caso. Lo único que supieron decirme es que salir a la calle, también tiene un riesgo. Yo le contesté... Efectivamente es Así, pero yo no lo sé. Mientras que al ir a ponerme  esta vacuna ya voy condicionada. Y eso es muy distinto!!";"2021-06-21T16:36:43+0000";"0";"";""
"1";"1396";"1";"3643723515727569_1181150675696044";"data";"data.*";"fetched (200)";"2021-08-04 13:29:58.037820";"Facebook:/<post-id>/comments";"Juana Ortega Lopez en que comunidad autónoma? En Galicia te llaman ellos ....tienes que tener error mira eso .";"2021-06-21T16:37:41+0000";"0";"";""
"1";"1397";"1";"3643723515727569_1181150735696038";"data";"data.*";"fetched (200)";"2021-08-04 13:29:58.037820";"Facebook:/<post-id>/comments";"María José Aldrey Benito quieres un consejo no te pongas ninguna que antecedentes de coagulación y te dara trombos ";"2021-06-21T16:37:47+0000";"1";"";""
"1";"1398";"1";"3643723515727569_1181150962362682";"data";"data.*";"fetched (200)";"2021-08-04 13:29:58.037820";"Facebook:/<post-id>/comments";"🐑🐑🐑🐑🐑🐑🐑🐑🐑🐑🧠😒";"2021-06-21T16:38:27+0000";"1";"";""
"1";"1399";"1";"3643723515727569_1181151032362675";"data";"data.*";"fetched (200)";"2021-08-04 13:29:58.037820";"Facebook:/<post-id>/comments";"Propaganda Goebbels...iros a la mierda";"2021-06-21T16:38:33+0000";"0";"";""
"1";"1400";"1";"3643723515727569_1144849469330495";"data";"data.*";"fetched (200)";"2021-08-04 13:29:58.037820";"Facebook:/<post-id>/comments";"Escribano Peribañez Carmen Espérate y ves llamando y preguntando hasta que tengan la de pfizer. Es q esto es vacunar por vacunar y hay que darse cuenta que no son vacunas probadas y efectivas y q conllevan un riesgo";"2021-06-21T16:41:51+0000";"0";"";""
